{
  "address": "0xAD50B75ae062c9853725ed88eF1E220C0bC44753",
  "abi": [
    {
      "inputs": [],
      "stateMutability": "nonpayable",
      "type": "constructor"
    },
    {
      "inputs": [
        {
          "internalType": "uint256",
          "name": "actualAddAmount",
          "type": "uint256"
        }
      ],
      "name": "AddReservesFactorFreshCheck",
      "type": "error"
    },
    {
      "inputs": [],
      "name": "BorrowCashNotAvailable",
      "type": "error"
    },
    {
      "inputs": [
        {
          "internalType": "uint256",
          "name": "errorCode",
          "type": "uint256"
        }
      ],
      "name": "BorrowComptrollerRejection",
      "type": "error"
    },
    {
      "inputs": [],
      "name": "BorrowFreshnessCheck",
      "type": "error"
    },
    {
      "inputs": [],
      "name": "ForceLiquidateBorrowUnauthorized",
      "type": "error"
    },
    {
      "inputs": [],
      "name": "HealBorrowUnauthorized",
      "type": "error"
    },
    {
      "inputs": [
        {
          "internalType": "uint256",
          "name": "errorCode",
          "type": "uint256"
        }
      ],
      "name": "LiquidateAccrueBorrowInterestFailed",
      "type": "error"
    },
    {
      "inputs": [
        {
          "internalType": "uint256",
          "name": "errorCode",
          "type": "uint256"
        }
      ],
      "name": "LiquidateAccrueCollateralInterestFailed",
      "type": "error"
    },
    {
      "inputs": [],
      "name": "LiquidateCloseAmountIsUintMax",
      "type": "error"
    },
    {
      "inputs": [],
      "name": "LiquidateCloseAmountIsZero",
      "type": "error"
    },
    {
      "inputs": [],
      "name": "LiquidateCollateralFreshnessCheck",
      "type": "error"
    },
    {
      "inputs": [
        {
          "internalType": "uint256",
          "name": "errorCode",
          "type": "uint256"
        }
      ],
      "name": "LiquidateComptrollerRejection",
      "type": "error"
    },
    {
      "inputs": [],
      "name": "LiquidateFreshnessCheck",
      "type": "error"
    },
    {
      "inputs": [],
      "name": "LiquidateLiquidatorIsBorrower",
      "type": "error"
    },
    {
      "inputs": [
        {
          "internalType": "uint256",
          "name": "errorCode",
          "type": "uint256"
        }
      ],
      "name": "LiquidateRepayBorrowFreshFailed",
      "type": "error"
    },
    {
      "inputs": [
        {
          "internalType": "uint256",
          "name": "errorCode",
          "type": "uint256"
        }
      ],
      "name": "LiquidateSeizeComptrollerRejection",
      "type": "error"
    },
    {
      "inputs": [],
      "name": "LiquidateSeizeLiquidatorIsBorrower",
      "type": "error"
    },
    {
      "inputs": [
        {
          "internalType": "uint256",
          "name": "errorCode",
          "type": "uint256"
        }
      ],
      "name": "MintComptrollerRejection",
      "type": "error"
    },
    {
      "inputs": [],
      "name": "MintFreshnessCheck",
      "type": "error"
    },
    {
      "inputs": [],
      "name": "ProtocolSeizeShareTooBig",
      "type": "error"
    },
    {
      "inputs": [
        {
          "internalType": "uint256",
          "name": "errorCode",
          "type": "uint256"
        }
      ],
      "name": "RedeemComptrollerRejection",
      "type": "error"
    },
    {
      "inputs": [],
      "name": "RedeemFreshnessCheck",
      "type": "error"
    },
    {
      "inputs": [],
      "name": "RedeemTransferOutNotPossible",
      "type": "error"
    },
    {
      "inputs": [],
      "name": "ReduceReservesAdminCheck",
      "type": "error"
    },
    {
      "inputs": [],
      "name": "ReduceReservesCashNotAvailable",
      "type": "error"
    },
    {
      "inputs": [],
      "name": "ReduceReservesCashValidation",
      "type": "error"
    },
    {
      "inputs": [],
      "name": "ReduceReservesFreshCheck",
      "type": "error"
    },
    {
      "inputs": [
        {
          "internalType": "uint256",
          "name": "errorCode",
          "type": "uint256"
        }
      ],
      "name": "RepayBorrowComptrollerRejection",
      "type": "error"
    },
    {
      "inputs": [],
      "name": "RepayBorrowFreshnessCheck",
      "type": "error"
    },
    {
      "inputs": [],
      "name": "SetComptrollerOwnerCheck",
      "type": "error"
    },
    {
      "inputs": [],
      "name": "SetInterestRateModelFreshCheck",
      "type": "error"
    },
    {
      "inputs": [],
      "name": "SetInterestRateModelOwnerCheck",
      "type": "error"
    },
    {
      "inputs": [],
      "name": "SetProtocolSeizeShareUnauthorized",
      "type": "error"
    },
    {
      "inputs": [],
      "name": "SetReserveFactorAdminCheck",
      "type": "error"
    },
    {
      "inputs": [],
      "name": "SetReserveFactorBoundsCheck",
      "type": "error"
    },
    {
      "inputs": [],
      "name": "SetReserveFactorFreshCheck",
      "type": "error"
    },
    {
      "inputs": [
        {
          "internalType": "uint256",
          "name": "errorCode",
          "type": "uint256"
        }
      ],
      "name": "TransferComptrollerRejection",
      "type": "error"
    },
    {
      "inputs": [],
      "name": "TransferNotAllowed",
      "type": "error"
    },
    {
      "inputs": [],
      "name": "TransferNotEnough",
      "type": "error"
    },
    {
      "inputs": [],
      "name": "TransferTooMuch",
      "type": "error"
    },
    {
      "anonymous": false,
      "inputs": [
        {
          "indexed": false,
          "internalType": "uint256",
          "name": "cashPrior",
          "type": "uint256"
        },
        {
          "indexed": false,
          "internalType": "uint256",
          "name": "interestAccumulated",
          "type": "uint256"
        },
        {
          "indexed": false,
          "internalType": "uint256",
          "name": "borrowIndex",
          "type": "uint256"
        },
        {
          "indexed": false,
          "internalType": "uint256",
          "name": "totalBorrows",
          "type": "uint256"
        }
      ],
      "name": "AccrueInterest",
      "type": "event"
    },
    {
      "anonymous": false,
      "inputs": [
        {
          "indexed": true,
          "internalType": "address",
          "name": "owner",
          "type": "address"
        },
        {
          "indexed": true,
          "internalType": "address",
          "name": "spender",
          "type": "address"
        },
        {
          "indexed": false,
          "internalType": "uint256",
          "name": "amount",
          "type": "uint256"
        }
      ],
      "name": "Approval",
      "type": "event"
    },
    {
      "anonymous": false,
      "inputs": [
        {
          "indexed": false,
          "internalType": "address",
          "name": "borrower",
          "type": "address"
        },
        {
          "indexed": false,
          "internalType": "uint256",
          "name": "badDebtDelta",
          "type": "uint256"
        },
        {
          "indexed": false,
          "internalType": "uint256",
          "name": "badDebtOld",
          "type": "uint256"
        },
        {
          "indexed": false,
          "internalType": "uint256",
          "name": "badDebtNew",
          "type": "uint256"
        }
      ],
      "name": "BadDebtIncreased",
      "type": "event"
    },
    {
      "anonymous": false,
      "inputs": [
        {
          "indexed": false,
          "internalType": "uint256",
          "name": "badDebtOld",
          "type": "uint256"
        },
        {
          "indexed": false,
          "internalType": "uint256",
          "name": "badDebtNew",
          "type": "uint256"
        }
      ],
      "name": "BadDebtRecovered",
      "type": "event"
    },
    {
      "anonymous": false,
      "inputs": [
        {
          "indexed": false,
          "internalType": "address",
          "name": "borrower",
          "type": "address"
        },
        {
          "indexed": false,
          "internalType": "uint256",
          "name": "borrowAmount",
          "type": "uint256"
        },
        {
          "indexed": false,
          "internalType": "uint256",
          "name": "accountBorrows",
          "type": "uint256"
        },
        {
          "indexed": false,
          "internalType": "uint256",
          "name": "totalBorrows",
          "type": "uint256"
        }
      ],
      "name": "Borrow",
      "type": "event"
    },
    {
      "anonymous": false,
      "inputs": [
        {
          "indexed": false,
          "internalType": "uint8",
          "name": "version",
          "type": "uint8"
        }
      ],
      "name": "Initialized",
      "type": "event"
    },
    {
      "anonymous": false,
      "inputs": [
        {
          "indexed": false,
          "internalType": "address",
          "name": "liquidator",
          "type": "address"
        },
        {
          "indexed": false,
          "internalType": "address",
          "name": "borrower",
          "type": "address"
        },
        {
          "indexed": false,
          "internalType": "uint256",
          "name": "repayAmount",
          "type": "uint256"
        },
        {
          "indexed": false,
          "internalType": "address",
          "name": "vTokenCollateral",
          "type": "address"
        },
        {
          "indexed": false,
          "internalType": "uint256",
          "name": "seizeTokens",
          "type": "uint256"
        }
      ],
      "name": "LiquidateBorrow",
      "type": "event"
    },
    {
      "anonymous": false,
      "inputs": [
        {
          "indexed": false,
          "internalType": "address",
          "name": "minter",
          "type": "address"
        },
        {
          "indexed": false,
          "internalType": "uint256",
          "name": "mintAmount",
          "type": "uint256"
        },
        {
          "indexed": false,
          "internalType": "uint256",
          "name": "mintTokens",
          "type": "uint256"
        }
      ],
      "name": "Mint",
      "type": "event"
    },
    {
      "anonymous": false,
      "inputs": [
        {
          "indexed": false,
          "internalType": "contract AccessControlManager",
          "name": "oldAccessControlManager",
          "type": "address"
        },
        {
          "indexed": false,
          "internalType": "contract AccessControlManager",
          "name": "newAccessControlManager",
          "type": "address"
        }
      ],
      "name": "NewAccessControlManager",
      "type": "event"
    },
    {
      "anonymous": false,
      "inputs": [
        {
          "indexed": false,
          "internalType": "contract ComptrollerInterface",
          "name": "oldComptroller",
          "type": "address"
        },
        {
          "indexed": false,
          "internalType": "contract ComptrollerInterface",
          "name": "newComptroller",
          "type": "address"
        }
      ],
      "name": "NewComptroller",
      "type": "event"
    },
    {
      "anonymous": false,
      "inputs": [
        {
          "indexed": false,
          "internalType": "contract InterestRateModel",
          "name": "oldInterestRateModel",
          "type": "address"
        },
        {
          "indexed": false,
          "internalType": "contract InterestRateModel",
          "name": "newInterestRateModel",
          "type": "address"
        }
      ],
      "name": "NewMarketInterestRateModel",
      "type": "event"
    },
    {
      "anonymous": false,
      "inputs": [
        {
          "indexed": false,
          "internalType": "uint256",
          "name": "oldProtocolSeizeShareMantissa",
          "type": "uint256"
        },
        {
          "indexed": false,
          "internalType": "uint256",
          "name": "newProtocolSeizeShareMantissa",
          "type": "uint256"
        }
      ],
      "name": "NewProtocolSeizeShare",
      "type": "event"
    },
    {
      "anonymous": false,
      "inputs": [
        {
          "indexed": false,
          "internalType": "uint256",
          "name": "oldReserveFactorMantissa",
          "type": "uint256"
        },
        {
          "indexed": false,
          "internalType": "uint256",
          "name": "newReserveFactorMantissa",
          "type": "uint256"
        }
      ],
      "name": "NewReserveFactor",
      "type": "event"
    },
    {
      "anonymous": false,
      "inputs": [
        {
          "indexed": true,
          "internalType": "address",
          "name": "previousOwner",
          "type": "address"
        },
        {
          "indexed": true,
          "internalType": "address",
          "name": "newOwner",
          "type": "address"
        }
      ],
      "name": "OwnershipTransferStarted",
      "type": "event"
    },
    {
      "anonymous": false,
      "inputs": [
        {
          "indexed": true,
          "internalType": "address",
          "name": "previousOwner",
          "type": "address"
        },
        {
          "indexed": true,
          "internalType": "address",
          "name": "newOwner",
          "type": "address"
        }
      ],
      "name": "OwnershipTransferred",
      "type": "event"
    },
    {
      "anonymous": false,
      "inputs": [
        {
          "indexed": false,
          "internalType": "address",
          "name": "redeemer",
          "type": "address"
        },
        {
          "indexed": false,
          "internalType": "uint256",
          "name": "redeemAmount",
          "type": "uint256"
        },
        {
          "indexed": false,
          "internalType": "uint256",
          "name": "redeemTokens",
          "type": "uint256"
        }
      ],
      "name": "Redeem",
      "type": "event"
    },
    {
      "anonymous": false,
      "inputs": [
        {
          "indexed": false,
          "internalType": "address",
          "name": "payer",
          "type": "address"
        },
        {
          "indexed": false,
          "internalType": "address",
          "name": "borrower",
          "type": "address"
        },
        {
          "indexed": false,
          "internalType": "uint256",
          "name": "repayAmount",
          "type": "uint256"
        },
        {
          "indexed": false,
          "internalType": "uint256",
          "name": "accountBorrows",
          "type": "uint256"
        },
        {
          "indexed": false,
          "internalType": "uint256",
          "name": "totalBorrows",
          "type": "uint256"
        }
      ],
      "name": "RepayBorrow",
      "type": "event"
    },
    {
      "anonymous": false,
      "inputs": [
        {
          "indexed": false,
          "internalType": "address",
          "name": "benefactor",
          "type": "address"
        },
        {
          "indexed": false,
          "internalType": "uint256",
          "name": "addAmount",
          "type": "uint256"
        },
        {
          "indexed": false,
          "internalType": "uint256",
          "name": "newTotalReserves",
          "type": "uint256"
        }
      ],
      "name": "ReservesAdded",
      "type": "event"
    },
    {
      "anonymous": false,
      "inputs": [
        {
          "indexed": false,
          "internalType": "address",
          "name": "admin",
          "type": "address"
        },
        {
          "indexed": false,
          "internalType": "uint256",
          "name": "reduceAmount",
          "type": "uint256"
        },
        {
          "indexed": false,
          "internalType": "uint256",
          "name": "newTotalReserves",
          "type": "uint256"
        }
      ],
      "name": "ReservesReduced",
      "type": "event"
    },
    {
      "anonymous": false,
      "inputs": [
        {
          "indexed": true,
          "internalType": "address",
          "name": "from",
          "type": "address"
        },
        {
          "indexed": true,
          "internalType": "address",
          "name": "to",
          "type": "address"
        },
        {
          "indexed": false,
          "internalType": "uint256",
          "name": "amount",
          "type": "uint256"
        }
      ],
      "name": "Transfer",
      "type": "event"
    },
    {
      "inputs": [],
      "name": "NO_ERROR",
      "outputs": [
        {
          "internalType": "uint256",
          "name": "",
          "type": "uint256"
        }
      ],
      "stateMutability": "view",
      "type": "function"
    },
    {
      "inputs": [],
      "name": "acceptOwnership",
      "outputs": [],
      "stateMutability": "nonpayable",
      "type": "function"
    },
    {
      "inputs": [],
      "name": "accessControlManager",
      "outputs": [
        {
          "internalType": "contract AccessControlManager",
          "name": "",
          "type": "address"
        }
      ],
      "stateMutability": "view",
      "type": "function"
    },
    {
      "inputs": [],
      "name": "accrualBlockNumber",
      "outputs": [
        {
          "internalType": "uint256",
          "name": "",
          "type": "uint256"
        }
      ],
      "stateMutability": "view",
      "type": "function"
    },
    {
      "inputs": [],
      "name": "accrueInterest",
      "outputs": [
        {
          "internalType": "uint256",
          "name": "",
          "type": "uint256"
        }
      ],
      "stateMutability": "nonpayable",
      "type": "function"
    },
    {
      "inputs": [
        {
          "internalType": "uint256",
          "name": "addAmount",
          "type": "uint256"
        }
      ],
      "name": "addReserves",
      "outputs": [],
      "stateMutability": "nonpayable",
      "type": "function"
    },
    {
      "inputs": [
        {
          "internalType": "address",
          "name": "owner",
          "type": "address"
        },
        {
          "internalType": "address",
          "name": "spender",
          "type": "address"
        }
      ],
      "name": "allowance",
      "outputs": [
        {
          "internalType": "uint256",
          "name": "",
          "type": "uint256"
        }
      ],
      "stateMutability": "view",
      "type": "function"
    },
    {
      "inputs": [
        {
          "internalType": "address",
          "name": "spender",
          "type": "address"
        },
        {
          "internalType": "uint256",
          "name": "amount",
          "type": "uint256"
        }
      ],
      "name": "approve",
      "outputs": [
        {
          "internalType": "bool",
          "name": "",
          "type": "bool"
        }
      ],
      "stateMutability": "nonpayable",
      "type": "function"
    },
    {
      "inputs": [],
      "name": "badDebt",
      "outputs": [
        {
          "internalType": "uint256",
          "name": "",
          "type": "uint256"
        }
      ],
      "stateMutability": "view",
      "type": "function"
    },
    {
      "inputs": [
        {
          "internalType": "uint256",
          "name": "recoveredAmount_",
          "type": "uint256"
        }
      ],
      "name": "badDebtRecovered",
      "outputs": [],
      "stateMutability": "nonpayable",
      "type": "function"
    },
    {
      "inputs": [
        {
          "internalType": "address",
          "name": "owner",
          "type": "address"
        }
      ],
      "name": "balanceOf",
      "outputs": [
        {
          "internalType": "uint256",
          "name": "",
          "type": "uint256"
        }
      ],
      "stateMutability": "view",
      "type": "function"
    },
    {
      "inputs": [
        {
          "internalType": "address",
          "name": "owner",
          "type": "address"
        }
      ],
      "name": "balanceOfUnderlying",
      "outputs": [
        {
          "internalType": "uint256",
          "name": "",
          "type": "uint256"
        }
      ],
      "stateMutability": "nonpayable",
      "type": "function"
    },
    {
      "inputs": [
        {
          "internalType": "uint256",
          "name": "borrowAmount",
          "type": "uint256"
        }
      ],
      "name": "borrow",
      "outputs": [
        {
          "internalType": "uint256",
          "name": "",
          "type": "uint256"
        }
      ],
      "stateMutability": "nonpayable",
      "type": "function"
    },
    {
      "inputs": [
        {
          "internalType": "address",
          "name": "account",
          "type": "address"
        }
      ],
      "name": "borrowBalanceCurrent",
      "outputs": [
        {
          "internalType": "uint256",
          "name": "",
          "type": "uint256"
        }
      ],
      "stateMutability": "nonpayable",
      "type": "function"
    },
    {
      "inputs": [
        {
          "internalType": "address",
          "name": "account",
          "type": "address"
        }
      ],
      "name": "borrowBalanceStored",
      "outputs": [
        {
          "internalType": "uint256",
          "name": "",
          "type": "uint256"
        }
      ],
      "stateMutability": "view",
      "type": "function"
    },
    {
      "inputs": [],
      "name": "borrowIndex",
      "outputs": [
        {
          "internalType": "uint256",
          "name": "",
          "type": "uint256"
        }
      ],
      "stateMutability": "view",
      "type": "function"
    },
    {
      "inputs": [],
      "name": "borrowRatePerBlock",
      "outputs": [
        {
          "internalType": "uint256",
          "name": "",
          "type": "uint256"
        }
      ],
      "stateMutability": "view",
      "type": "function"
    },
    {
      "inputs": [],
      "name": "comptroller",
      "outputs": [
        {
          "internalType": "contract ComptrollerInterface",
          "name": "",
          "type": "address"
        }
      ],
      "stateMutability": "view",
      "type": "function"
    },
    {
      "inputs": [],
      "name": "decimals",
      "outputs": [
        {
          "internalType": "uint8",
          "name": "",
          "type": "uint8"
        }
      ],
      "stateMutability": "view",
      "type": "function"
    },
    {
      "inputs": [],
      "name": "exchangeRateCurrent",
      "outputs": [
        {
          "internalType": "uint256",
          "name": "",
          "type": "uint256"
        }
      ],
      "stateMutability": "nonpayable",
      "type": "function"
    },
    {
      "inputs": [],
      "name": "exchangeRateStored",
      "outputs": [
        {
          "internalType": "uint256",
          "name": "",
          "type": "uint256"
        }
      ],
      "stateMutability": "view",
      "type": "function"
    },
    {
      "inputs": [
        {
          "internalType": "address",
          "name": "liquidator",
          "type": "address"
        },
        {
          "internalType": "address",
          "name": "borrower",
          "type": "address"
        },
        {
          "internalType": "uint256",
          "name": "repayAmount",
          "type": "uint256"
        },
        {
          "internalType": "contract VTokenInterface",
          "name": "vTokenCollateral",
          "type": "address"
        },
        {
          "internalType": "bool",
          "name": "skipLiquidityCheck",
          "type": "bool"
        }
      ],
      "name": "forceLiquidateBorrow",
      "outputs": [],
      "stateMutability": "nonpayable",
      "type": "function"
    },
    {
      "inputs": [
        {
          "internalType": "address",
          "name": "account",
          "type": "address"
        }
      ],
      "name": "getAccountSnapshot",
      "outputs": [
        {
          "internalType": "uint256",
          "name": "error",
          "type": "uint256"
        },
        {
          "internalType": "uint256",
          "name": "vTokenBalance",
          "type": "uint256"
        },
        {
          "internalType": "uint256",
          "name": "borrowBalance",
          "type": "uint256"
        },
        {
          "internalType": "uint256",
          "name": "exchangeRate",
          "type": "uint256"
        }
      ],
      "stateMutability": "view",
      "type": "function"
    },
    {
      "inputs": [],
      "name": "getCash",
      "outputs": [
        {
          "internalType": "uint256",
          "name": "",
          "type": "uint256"
        }
      ],
      "stateMutability": "view",
      "type": "function"
    },
    {
      "inputs": [
        {
          "internalType": "address",
          "name": "payer",
          "type": "address"
        },
        {
          "internalType": "address",
          "name": "borrower",
          "type": "address"
        },
        {
          "internalType": "uint256",
          "name": "repayAmount",
          "type": "uint256"
        }
      ],
      "name": "healBorrow",
      "outputs": [],
      "stateMutability": "nonpayable",
      "type": "function"
    },
    {
      "inputs": [
        {
          "internalType": "address",
          "name": "underlying_",
          "type": "address"
        },
        {
          "internalType": "contract ComptrollerInterface",
          "name": "comptroller_",
          "type": "address"
        },
        {
          "internalType": "contract InterestRateModel",
          "name": "interestRateModel_",
          "type": "address"
        },
        {
          "internalType": "uint256",
          "name": "initialExchangeRateMantissa_",
          "type": "uint256"
        },
        {
          "internalType": "string",
          "name": "name_",
          "type": "string"
        },
        {
          "internalType": "string",
          "name": "symbol_",
          "type": "string"
        },
        {
          "internalType": "uint8",
          "name": "decimals_",
          "type": "uint8"
        },
        {
          "internalType": "address payable",
          "name": "admin_",
          "type": "address"
        },
        {
          "internalType": "contract AccessControlManager",
          "name": "accessControlManager_",
          "type": "address"
        },
        {
          "components": [
            {
              "internalType": "address",
              "name": "shortfall",
              "type": "address"
            },
            {
              "internalType": "address payable",
              "name": "riskFund",
              "type": "address"
            },
            {
              "internalType": "address payable",
              "name": "protocolShareReserve",
              "type": "address"
            }
          ],
          "internalType": "struct VTokenInterface.RiskManagementInit",
          "name": "riskManagement",
          "type": "tuple"
        }
      ],
      "name": "initialize",
      "outputs": [],
      "stateMutability": "nonpayable",
      "type": "function"
    },
    {
      "inputs": [],
      "name": "interestRateModel",
      "outputs": [
        {
          "internalType": "contract InterestRateModel",
          "name": "",
          "type": "address"
        }
      ],
      "stateMutability": "view",
      "type": "function"
    },
    {
      "inputs": [],
      "name": "isVToken",
      "outputs": [
        {
          "internalType": "bool",
          "name": "",
          "type": "bool"
        }
      ],
      "stateMutability": "view",
      "type": "function"
    },
    {
      "inputs": [
        {
          "internalType": "address",
          "name": "borrower",
          "type": "address"
        },
        {
          "internalType": "uint256",
          "name": "repayAmount",
          "type": "uint256"
        },
        {
          "internalType": "contract VTokenInterface",
          "name": "vTokenCollateral",
          "type": "address"
        }
      ],
      "name": "liquidateBorrow",
      "outputs": [
        {
          "internalType": "uint256",
          "name": "",
          "type": "uint256"
        }
      ],
      "stateMutability": "nonpayable",
      "type": "function"
    },
    {
      "inputs": [
        {
          "internalType": "uint256",
          "name": "mintAmount",
          "type": "uint256"
        }
      ],
      "name": "mint",
      "outputs": [
        {
          "internalType": "uint256",
          "name": "",
          "type": "uint256"
        }
      ],
      "stateMutability": "nonpayable",
      "type": "function"
    },
    {
      "inputs": [
        {
          "internalType": "address",
          "name": "minter",
          "type": "address"
        },
        {
          "internalType": "uint256",
          "name": "mintAmount",
          "type": "uint256"
        }
      ],
      "name": "mintBehalf",
      "outputs": [
        {
          "internalType": "uint256",
          "name": "",
          "type": "uint256"
        }
      ],
      "stateMutability": "nonpayable",
      "type": "function"
    },
    {
      "inputs": [],
      "name": "name",
      "outputs": [
        {
          "internalType": "string",
          "name": "",
          "type": "string"
        }
      ],
      "stateMutability": "view",
      "type": "function"
    },
    {
      "inputs": [],
      "name": "owner",
      "outputs": [
        {
          "internalType": "address",
          "name": "",
          "type": "address"
        }
      ],
      "stateMutability": "view",
      "type": "function"
    },
    {
      "inputs": [],
      "name": "pendingOwner",
      "outputs": [
        {
          "internalType": "address",
          "name": "",
          "type": "address"
        }
      ],
      "stateMutability": "view",
      "type": "function"
    },
    {
      "inputs": [],
      "name": "protocolSeizeShareMantissa",
      "outputs": [
        {
          "internalType": "uint256",
          "name": "",
          "type": "uint256"
        }
      ],
      "stateMutability": "view",
      "type": "function"
    },
    {
      "inputs": [
        {
          "internalType": "uint256",
          "name": "redeemTokens",
          "type": "uint256"
        }
      ],
      "name": "redeem",
      "outputs": [
        {
          "internalType": "uint256",
          "name": "",
          "type": "uint256"
        }
      ],
      "stateMutability": "nonpayable",
      "type": "function"
    },
    {
      "inputs": [
        {
          "internalType": "uint256",
          "name": "redeemAmount",
          "type": "uint256"
        }
      ],
      "name": "redeemUnderlying",
      "outputs": [
        {
          "internalType": "uint256",
          "name": "",
          "type": "uint256"
        }
      ],
      "stateMutability": "nonpayable",
      "type": "function"
    },
    {
      "inputs": [
        {
          "internalType": "uint256",
          "name": "reduceAmount",
          "type": "uint256"
        }
      ],
      "name": "reduceReserves",
      "outputs": [],
      "stateMutability": "nonpayable",
      "type": "function"
    },
    {
      "inputs": [],
      "name": "renounceOwnership",
      "outputs": [],
      "stateMutability": "nonpayable",
      "type": "function"
    },
    {
      "inputs": [
        {
          "internalType": "uint256",
          "name": "repayAmount",
          "type": "uint256"
        }
      ],
      "name": "repayBorrow",
      "outputs": [
        {
          "internalType": "uint256",
          "name": "",
          "type": "uint256"
        }
      ],
      "stateMutability": "nonpayable",
      "type": "function"
    },
    {
      "inputs": [
        {
          "internalType": "address",
          "name": "borrower",
          "type": "address"
        },
        {
          "internalType": "uint256",
          "name": "repayAmount",
          "type": "uint256"
        }
      ],
      "name": "repayBorrowBehalf",
      "outputs": [
        {
          "internalType": "uint256",
          "name": "",
          "type": "uint256"
        }
      ],
      "stateMutability": "nonpayable",
      "type": "function"
    },
    {
      "inputs": [],
      "name": "reserveFactorMantissa",
      "outputs": [
        {
          "internalType": "uint256",
          "name": "",
          "type": "uint256"
        }
      ],
      "stateMutability": "view",
      "type": "function"
    },
    {
      "inputs": [
        {
          "internalType": "address",
          "name": "liquidator",
          "type": "address"
        },
        {
          "internalType": "address",
          "name": "borrower",
          "type": "address"
        },
        {
          "internalType": "uint256",
          "name": "seizeTokens",
          "type": "uint256"
        }
      ],
      "name": "seize",
      "outputs": [],
      "stateMutability": "nonpayable",
      "type": "function"
    },
    {
      "inputs": [
        {
          "internalType": "contract AccessControlManager",
          "name": "newAccessControlManager",
          "type": "address"
        }
      ],
      "name": "setAccessControlAddress",
      "outputs": [],
      "stateMutability": "nonpayable",
      "type": "function"
    },
    {
      "inputs": [
        {
          "internalType": "contract ComptrollerInterface",
          "name": "newComptroller",
          "type": "address"
        }
      ],
      "name": "setComptroller",
      "outputs": [],
      "stateMutability": "nonpayable",
      "type": "function"
    },
    {
      "inputs": [
        {
          "internalType": "contract InterestRateModel",
          "name": "newInterestRateModel",
          "type": "address"
        }
      ],
      "name": "setInterestRateModel",
      "outputs": [],
      "stateMutability": "nonpayable",
      "type": "function"
    },
    {
      "inputs": [
        {
          "internalType": "uint256",
          "name": "newProtocolSeizeShareMantissa_",
          "type": "uint256"
        }
      ],
      "name": "setProtocolSeizeShare",
      "outputs": [],
      "stateMutability": "nonpayable",
      "type": "function"
    },
    {
      "inputs": [
        {
          "internalType": "uint256",
          "name": "newReserveFactorMantissa",
          "type": "uint256"
        }
      ],
      "name": "setReserveFactor",
      "outputs": [],
      "stateMutability": "nonpayable",
      "type": "function"
    },
    {
      "inputs": [],
      "name": "shortfall",
      "outputs": [
        {
          "internalType": "address",
          "name": "",
          "type": "address"
        }
      ],
      "stateMutability": "view",
      "type": "function"
    },
    {
      "inputs": [],
      "name": "supplyRatePerBlock",
      "outputs": [
        {
          "internalType": "uint256",
          "name": "",
          "type": "uint256"
        }
      ],
      "stateMutability": "view",
      "type": "function"
    },
    {
      "inputs": [
        {
          "internalType": "contract IERC20Upgradeable",
          "name": "token",
          "type": "address"
        }
      ],
      "name": "sweepToken",
      "outputs": [],
      "stateMutability": "nonpayable",
      "type": "function"
    },
    {
      "inputs": [],
      "name": "symbol",
      "outputs": [
        {
          "internalType": "string",
          "name": "",
          "type": "string"
        }
      ],
      "stateMutability": "view",
      "type": "function"
    },
    {
      "inputs": [],
      "name": "totalBorrows",
      "outputs": [
        {
          "internalType": "uint256",
          "name": "",
          "type": "uint256"
        }
      ],
      "stateMutability": "view",
      "type": "function"
    },
    {
      "inputs": [],
      "name": "totalBorrowsCurrent",
      "outputs": [
        {
          "internalType": "uint256",
          "name": "",
          "type": "uint256"
        }
      ],
      "stateMutability": "nonpayable",
      "type": "function"
    },
    {
      "inputs": [],
      "name": "totalReserves",
      "outputs": [
        {
          "internalType": "uint256",
          "name": "",
          "type": "uint256"
        }
      ],
      "stateMutability": "view",
      "type": "function"
    },
    {
      "inputs": [],
      "name": "totalSupply",
      "outputs": [
        {
          "internalType": "uint256",
          "name": "",
          "type": "uint256"
        }
      ],
      "stateMutability": "view",
      "type": "function"
    },
    {
      "inputs": [
        {
          "internalType": "address",
          "name": "dst",
          "type": "address"
        },
        {
          "internalType": "uint256",
          "name": "amount",
          "type": "uint256"
        }
      ],
      "name": "transfer",
      "outputs": [
        {
          "internalType": "bool",
          "name": "",
          "type": "bool"
        }
      ],
      "stateMutability": "nonpayable",
      "type": "function"
    },
    {
      "inputs": [
        {
          "internalType": "address",
          "name": "src",
          "type": "address"
        },
        {
          "internalType": "address",
          "name": "dst",
          "type": "address"
        },
        {
          "internalType": "uint256",
          "name": "amount",
          "type": "uint256"
        }
      ],
      "name": "transferFrom",
      "outputs": [
        {
          "internalType": "bool",
          "name": "",
          "type": "bool"
        }
      ],
      "stateMutability": "nonpayable",
      "type": "function"
    },
    {
      "inputs": [
        {
          "internalType": "address",
          "name": "newOwner",
          "type": "address"
        }
      ],
      "name": "transferOwnership",
      "outputs": [],
      "stateMutability": "nonpayable",
      "type": "function"
    },
    {
      "inputs": [],
      "name": "underlying",
      "outputs": [
        {
          "internalType": "address",
          "name": "",
          "type": "address"
        }
      ],
      "stateMutability": "view",
      "type": "function"
    }
  ],
  "transactionHash": "0x85a20cf8936ab0b8ceb50c13e2cf1a52571daa402bca357d94b3001aa91d9672",
  "receipt": {
    "to": null,
    "from": "0x8BDA9f9E1fEF0DFd404Fef338D9fE4c543d172e1",
    "contractAddress": "0xAD50B75ae062c9853725ed88eF1E220C0bC44753",
    "transactionIndex": 0,
    "gasUsed": "3755835",
    "logsBloom": "0x00000000000000000000000000000000000000000000000000000000002000000000000000000000000000000000000000000000000000000000000000000000000000000000000000000000000000000000000000000000000000000000000000000000400000000000000000000000000000000000000000000000000000000000000000000000000000000000000000000000000080000000000000000000000000000000000000000000000400000000000000000000000000000000000000000000000000000000000000040000000000000000000000000000000000000000000200000000000000000000000000000000000000000000000000000000",
    "blockHash": "0xfdece3acd04487b4bf4a601118eebb4733317f69b5b0541fe8f904cbc467dc2c",
    "transactionHash": "0x85a20cf8936ab0b8ceb50c13e2cf1a52571daa402bca357d94b3001aa91d9672",
    "logs": [
      {
        "transactionIndex": 0,
        "blockNumber": 26439082,
        "transactionHash": "0x85a20cf8936ab0b8ceb50c13e2cf1a52571daa402bca357d94b3001aa91d9672",
        "address": "0xAD50B75ae062c9853725ed88eF1E220C0bC44753",
        "topics": [
          "0x7f26b83ff96e1f2b6a682f133852f6798a09c465da95921460cefb3847402498"
        ],
        "data": "0x00000000000000000000000000000000000000000000000000000000000000ff",
        "logIndex": 0,
        "blockHash": "0xfdece3acd04487b4bf4a601118eebb4733317f69b5b0541fe8f904cbc467dc2c"
      }
    ],
    "blockNumber": 26439082,
    "cumulativeGasUsed": "3755835",
    "status": 1,
    "byzantium": true
  },
  "args": [],
  "numDeployments": 1,
  "solcInputHash": "39eb8f31da9b4d9c16abde8f5ab5340d",
  "metadata": "{\"compiler\":{\"version\":\"0.8.13+commit.abaa5c0e\"},\"language\":\"Solidity\",\"output\":{\"abi\":[{\"inputs\":[],\"stateMutability\":\"nonpayable\",\"type\":\"constructor\"},{\"inputs\":[{\"internalType\":\"uint256\",\"name\":\"actualAddAmount\",\"type\":\"uint256\"}],\"name\":\"AddReservesFactorFreshCheck\",\"type\":\"error\"},{\"inputs\":[],\"name\":\"BorrowCashNotAvailable\",\"type\":\"error\"},{\"inputs\":[{\"internalType\":\"uint256\",\"name\":\"errorCode\",\"type\":\"uint256\"}],\"name\":\"BorrowComptrollerRejection\",\"type\":\"error\"},{\"inputs\":[],\"name\":\"BorrowFreshnessCheck\",\"type\":\"error\"},{\"inputs\":[],\"name\":\"ForceLiquidateBorrowUnauthorized\",\"type\":\"error\"},{\"inputs\":[],\"name\":\"HealBorrowUnauthorized\",\"type\":\"error\"},{\"inputs\":[{\"internalType\":\"uint256\",\"name\":\"errorCode\",\"type\":\"uint256\"}],\"name\":\"LiquidateAccrueBorrowInterestFailed\",\"type\":\"error\"},{\"inputs\":[{\"internalType\":\"uint256\",\"name\":\"errorCode\",\"type\":\"uint256\"}],\"name\":\"LiquidateAccrueCollateralInterestFailed\",\"type\":\"error\"},{\"inputs\":[],\"name\":\"LiquidateCloseAmountIsUintMax\",\"type\":\"error\"},{\"inputs\":[],\"name\":\"LiquidateCloseAmountIsZero\",\"type\":\"error\"},{\"inputs\":[],\"name\":\"LiquidateCollateralFreshnessCheck\",\"type\":\"error\"},{\"inputs\":[{\"internalType\":\"uint256\",\"name\":\"errorCode\",\"type\":\"uint256\"}],\"name\":\"LiquidateComptrollerRejection\",\"type\":\"error\"},{\"inputs\":[],\"name\":\"LiquidateFreshnessCheck\",\"type\":\"error\"},{\"inputs\":[],\"name\":\"LiquidateLiquidatorIsBorrower\",\"type\":\"error\"},{\"inputs\":[{\"internalType\":\"uint256\",\"name\":\"errorCode\",\"type\":\"uint256\"}],\"name\":\"LiquidateRepayBorrowFreshFailed\",\"type\":\"error\"},{\"inputs\":[{\"internalType\":\"uint256\",\"name\":\"errorCode\",\"type\":\"uint256\"}],\"name\":\"LiquidateSeizeComptrollerRejection\",\"type\":\"error\"},{\"inputs\":[],\"name\":\"LiquidateSeizeLiquidatorIsBorrower\",\"type\":\"error\"},{\"inputs\":[{\"internalType\":\"uint256\",\"name\":\"errorCode\",\"type\":\"uint256\"}],\"name\":\"MintComptrollerRejection\",\"type\":\"error\"},{\"inputs\":[],\"name\":\"MintFreshnessCheck\",\"type\":\"error\"},{\"inputs\":[],\"name\":\"ProtocolSeizeShareTooBig\",\"type\":\"error\"},{\"inputs\":[{\"internalType\":\"uint256\",\"name\":\"errorCode\",\"type\":\"uint256\"}],\"name\":\"RedeemComptrollerRejection\",\"type\":\"error\"},{\"inputs\":[],\"name\":\"RedeemFreshnessCheck\",\"type\":\"error\"},{\"inputs\":[],\"name\":\"RedeemTransferOutNotPossible\",\"type\":\"error\"},{\"inputs\":[],\"name\":\"ReduceReservesAdminCheck\",\"type\":\"error\"},{\"inputs\":[],\"name\":\"ReduceReservesCashNotAvailable\",\"type\":\"error\"},{\"inputs\":[],\"name\":\"ReduceReservesCashValidation\",\"type\":\"error\"},{\"inputs\":[],\"name\":\"ReduceReservesFreshCheck\",\"type\":\"error\"},{\"inputs\":[{\"internalType\":\"uint256\",\"name\":\"errorCode\",\"type\":\"uint256\"}],\"name\":\"RepayBorrowComptrollerRejection\",\"type\":\"error\"},{\"inputs\":[],\"name\":\"RepayBorrowFreshnessCheck\",\"type\":\"error\"},{\"inputs\":[],\"name\":\"SetComptrollerOwnerCheck\",\"type\":\"error\"},{\"inputs\":[],\"name\":\"SetInterestRateModelFreshCheck\",\"type\":\"error\"},{\"inputs\":[],\"name\":\"SetInterestRateModelOwnerCheck\",\"type\":\"error\"},{\"inputs\":[],\"name\":\"SetProtocolSeizeShareUnauthorized\",\"type\":\"error\"},{\"inputs\":[],\"name\":\"SetReserveFactorAdminCheck\",\"type\":\"error\"},{\"inputs\":[],\"name\":\"SetReserveFactorBoundsCheck\",\"type\":\"error\"},{\"inputs\":[],\"name\":\"SetReserveFactorFreshCheck\",\"type\":\"error\"},{\"inputs\":[{\"internalType\":\"uint256\",\"name\":\"errorCode\",\"type\":\"uint256\"}],\"name\":\"TransferComptrollerRejection\",\"type\":\"error\"},{\"inputs\":[],\"name\":\"TransferNotAllowed\",\"type\":\"error\"},{\"inputs\":[],\"name\":\"TransferNotEnough\",\"type\":\"error\"},{\"inputs\":[],\"name\":\"TransferTooMuch\",\"type\":\"error\"},{\"anonymous\":false,\"inputs\":[{\"indexed\":false,\"internalType\":\"uint256\",\"name\":\"cashPrior\",\"type\":\"uint256\"},{\"indexed\":false,\"internalType\":\"uint256\",\"name\":\"interestAccumulated\",\"type\":\"uint256\"},{\"indexed\":false,\"internalType\":\"uint256\",\"name\":\"borrowIndex\",\"type\":\"uint256\"},{\"indexed\":false,\"internalType\":\"uint256\",\"name\":\"totalBorrows\",\"type\":\"uint256\"}],\"name\":\"AccrueInterest\",\"type\":\"event\"},{\"anonymous\":false,\"inputs\":[{\"indexed\":true,\"internalType\":\"address\",\"name\":\"owner\",\"type\":\"address\"},{\"indexed\":true,\"internalType\":\"address\",\"name\":\"spender\",\"type\":\"address\"},{\"indexed\":false,\"internalType\":\"uint256\",\"name\":\"amount\",\"type\":\"uint256\"}],\"name\":\"Approval\",\"type\":\"event\"},{\"anonymous\":false,\"inputs\":[{\"indexed\":false,\"internalType\":\"address\",\"name\":\"borrower\",\"type\":\"address\"},{\"indexed\":false,\"internalType\":\"uint256\",\"name\":\"badDebtDelta\",\"type\":\"uint256\"},{\"indexed\":false,\"internalType\":\"uint256\",\"name\":\"badDebtOld\",\"type\":\"uint256\"},{\"indexed\":false,\"internalType\":\"uint256\",\"name\":\"badDebtNew\",\"type\":\"uint256\"}],\"name\":\"BadDebtIncreased\",\"type\":\"event\"},{\"anonymous\":false,\"inputs\":[{\"indexed\":false,\"internalType\":\"uint256\",\"name\":\"badDebtOld\",\"type\":\"uint256\"},{\"indexed\":false,\"internalType\":\"uint256\",\"name\":\"badDebtNew\",\"type\":\"uint256\"}],\"name\":\"BadDebtRecovered\",\"type\":\"event\"},{\"anonymous\":false,\"inputs\":[{\"indexed\":false,\"internalType\":\"address\",\"name\":\"borrower\",\"type\":\"address\"},{\"indexed\":false,\"internalType\":\"uint256\",\"name\":\"borrowAmount\",\"type\":\"uint256\"},{\"indexed\":false,\"internalType\":\"uint256\",\"name\":\"accountBorrows\",\"type\":\"uint256\"},{\"indexed\":false,\"internalType\":\"uint256\",\"name\":\"totalBorrows\",\"type\":\"uint256\"}],\"name\":\"Borrow\",\"type\":\"event\"},{\"anonymous\":false,\"inputs\":[{\"indexed\":false,\"internalType\":\"uint8\",\"name\":\"version\",\"type\":\"uint8\"}],\"name\":\"Initialized\",\"type\":\"event\"},{\"anonymous\":false,\"inputs\":[{\"indexed\":false,\"internalType\":\"address\",\"name\":\"liquidator\",\"type\":\"address\"},{\"indexed\":false,\"internalType\":\"address\",\"name\":\"borrower\",\"type\":\"address\"},{\"indexed\":false,\"internalType\":\"uint256\",\"name\":\"repayAmount\",\"type\":\"uint256\"},{\"indexed\":false,\"internalType\":\"address\",\"name\":\"vTokenCollateral\",\"type\":\"address\"},{\"indexed\":false,\"internalType\":\"uint256\",\"name\":\"seizeTokens\",\"type\":\"uint256\"}],\"name\":\"LiquidateBorrow\",\"type\":\"event\"},{\"anonymous\":false,\"inputs\":[{\"indexed\":false,\"internalType\":\"address\",\"name\":\"minter\",\"type\":\"address\"},{\"indexed\":false,\"internalType\":\"uint256\",\"name\":\"mintAmount\",\"type\":\"uint256\"},{\"indexed\":false,\"internalType\":\"uint256\",\"name\":\"mintTokens\",\"type\":\"uint256\"}],\"name\":\"Mint\",\"type\":\"event\"},{\"anonymous\":false,\"inputs\":[{\"indexed\":false,\"internalType\":\"contract AccessControlManager\",\"name\":\"oldAccessControlManager\",\"type\":\"address\"},{\"indexed\":false,\"internalType\":\"contract AccessControlManager\",\"name\":\"newAccessControlManager\",\"type\":\"address\"}],\"name\":\"NewAccessControlManager\",\"type\":\"event\"},{\"anonymous\":false,\"inputs\":[{\"indexed\":false,\"internalType\":\"contract ComptrollerInterface\",\"name\":\"oldComptroller\",\"type\":\"address\"},{\"indexed\":false,\"internalType\":\"contract ComptrollerInterface\",\"name\":\"newComptroller\",\"type\":\"address\"}],\"name\":\"NewComptroller\",\"type\":\"event\"},{\"anonymous\":false,\"inputs\":[{\"indexed\":false,\"internalType\":\"contract InterestRateModel\",\"name\":\"oldInterestRateModel\",\"type\":\"address\"},{\"indexed\":false,\"internalType\":\"contract InterestRateModel\",\"name\":\"newInterestRateModel\",\"type\":\"address\"}],\"name\":\"NewMarketInterestRateModel\",\"type\":\"event\"},{\"anonymous\":false,\"inputs\":[{\"indexed\":false,\"internalType\":\"uint256\",\"name\":\"oldProtocolSeizeShareMantissa\",\"type\":\"uint256\"},{\"indexed\":false,\"internalType\":\"uint256\",\"name\":\"newProtocolSeizeShareMantissa\",\"type\":\"uint256\"}],\"name\":\"NewProtocolSeizeShare\",\"type\":\"event\"},{\"anonymous\":false,\"inputs\":[{\"indexed\":false,\"internalType\":\"uint256\",\"name\":\"oldReserveFactorMantissa\",\"type\":\"uint256\"},{\"indexed\":false,\"internalType\":\"uint256\",\"name\":\"newReserveFactorMantissa\",\"type\":\"uint256\"}],\"name\":\"NewReserveFactor\",\"type\":\"event\"},{\"anonymous\":false,\"inputs\":[{\"indexed\":true,\"internalType\":\"address\",\"name\":\"previousOwner\",\"type\":\"address\"},{\"indexed\":true,\"internalType\":\"address\",\"name\":\"newOwner\",\"type\":\"address\"}],\"name\":\"OwnershipTransferStarted\",\"type\":\"event\"},{\"anonymous\":false,\"inputs\":[{\"indexed\":true,\"internalType\":\"address\",\"name\":\"previousOwner\",\"type\":\"address\"},{\"indexed\":true,\"internalType\":\"address\",\"name\":\"newOwner\",\"type\":\"address\"}],\"name\":\"OwnershipTransferred\",\"type\":\"event\"},{\"anonymous\":false,\"inputs\":[{\"indexed\":false,\"internalType\":\"address\",\"name\":\"redeemer\",\"type\":\"address\"},{\"indexed\":false,\"internalType\":\"uint256\",\"name\":\"redeemAmount\",\"type\":\"uint256\"},{\"indexed\":false,\"internalType\":\"uint256\",\"name\":\"redeemTokens\",\"type\":\"uint256\"}],\"name\":\"Redeem\",\"type\":\"event\"},{\"anonymous\":false,\"inputs\":[{\"indexed\":false,\"internalType\":\"address\",\"name\":\"payer\",\"type\":\"address\"},{\"indexed\":false,\"internalType\":\"address\",\"name\":\"borrower\",\"type\":\"address\"},{\"indexed\":false,\"internalType\":\"uint256\",\"name\":\"repayAmount\",\"type\":\"uint256\"},{\"indexed\":false,\"internalType\":\"uint256\",\"name\":\"accountBorrows\",\"type\":\"uint256\"},{\"indexed\":false,\"internalType\":\"uint256\",\"name\":\"totalBorrows\",\"type\":\"uint256\"}],\"name\":\"RepayBorrow\",\"type\":\"event\"},{\"anonymous\":false,\"inputs\":[{\"indexed\":false,\"internalType\":\"address\",\"name\":\"benefactor\",\"type\":\"address\"},{\"indexed\":false,\"internalType\":\"uint256\",\"name\":\"addAmount\",\"type\":\"uint256\"},{\"indexed\":false,\"internalType\":\"uint256\",\"name\":\"newTotalReserves\",\"type\":\"uint256\"}],\"name\":\"ReservesAdded\",\"type\":\"event\"},{\"anonymous\":false,\"inputs\":[{\"indexed\":false,\"internalType\":\"address\",\"name\":\"admin\",\"type\":\"address\"},{\"indexed\":false,\"internalType\":\"uint256\",\"name\":\"reduceAmount\",\"type\":\"uint256\"},{\"indexed\":false,\"internalType\":\"uint256\",\"name\":\"newTotalReserves\",\"type\":\"uint256\"}],\"name\":\"ReservesReduced\",\"type\":\"event\"},{\"anonymous\":false,\"inputs\":[{\"indexed\":true,\"internalType\":\"address\",\"name\":\"from\",\"type\":\"address\"},{\"indexed\":true,\"internalType\":\"address\",\"name\":\"to\",\"type\":\"address\"},{\"indexed\":false,\"internalType\":\"uint256\",\"name\":\"amount\",\"type\":\"uint256\"}],\"name\":\"Transfer\",\"type\":\"event\"},{\"inputs\":[],\"name\":\"NO_ERROR\",\"outputs\":[{\"internalType\":\"uint256\",\"name\":\"\",\"type\":\"uint256\"}],\"stateMutability\":\"view\",\"type\":\"function\"},{\"inputs\":[],\"name\":\"acceptOwnership\",\"outputs\":[],\"stateMutability\":\"nonpayable\",\"type\":\"function\"},{\"inputs\":[],\"name\":\"accessControlManager\",\"outputs\":[{\"internalType\":\"contract AccessControlManager\",\"name\":\"\",\"type\":\"address\"}],\"stateMutability\":\"view\",\"type\":\"function\"},{\"inputs\":[],\"name\":\"accrualBlockNumber\",\"outputs\":[{\"internalType\":\"uint256\",\"name\":\"\",\"type\":\"uint256\"}],\"stateMutability\":\"view\",\"type\":\"function\"},{\"inputs\":[],\"name\":\"accrueInterest\",\"outputs\":[{\"internalType\":\"uint256\",\"name\":\"\",\"type\":\"uint256\"}],\"stateMutability\":\"nonpayable\",\"type\":\"function\"},{\"inputs\":[{\"internalType\":\"uint256\",\"name\":\"addAmount\",\"type\":\"uint256\"}],\"name\":\"addReserves\",\"outputs\":[],\"stateMutability\":\"nonpayable\",\"type\":\"function\"},{\"inputs\":[{\"internalType\":\"address\",\"name\":\"owner\",\"type\":\"address\"},{\"internalType\":\"address\",\"name\":\"spender\",\"type\":\"address\"}],\"name\":\"allowance\",\"outputs\":[{\"internalType\":\"uint256\",\"name\":\"\",\"type\":\"uint256\"}],\"stateMutability\":\"view\",\"type\":\"function\"},{\"inputs\":[{\"internalType\":\"address\",\"name\":\"spender\",\"type\":\"address\"},{\"internalType\":\"uint256\",\"name\":\"amount\",\"type\":\"uint256\"}],\"name\":\"approve\",\"outputs\":[{\"internalType\":\"bool\",\"name\":\"\",\"type\":\"bool\"}],\"stateMutability\":\"nonpayable\",\"type\":\"function\"},{\"inputs\":[],\"name\":\"badDebt\",\"outputs\":[{\"internalType\":\"uint256\",\"name\":\"\",\"type\":\"uint256\"}],\"stateMutability\":\"view\",\"type\":\"function\"},{\"inputs\":[{\"internalType\":\"uint256\",\"name\":\"recoveredAmount_\",\"type\":\"uint256\"}],\"name\":\"badDebtRecovered\",\"outputs\":[],\"stateMutability\":\"nonpayable\",\"type\":\"function\"},{\"inputs\":[{\"internalType\":\"address\",\"name\":\"owner\",\"type\":\"address\"}],\"name\":\"balanceOf\",\"outputs\":[{\"internalType\":\"uint256\",\"name\":\"\",\"type\":\"uint256\"}],\"stateMutability\":\"view\",\"type\":\"function\"},{\"inputs\":[{\"internalType\":\"address\",\"name\":\"owner\",\"type\":\"address\"}],\"name\":\"balanceOfUnderlying\",\"outputs\":[{\"internalType\":\"uint256\",\"name\":\"\",\"type\":\"uint256\"}],\"stateMutability\":\"nonpayable\",\"type\":\"function\"},{\"inputs\":[{\"internalType\":\"uint256\",\"name\":\"borrowAmount\",\"type\":\"uint256\"}],\"name\":\"borrow\",\"outputs\":[{\"internalType\":\"uint256\",\"name\":\"\",\"type\":\"uint256\"}],\"stateMutability\":\"nonpayable\",\"type\":\"function\"},{\"inputs\":[{\"internalType\":\"address\",\"name\":\"account\",\"type\":\"address\"}],\"name\":\"borrowBalanceCurrent\",\"outputs\":[{\"internalType\":\"uint256\",\"name\":\"\",\"type\":\"uint256\"}],\"stateMutability\":\"nonpayable\",\"type\":\"function\"},{\"inputs\":[{\"internalType\":\"address\",\"name\":\"account\",\"type\":\"address\"}],\"name\":\"borrowBalanceStored\",\"outputs\":[{\"internalType\":\"uint256\",\"name\":\"\",\"type\":\"uint256\"}],\"stateMutability\":\"view\",\"type\":\"function\"},{\"inputs\":[],\"name\":\"borrowIndex\",\"outputs\":[{\"internalType\":\"uint256\",\"name\":\"\",\"type\":\"uint256\"}],\"stateMutability\":\"view\",\"type\":\"function\"},{\"inputs\":[],\"name\":\"borrowRatePerBlock\",\"outputs\":[{\"internalType\":\"uint256\",\"name\":\"\",\"type\":\"uint256\"}],\"stateMutability\":\"view\",\"type\":\"function\"},{\"inputs\":[],\"name\":\"comptroller\",\"outputs\":[{\"internalType\":\"contract ComptrollerInterface\",\"name\":\"\",\"type\":\"address\"}],\"stateMutability\":\"view\",\"type\":\"function\"},{\"inputs\":[],\"name\":\"decimals\",\"outputs\":[{\"internalType\":\"uint8\",\"name\":\"\",\"type\":\"uint8\"}],\"stateMutability\":\"view\",\"type\":\"function\"},{\"inputs\":[],\"name\":\"exchangeRateCurrent\",\"outputs\":[{\"internalType\":\"uint256\",\"name\":\"\",\"type\":\"uint256\"}],\"stateMutability\":\"nonpayable\",\"type\":\"function\"},{\"inputs\":[],\"name\":\"exchangeRateStored\",\"outputs\":[{\"internalType\":\"uint256\",\"name\":\"\",\"type\":\"uint256\"}],\"stateMutability\":\"view\",\"type\":\"function\"},{\"inputs\":[{\"internalType\":\"address\",\"name\":\"liquidator\",\"type\":\"address\"},{\"internalType\":\"address\",\"name\":\"borrower\",\"type\":\"address\"},{\"internalType\":\"uint256\",\"name\":\"repayAmount\",\"type\":\"uint256\"},{\"internalType\":\"contract VTokenInterface\",\"name\":\"vTokenCollateral\",\"type\":\"address\"},{\"internalType\":\"bool\",\"name\":\"skipLiquidityCheck\",\"type\":\"bool\"}],\"name\":\"forceLiquidateBorrow\",\"outputs\":[],\"stateMutability\":\"nonpayable\",\"type\":\"function\"},{\"inputs\":[{\"internalType\":\"address\",\"name\":\"account\",\"type\":\"address\"}],\"name\":\"getAccountSnapshot\",\"outputs\":[{\"internalType\":\"uint256\",\"name\":\"error\",\"type\":\"uint256\"},{\"internalType\":\"uint256\",\"name\":\"vTokenBalance\",\"type\":\"uint256\"},{\"internalType\":\"uint256\",\"name\":\"borrowBalance\",\"type\":\"uint256\"},{\"internalType\":\"uint256\",\"name\":\"exchangeRate\",\"type\":\"uint256\"}],\"stateMutability\":\"view\",\"type\":\"function\"},{\"inputs\":[],\"name\":\"getCash\",\"outputs\":[{\"internalType\":\"uint256\",\"name\":\"\",\"type\":\"uint256\"}],\"stateMutability\":\"view\",\"type\":\"function\"},{\"inputs\":[{\"internalType\":\"address\",\"name\":\"payer\",\"type\":\"address\"},{\"internalType\":\"address\",\"name\":\"borrower\",\"type\":\"address\"},{\"internalType\":\"uint256\",\"name\":\"repayAmount\",\"type\":\"uint256\"}],\"name\":\"healBorrow\",\"outputs\":[],\"stateMutability\":\"nonpayable\",\"type\":\"function\"},{\"inputs\":[{\"internalType\":\"address\",\"name\":\"underlying_\",\"type\":\"address\"},{\"internalType\":\"contract ComptrollerInterface\",\"name\":\"comptroller_\",\"type\":\"address\"},{\"internalType\":\"contract InterestRateModel\",\"name\":\"interestRateModel_\",\"type\":\"address\"},{\"internalType\":\"uint256\",\"name\":\"initialExchangeRateMantissa_\",\"type\":\"uint256\"},{\"internalType\":\"string\",\"name\":\"name_\",\"type\":\"string\"},{\"internalType\":\"string\",\"name\":\"symbol_\",\"type\":\"string\"},{\"internalType\":\"uint8\",\"name\":\"decimals_\",\"type\":\"uint8\"},{\"internalType\":\"address payable\",\"name\":\"admin_\",\"type\":\"address\"},{\"internalType\":\"contract AccessControlManager\",\"name\":\"accessControlManager_\",\"type\":\"address\"},{\"components\":[{\"internalType\":\"address\",\"name\":\"shortfall\",\"type\":\"address\"},{\"internalType\":\"address payable\",\"name\":\"riskFund\",\"type\":\"address\"},{\"internalType\":\"address payable\",\"name\":\"protocolShareReserve\",\"type\":\"address\"}],\"internalType\":\"struct VTokenInterface.RiskManagementInit\",\"name\":\"riskManagement\",\"type\":\"tuple\"}],\"name\":\"initialize\",\"outputs\":[],\"stateMutability\":\"nonpayable\",\"type\":\"function\"},{\"inputs\":[],\"name\":\"interestRateModel\",\"outputs\":[{\"internalType\":\"contract InterestRateModel\",\"name\":\"\",\"type\":\"address\"}],\"stateMutability\":\"view\",\"type\":\"function\"},{\"inputs\":[],\"name\":\"isVToken\",\"outputs\":[{\"internalType\":\"bool\",\"name\":\"\",\"type\":\"bool\"}],\"stateMutability\":\"view\",\"type\":\"function\"},{\"inputs\":[{\"internalType\":\"address\",\"name\":\"borrower\",\"type\":\"address\"},{\"internalType\":\"uint256\",\"name\":\"repayAmount\",\"type\":\"uint256\"},{\"internalType\":\"contract VTokenInterface\",\"name\":\"vTokenCollateral\",\"type\":\"address\"}],\"name\":\"liquidateBorrow\",\"outputs\":[{\"internalType\":\"uint256\",\"name\":\"\",\"type\":\"uint256\"}],\"stateMutability\":\"nonpayable\",\"type\":\"function\"},{\"inputs\":[{\"internalType\":\"uint256\",\"name\":\"mintAmount\",\"type\":\"uint256\"}],\"name\":\"mint\",\"outputs\":[{\"internalType\":\"uint256\",\"name\":\"\",\"type\":\"uint256\"}],\"stateMutability\":\"nonpayable\",\"type\":\"function\"},{\"inputs\":[{\"internalType\":\"address\",\"name\":\"minter\",\"type\":\"address\"},{\"internalType\":\"uint256\",\"name\":\"mintAmount\",\"type\":\"uint256\"}],\"name\":\"mintBehalf\",\"outputs\":[{\"internalType\":\"uint256\",\"name\":\"\",\"type\":\"uint256\"}],\"stateMutability\":\"nonpayable\",\"type\":\"function\"},{\"inputs\":[],\"name\":\"name\",\"outputs\":[{\"internalType\":\"string\",\"name\":\"\",\"type\":\"string\"}],\"stateMutability\":\"view\",\"type\":\"function\"},{\"inputs\":[],\"name\":\"owner\",\"outputs\":[{\"internalType\":\"address\",\"name\":\"\",\"type\":\"address\"}],\"stateMutability\":\"view\",\"type\":\"function\"},{\"inputs\":[],\"name\":\"pendingOwner\",\"outputs\":[{\"internalType\":\"address\",\"name\":\"\",\"type\":\"address\"}],\"stateMutability\":\"view\",\"type\":\"function\"},{\"inputs\":[],\"name\":\"protocolSeizeShareMantissa\",\"outputs\":[{\"internalType\":\"uint256\",\"name\":\"\",\"type\":\"uint256\"}],\"stateMutability\":\"view\",\"type\":\"function\"},{\"inputs\":[{\"internalType\":\"uint256\",\"name\":\"redeemTokens\",\"type\":\"uint256\"}],\"name\":\"redeem\",\"outputs\":[{\"internalType\":\"uint256\",\"name\":\"\",\"type\":\"uint256\"}],\"stateMutability\":\"nonpayable\",\"type\":\"function\"},{\"inputs\":[{\"internalType\":\"uint256\",\"name\":\"redeemAmount\",\"type\":\"uint256\"}],\"name\":\"redeemUnderlying\",\"outputs\":[{\"internalType\":\"uint256\",\"name\":\"\",\"type\":\"uint256\"}],\"stateMutability\":\"nonpayable\",\"type\":\"function\"},{\"inputs\":[{\"internalType\":\"uint256\",\"name\":\"reduceAmount\",\"type\":\"uint256\"}],\"name\":\"reduceReserves\",\"outputs\":[],\"stateMutability\":\"nonpayable\",\"type\":\"function\"},{\"inputs\":[],\"name\":\"renounceOwnership\",\"outputs\":[],\"stateMutability\":\"nonpayable\",\"type\":\"function\"},{\"inputs\":[{\"internalType\":\"uint256\",\"name\":\"repayAmount\",\"type\":\"uint256\"}],\"name\":\"repayBorrow\",\"outputs\":[{\"internalType\":\"uint256\",\"name\":\"\",\"type\":\"uint256\"}],\"stateMutability\":\"nonpayable\",\"type\":\"function\"},{\"inputs\":[{\"internalType\":\"address\",\"name\":\"borrower\",\"type\":\"address\"},{\"internalType\":\"uint256\",\"name\":\"repayAmount\",\"type\":\"uint256\"}],\"name\":\"repayBorrowBehalf\",\"outputs\":[{\"internalType\":\"uint256\",\"name\":\"\",\"type\":\"uint256\"}],\"stateMutability\":\"nonpayable\",\"type\":\"function\"},{\"inputs\":[],\"name\":\"reserveFactorMantissa\",\"outputs\":[{\"internalType\":\"uint256\",\"name\":\"\",\"type\":\"uint256\"}],\"stateMutability\":\"view\",\"type\":\"function\"},{\"inputs\":[{\"internalType\":\"address\",\"name\":\"liquidator\",\"type\":\"address\"},{\"internalType\":\"address\",\"name\":\"borrower\",\"type\":\"address\"},{\"internalType\":\"uint256\",\"name\":\"seizeTokens\",\"type\":\"uint256\"}],\"name\":\"seize\",\"outputs\":[],\"stateMutability\":\"nonpayable\",\"type\":\"function\"},{\"inputs\":[{\"internalType\":\"contract AccessControlManager\",\"name\":\"newAccessControlManager\",\"type\":\"address\"}],\"name\":\"setAccessControlAddress\",\"outputs\":[],\"stateMutability\":\"nonpayable\",\"type\":\"function\"},{\"inputs\":[{\"internalType\":\"contract ComptrollerInterface\",\"name\":\"newComptroller\",\"type\":\"address\"}],\"name\":\"setComptroller\",\"outputs\":[],\"stateMutability\":\"nonpayable\",\"type\":\"function\"},{\"inputs\":[{\"internalType\":\"contract InterestRateModel\",\"name\":\"newInterestRateModel\",\"type\":\"address\"}],\"name\":\"setInterestRateModel\",\"outputs\":[],\"stateMutability\":\"nonpayable\",\"type\":\"function\"},{\"inputs\":[{\"internalType\":\"uint256\",\"name\":\"newProtocolSeizeShareMantissa_\",\"type\":\"uint256\"}],\"name\":\"setProtocolSeizeShare\",\"outputs\":[],\"stateMutability\":\"nonpayable\",\"type\":\"function\"},{\"inputs\":[{\"internalType\":\"uint256\",\"name\":\"newReserveFactorMantissa\",\"type\":\"uint256\"}],\"name\":\"setReserveFactor\",\"outputs\":[],\"stateMutability\":\"nonpayable\",\"type\":\"function\"},{\"inputs\":[],\"name\":\"shortfall\",\"outputs\":[{\"internalType\":\"address\",\"name\":\"\",\"type\":\"address\"}],\"stateMutability\":\"view\",\"type\":\"function\"},{\"inputs\":[],\"name\":\"supplyRatePerBlock\",\"outputs\":[{\"internalType\":\"uint256\",\"name\":\"\",\"type\":\"uint256\"}],\"stateMutability\":\"view\",\"type\":\"function\"},{\"inputs\":[{\"internalType\":\"contract IERC20Upgradeable\",\"name\":\"token\",\"type\":\"address\"}],\"name\":\"sweepToken\",\"outputs\":[],\"stateMutability\":\"nonpayable\",\"type\":\"function\"},{\"inputs\":[],\"name\":\"symbol\",\"outputs\":[{\"internalType\":\"string\",\"name\":\"\",\"type\":\"string\"}],\"stateMutability\":\"view\",\"type\":\"function\"},{\"inputs\":[],\"name\":\"totalBorrows\",\"outputs\":[{\"internalType\":\"uint256\",\"name\":\"\",\"type\":\"uint256\"}],\"stateMutability\":\"view\",\"type\":\"function\"},{\"inputs\":[],\"name\":\"totalBorrowsCurrent\",\"outputs\":[{\"internalType\":\"uint256\",\"name\":\"\",\"type\":\"uint256\"}],\"stateMutability\":\"nonpayable\",\"type\":\"function\"},{\"inputs\":[],\"name\":\"totalReserves\",\"outputs\":[{\"internalType\":\"uint256\",\"name\":\"\",\"type\":\"uint256\"}],\"stateMutability\":\"view\",\"type\":\"function\"},{\"inputs\":[],\"name\":\"totalSupply\",\"outputs\":[{\"internalType\":\"uint256\",\"name\":\"\",\"type\":\"uint256\"}],\"stateMutability\":\"view\",\"type\":\"function\"},{\"inputs\":[{\"internalType\":\"address\",\"name\":\"dst\",\"type\":\"address\"},{\"internalType\":\"uint256\",\"name\":\"amount\",\"type\":\"uint256\"}],\"name\":\"transfer\",\"outputs\":[{\"internalType\":\"bool\",\"name\":\"\",\"type\":\"bool\"}],\"stateMutability\":\"nonpayable\",\"type\":\"function\"},{\"inputs\":[{\"internalType\":\"address\",\"name\":\"src\",\"type\":\"address\"},{\"internalType\":\"address\",\"name\":\"dst\",\"type\":\"address\"},{\"internalType\":\"uint256\",\"name\":\"amount\",\"type\":\"uint256\"}],\"name\":\"transferFrom\",\"outputs\":[{\"internalType\":\"bool\",\"name\":\"\",\"type\":\"bool\"}],\"stateMutability\":\"nonpayable\",\"type\":\"function\"},{\"inputs\":[{\"internalType\":\"address\",\"name\":\"newOwner\",\"type\":\"address\"}],\"name\":\"transferOwnership\",\"outputs\":[],\"stateMutability\":\"nonpayable\",\"type\":\"function\"},{\"inputs\":[],\"name\":\"underlying\",\"outputs\":[{\"internalType\":\"address\",\"name\":\"\",\"type\":\"address\"}],\"stateMutability\":\"view\",\"type\":\"function\"}],\"devdoc\":{\"author\":\"Venus Dev Team\",\"kind\":\"dev\",\"methods\":{\"acceptOwnership()\":{\"details\":\"The new owner accepts the ownership transfer.\"},\"accrueInterest()\":{\"custom:access\":\"Not restricted\",\"custom:events\":\"Emits AccrueInterest event on success\",\"details\":\"This calculates interest accrued from the last checkpointed block   up to the current block and writes new checkpoint to storage.\",\"returns\":{\"_0\":\"Always NO_ERROR\"}},\"addReserves(uint256)\":{\"custom:access\":\"Not restricted\",\"custom:events\":\"Emits ReservesAdded event; may emit AccrueInterest\",\"params\":{\"addAmount\":\"The amount fo underlying token to add as reserves\"}},\"allowance(address,address)\":{\"params\":{\"owner\":\"The address of the account which owns the tokens to be spent\",\"spender\":\"The address of the account which may transfer tokens\"},\"returns\":{\"_0\":\"amount The number of tokens allowed to be spent (-1 means infinite)\"}},\"approve(address,uint256)\":{\"custom:access\":\"Not restricted\",\"custom:events\":\"Emits Approval event\",\"details\":\"This will overwrite the approval amount for `spender`  and is subject to issues noted [here](https://eips.ethereum.org/EIPS/eip-20#approve)\",\"params\":{\"amount\":\"The number of tokens that are approved (uint256.max means infinite)\",\"spender\":\"The address of the account which may transfer tokens\"},\"returns\":{\"_0\":\"success Whether or not the approval succeeded\"}},\"badDebtRecovered(uint256)\":{\"custom:access\":\"Only Shortfall contract\",\"custom:events\":\"Emits BadDebtRecovered event\",\"details\":\"Called only when bad debt is recovered from auction\",\"params\":{\"recoveredAmount_\":\"The amount of bad debt recovered\"}},\"balanceOf(address)\":{\"params\":{\"owner\":\"The address of the account to query\"},\"returns\":{\"_0\":\"amount The number of tokens owned by `owner`\"}},\"balanceOfUnderlying(address)\":{\"details\":\"This also accrues interest in a transaction\",\"params\":{\"owner\":\"The address of the account to query\"},\"returns\":{\"_0\":\"amount The amount of underlying owned by `owner`\"}},\"borrow(uint256)\":{\"custom:access\":\"Not restricted\",\"custom:error\":\"BorrowCashNotAvailable is thrown when the protocol has insufficient cash\",\"custom:events\":\"Emits Borrow event; may emit AccrueInterest\",\"params\":{\"borrowAmount\":\"The amount of the underlying asset to borrow\"},\"returns\":{\"_0\":\"error Always NO_ERROR for compatilibily with Venus core tooling\"}},\"borrowBalanceCurrent(address)\":{\"params\":{\"account\":\"The address whose balance should be calculated after updating borrowIndex\"},\"returns\":{\"_0\":\"borrowBalance The calculated balance\"}},\"borrowBalanceStored(address)\":{\"params\":{\"account\":\"The address whose balance should be calculated\"},\"returns\":{\"_0\":\"borrowBalance The calculated balance\"}},\"borrowRatePerBlock()\":{\"returns\":{\"_0\":\"rate The borrow interest rate per block, scaled by 1e18\"}},\"constructor\":{\"custom:oz-upgrades-unsafe-allow\":\"constructor\"},\"exchangeRateCurrent()\":{\"returns\":{\"_0\":\"exchangeRate Calculated exchange rate scaled by 1e18\"}},\"exchangeRateStored()\":{\"details\":\"This function does not accrue interest before calculating the exchange rate\",\"returns\":{\"_0\":\"exchangeRate Calculated exchange rate scaled by 1e18\"}},\"forceLiquidateBorrow(address,address,uint256,address,bool)\":{\"custom:access\":\"Only Comptroller\",\"custom:error\":\"ForceLiquidateBorrowUnauthorized is thrown when the request does not come from ComptrollerLiquidateAccrueCollateralInterestFailed is thrown when it is not possible to accrue interest on the collateral vTokenLiquidateCollateralFreshnessCheck is thrown when interest has not been accrued on the collateral vTokenLiquidateLiquidatorIsBorrower is thrown when trying to liquidate selfLiquidateCloseAmountIsZero is thrown when repayment amount is zeroLiquidateCloseAmountIsUintMax is thrown when repayment amount is UINT_MAX\",\"custom:events\":\"Emits LiquidateBorrow event; may emit AccrueInterest\",\"params\":{\"borrower\":\"The borrower of this vToken to be liquidated\",\"liquidator\":\"The address repaying the borrow and seizing collateral\",\"repayAmount\":\"The amount of the underlying borrowed asset to repay\",\"skipLiquidityCheck\":\"If set to true, allows to liquidate up to 100% of the borrow   regardless of the account liquidity\",\"vTokenCollateral\":\"The market in which to seize collateral from the borrower\"}},\"getAccountSnapshot(address)\":{\"details\":\"This is used by comptroller to more efficiently perform liquidity checks.\",\"params\":{\"account\":\"Address of the account to snapshot\"},\"returns\":{\"borrowBalance\":\"Amount owed in terms of underlying\",\"error\":\"Always NO_ERROR for compatilibily with Venus core tooling\",\"exchangeRate\":\"Stored exchange rate\",\"vTokenBalance\":\"User's balance of vTokens\"}},\"getCash()\":{\"returns\":{\"_0\":\"cash The quantity of underlying asset owned by this contract\"}},\"healBorrow(address,address,uint256)\":{\"custom:access\":\"Only Comptroller\",\"custom:error\":\"HealBorrowUnauthorized is thrown when the request does not come from Comptroller\",\"custom:events\":\"Emits RepayBorrow, BadDebtIncreased events; may emit AccrueInterest\",\"details\":\"This function does not call any Comptroller hooks (like \\\"healAllowed\\\"), because we assume   the Comptroller does all the necessary checks before calling this function.\",\"params\":{\"borrower\":\"account to heal\",\"payer\":\"account who repays the debt\",\"repayAmount\":\"amount to repay\"}},\"initialize(address,address,address,uint256,string,string,uint8,address,address,(address,address,address))\":{\"params\":{\"admin_\":\"Address of the administrator of this token\",\"comptroller_\":\"The address of the Comptroller\",\"decimals_\":\"ERC-20 decimal precision of this token\",\"initialExchangeRateMantissa_\":\"The initial exchange rate, scaled by 1e18\",\"interestRateModel_\":\"The address of the interest rate model\",\"name_\":\"ERC-20 name of this token\",\"riskManagement\":\"Addresses of risk fund contracts\",\"symbol_\":\"ERC-20 symbol of this token\",\"underlying_\":\"The address of the underlying asset\"}},\"liquidateBorrow(address,uint256,address)\":{\"custom:access\":\"Not restricted\",\"custom:error\":\"LiquidateAccrueCollateralInterestFailed is thrown when it is not possible to accrue interest on the collateral vTokenLiquidateCollateralFreshnessCheck is thrown when interest has not been accrued on the collateral vTokenLiquidateLiquidatorIsBorrower is thrown when trying to liquidate selfLiquidateCloseAmountIsZero is thrown when repayment amount is zeroLiquidateCloseAmountIsUintMax is thrown when repayment amount is UINT_MAX\",\"custom:events\":\"Emits LiquidateBorrow event; may emit AccrueInterest\",\"params\":{\"borrower\":\"The borrower of this vToken to be liquidated\",\"repayAmount\":\"The amount of the underlying borrowed asset to repay\",\"vTokenCollateral\":\"The market in which to seize collateral from the borrower\"},\"returns\":{\"_0\":\"error Always NO_ERROR for compatilibily with Venus core tooling\"}},\"mint(uint256)\":{\"custom:access\":\"Not restricted\",\"custom:events\":\"Emits Mint and Transfer events; may emit AccrueInterest\",\"details\":\"Accrues interest whether or not the operation succeeds, unless reverted\",\"params\":{\"mintAmount\":\"The amount of the underlying asset to supply\"},\"returns\":{\"_0\":\"error Always NO_ERROR for compatilibily with Venus core tooling\"}},\"mintBehalf(address,uint256)\":{\"custom:access\":\"Not restricted\",\"custom:events\":\"Emits Mint and Transfer events; may emit AccrueInterest\",\"details\":\"Accrues interest whether or not the operation succeeds, unless reverted\",\"params\":{\"mintAmount\":\"The amount of the underlying asset to supply\"},\"returns\":{\"_0\":\"error Always NO_ERROR for compatilibily with Venus core tooling\"}},\"owner()\":{\"details\":\"Returns the address of the current owner.\"},\"pendingOwner()\":{\"details\":\"Returns the address of the pending owner.\"},\"redeem(uint256)\":{\"custom:access\":\"Not restricted\",\"custom:error\":\"RedeemTransferOutNotPossible is thrown when the protocol has insufficient cash\",\"custom:events\":\"Emits Redeem and Transfer events; may emit AccrueInterest\",\"details\":\"Accrues interest whether or not the operation succeeds, unless reverted\",\"params\":{\"redeemTokens\":\"The number of vTokens to redeem into underlying\"},\"returns\":{\"_0\":\"error Always NO_ERROR for compatilibily with Venus core tooling\"}},\"redeemUnderlying(uint256)\":{\"details\":\"Accrues interest whether or not the operation succeeds, unless reverted\",\"params\":{\"redeemAmount\":\"The amount of underlying to receive from redeeming vTokens\"},\"returns\":{\"_0\":\"error Always NO_ERROR for compatilibily with Venus core tooling\"}},\"reduceReserves(uint256)\":{\"custom:access\":\"Not restricted\",\"custom:error\":\"ReduceReservesCashNotAvailable is thrown when the vToken does not have sufficient cashReduceReservesCashValidation is thrown when trying to withdraw more cash than the reserves have\",\"custom:events\":\"Emits ReservesReduced event; may emit AccrueInterest\",\"params\":{\"reduceAmount\":\"Amount of reduction to reserves\"}},\"renounceOwnership()\":{\"details\":\"Leaves the contract without owner. It will not be possible to call `onlyOwner` functions anymore. Can only be called by the current owner. NOTE: Renouncing ownership will leave the contract without an owner, thereby removing any functionality that is only available to the owner.\"},\"repayBorrow(uint256)\":{\"custom:access\":\"Not restricted\",\"custom:events\":\"Emits RepayBorrow event; may emit AccrueInterest\",\"params\":{\"repayAmount\":\"The amount to repay, or -1 for the full outstanding amount\"},\"returns\":{\"_0\":\"error Always NO_ERROR for compatilibily with Venus core tooling\"}},\"repayBorrowBehalf(address,uint256)\":{\"custom:access\":\"Not restricted\",\"custom:events\":\"Emits RepayBorrow event; may emit AccrueInterest\",\"params\":{\"borrower\":\"the account with the debt being payed off\",\"repayAmount\":\"The amount to repay, or -1 for the full outstanding amount\"},\"returns\":{\"_0\":\"error Always NO_ERROR for compatilibily with Venus core tooling\"}},\"seize(address,address,uint256)\":{\"custom:access\":\"Not restricted\",\"custom:error\":\"LiquidateSeizeLiquidatorIsBorrower is thrown when trying to liquidate self\",\"custom:events\":\"Emits Transfer, ReservesAdded events\",\"details\":\"Will fail unless called by another vToken during the process of liquidation.  Its absolutely critical to use msg.sender as the borrowed vToken and not a parameter.\",\"params\":{\"borrower\":\"The account having collateral seized\",\"liquidator\":\"The account receiving seized collateral\",\"seizeTokens\":\"The number of vTokens to seize\"}},\"setAccessControlAddress(address)\":{\"custom:access\":\"Only Governance\",\"custom:events\":\"Emits NewAccessControlManager event\",\"details\":\"Admin function to set address of AccessControlManager\",\"params\":{\"newAccessControlManager\":\"The new address of the AccessControlManager\"}},\"setComptroller(address)\":{\"custom:access\":\"Only Governance\",\"custom:error\":\"SetComptrollerOwnerCheck is thrown when the call is not from owner\",\"custom:events\":\"Emits NewComptroller event\",\"details\":\"Admin function to set a new comptroller\"},\"setInterestRateModel(address)\":{\"custom:access\":\"Controlled by AccessControlManager\",\"custom:error\":\"SetInterestRateModelOwnerCheck is thrown when the call is not authorized by AccessControlManager\",\"custom:events\":\"Emits NewMarketInterestRateModel event; may emit AccrueInterest\",\"details\":\"Admin function to accrue interest and update the interest rate model\",\"params\":{\"newInterestRateModel\":\"the new interest rate model to use\"}},\"setProtocolSeizeShare(uint256)\":{\"custom:access\":\"Controlled by AccessControlManager\",\"custom:error\":\"SetProtocolSeizeShareUnauthorized is thrown when the call is not authorized by AccessControlManagerProtocolSeizeShareTooBig is thrown when the new seize share is too high\",\"custom:events\":\"Emits NewProtocolSeizeShare event on success\",\"details\":\"must be less than liquidation incentive - 1\",\"params\":{\"newProtocolSeizeShareMantissa_\":\"new protocol share mantissa\"}},\"setReserveFactor(uint256)\":{\"custom:access\":\"Controlled by AccessControlManager\",\"custom:error\":\"SetReserveFactorAdminCheck is thrown when the call is not authorized by AccessControlManagerSetReserveFactorBoundsCheck is thrown when the new reserve factor is too high\",\"custom:events\":\"Emits NewReserveFactor event; may emit AccrueInterest\",\"details\":\"Admin function to accrue interest and set a new reserve factor\"},\"supplyRatePerBlock()\":{\"returns\":{\"_0\":\"rate The supply interest rate per block, scaled by 1e18\"}},\"sweepToken(address)\":{\"custom:access\":\"Only Governance\",\"params\":{\"token\":\"The address of the ERC-20 token to sweep\"}},\"totalBorrowsCurrent()\":{\"returns\":{\"_0\":\"totalBorrows The total borrows with interest\"}},\"transfer(address,uint256)\":{\"custom:access\":\"Not restricted\",\"custom:error\":\"TransferNotAllowed is thrown if trying to transfer to self\",\"custom:events\":\"Emits Transfer event on success\",\"params\":{\"amount\":\"The number of tokens to transfer\",\"dst\":\"The address of the destination account\"},\"returns\":{\"_0\":\"success True if the transfer suceeded, reverts otherwise\"}},\"transferFrom(address,address,uint256)\":{\"custom:access\":\"Not restricted\",\"custom:error\":\"TransferNotAllowed is thrown if trying to transfer to self\",\"custom:events\":\"Emits Transfer event on success\",\"params\":{\"amount\":\"The number of tokens to transfer\",\"dst\":\"The address of the destination account\",\"src\":\"The address of the source account\"},\"returns\":{\"_0\":\"success True if the transfer suceeded, reverts otherwise\"}},\"transferOwnership(address)\":{\"details\":\"Starts the ownership transfer of the contract to a new account. Replaces the pending transfer if there is one. Can only be called by the current owner.\"}},\"title\":\"Venus VToken Contract\",\"version\":1},\"userdoc\":{\"events\":{\"AccrueInterest(uint256,uint256,uint256,uint256)\":{\"notice\":\"Event emitted when interest is accrued\"},\"Approval(address,address,uint256)\":{\"notice\":\"EIP20 Approval event\"},\"BadDebtIncreased(address,uint256,uint256,uint256)\":{\"notice\":\"Event emitted when bad debt is accumulated on a market\"},\"BadDebtRecovered(uint256,uint256)\":{\"notice\":\"Event emitted when bad debt is recovered via an auction\"},\"Borrow(address,uint256,uint256,uint256)\":{\"notice\":\"Event emitted when underlying is borrowed\"},\"LiquidateBorrow(address,address,uint256,address,uint256)\":{\"notice\":\"Event emitted when a borrow is liquidated\"},\"Mint(address,uint256,uint256)\":{\"notice\":\"Event emitted when tokens are minted\"},\"NewAccessControlManager(address,address)\":{\"notice\":\"Event emitted when comptroller is changed\"},\"NewComptroller(address,address)\":{\"notice\":\"Event emitted when comptroller is changed\"},\"NewMarketInterestRateModel(address,address)\":{\"notice\":\"Event emitted when interestRateModel is changed\"},\"NewProtocolSeizeShare(uint256,uint256)\":{\"notice\":\"Event emitted when protocol seize share is changed\"},\"NewReserveFactor(uint256,uint256)\":{\"notice\":\"Event emitted when the reserve factor is changed\"},\"Redeem(address,uint256,uint256)\":{\"notice\":\"Event emitted when tokens are redeemed\"},\"RepayBorrow(address,address,uint256,uint256,uint256)\":{\"notice\":\"Event emitted when a borrow is repaid\"},\"ReservesAdded(address,uint256,uint256)\":{\"notice\":\"Event emitted when the reserves are added\"},\"ReservesReduced(address,uint256,uint256)\":{\"notice\":\"Event emitted when the reserves are reduced\"},\"Transfer(address,address,uint256)\":{\"notice\":\"EIP20 Transfer event\"}},\"kind\":\"user\",\"methods\":{\"accessControlManager()\":{\"notice\":\"Storage of AccessControlManager\"},\"accrualBlockNumber()\":{\"notice\":\"Block number that interest was last accrued at\"},\"accrueInterest()\":{\"notice\":\"Applies accrued interest to total borrows and reserves\"},\"addReserves(uint256)\":{\"notice\":\"The sender adds to reserves.\"},\"allowance(address,address)\":{\"notice\":\"Get the current allowance from `owner` for `spender`\"},\"approve(address,uint256)\":{\"notice\":\"Approve `spender` to transfer up to `amount` from `src`\"},\"badDebt()\":{\"notice\":\"Total bad debt of the market\"},\"badDebtRecovered(uint256)\":{\"notice\":\"Updates bad debt\"},\"balanceOf(address)\":{\"notice\":\"Get the token balance of the `owner`\"},\"balanceOfUnderlying(address)\":{\"notice\":\"Get the underlying balance of the `owner`\"},\"borrow(uint256)\":{\"notice\":\"Sender borrows assets from the protocol to their own address\"},\"borrowBalanceCurrent(address)\":{\"notice\":\"Accrue interest to updated borrowIndex and then calculate account's borrow balance using the updated borrowIndex\"},\"borrowBalanceStored(address)\":{\"notice\":\"Return the borrow balance of account based on stored data\"},\"borrowIndex()\":{\"notice\":\"Accumulator of the total earned interest rate since the opening of the market\"},\"borrowRatePerBlock()\":{\"notice\":\"Returns the current per-block borrow interest rate for this vToken\"},\"comptroller()\":{\"notice\":\"Contract which oversees inter-vToken operations\"},\"decimals()\":{\"notice\":\"EIP-20 token decimals for this token\"},\"exchangeRateCurrent()\":{\"notice\":\"Accrue interest then return the up-to-date exchange rate\"},\"exchangeRateStored()\":{\"notice\":\"Calculates the exchange rate from the underlying to the VToken\"},\"forceLiquidateBorrow(address,address,uint256,address,bool)\":{\"notice\":\"The extended version of liquidations, callable only by Comptroller. May skip  the close factor check. The collateral seized is transferred to the liquidator.\"},\"getAccountSnapshot(address)\":{\"notice\":\"Get a snapshot of the account's balances, and the cached exchange rate\"},\"getCash()\":{\"notice\":\"Get cash balance of this vToken in the underlying asset\"},\"healBorrow(address,address,uint256)\":{\"notice\":\"Repays a certain amount of debt, treats the rest of the borrow as bad debt, essentially   \\\"forgiving\\\" the borrower. Healing is a situation that should rarely happen. However, some pools   may list risky assets or be configured improperly \\u2013 we want to still handle such cases gracefully.   We assume that Comptroller does the seizing, so this function is only available to Comptroller.\"},\"initialize(address,address,address,uint256,string,string,uint8,address,address,(address,address,address))\":{\"notice\":\"Construct a new money market\"},\"interestRateModel()\":{\"notice\":\"Model which tells what the current interest rate should be\"},\"isVToken()\":{\"notice\":\"Indicator that this is a VToken contract (for inspection)\"},\"liquidateBorrow(address,uint256,address)\":{\"notice\":\"The sender liquidates the borrowers collateral.  The collateral seized is transferred to the liquidator.\"},\"mint(uint256)\":{\"notice\":\"Sender supplies assets into the market and receives vTokens in exchange\"},\"mintBehalf(address,uint256)\":{\"notice\":\"Sender calls on-behalf of minter. minter supplies assets into the market and receives vTokens in exchange\"},\"name()\":{\"notice\":\"EIP-20 token name for this token\"},\"protocolSeizeShareMantissa()\":{\"notice\":\"Share of seized collateral that is added to reserves\"},\"redeem(uint256)\":{\"notice\":\"Sender redeems vTokens in exchange for the underlying asset\"},\"redeemUnderlying(uint256)\":{\"notice\":\"Sender redeems vTokens in exchange for a specified amount of underlying asset\"},\"reduceReserves(uint256)\":{\"notice\":\"Accrues interest and reduces reserves by transferring to the protocol reserve contract\"},\"repayBorrow(uint256)\":{\"notice\":\"Sender repays their own borrow\"},\"repayBorrowBehalf(address,uint256)\":{\"notice\":\"Sender repays a borrow belonging to borrower\"},\"reserveFactorMantissa()\":{\"notice\":\"Fraction of interest currently set aside for reserves\"},\"seize(address,address,uint256)\":{\"notice\":\"Transfers collateral tokens (this market) to the liquidator.\"},\"setAccessControlAddress(address)\":{\"notice\":\"Sets the address of AccessControlManager\"},\"setComptroller(address)\":{\"notice\":\"Sets a new comptroller for the market\"},\"setInterestRateModel(address)\":{\"notice\":\"accrues interest and updates the interest rate model using _setInterestRateModelFresh\"},\"setProtocolSeizeShare(uint256)\":{\"notice\":\"sets protocol share accumulated from liquidations\"},\"setReserveFactor(uint256)\":{\"notice\":\"accrues interest and sets a new reserve factor for the protocol using _setReserveFactorFresh\"},\"shortfall()\":{\"notice\":\"Storage of Shortfall contract address\"},\"supplyRatePerBlock()\":{\"notice\":\"Returns the current per-block supply interest rate for this v\"},\"sweepToken(address)\":{\"notice\":\"A public function to sweep accidental ERC-20 transfers to this contract. Tokens are sent to admin (timelock)\"},\"symbol()\":{\"notice\":\"EIP-20 token symbol for this token\"},\"totalBorrows()\":{\"notice\":\"Total amount of outstanding borrows of the underlying in this market\"},\"totalBorrowsCurrent()\":{\"notice\":\"Returns the current total borrows plus accrued interest\"},\"totalReserves()\":{\"notice\":\"Total amount of reserves of the underlying held in this market\"},\"totalSupply()\":{\"notice\":\"Total number of tokens in circulation\"},\"transfer(address,uint256)\":{\"notice\":\"Transfer `amount` tokens from `msg.sender` to `dst`\"},\"transferFrom(address,address,uint256)\":{\"notice\":\"Transfer `amount` tokens from `src` to `dst`\"},\"underlying()\":{\"notice\":\"Underlying asset for this VToken\"}},\"version\":1}},\"settings\":{\"compilationTarget\":{\"contracts/VToken.sol\":\"VToken\"},\"evmVersion\":\"london\",\"libraries\":{},\"metadata\":{\"bytecodeHash\":\"ipfs\",\"useLiteralContent\":true},\"optimizer\":{\"enabled\":true,\"runs\":200},\"remappings\":[]},\"sources\":{\"@openzeppelin/contracts-upgradeable/access/Ownable2StepUpgradeable.sol\":{\"content\":\"// SPDX-License-Identifier: MIT\\n// OpenZeppelin Contracts (last updated v4.8.0) (access/Ownable2Step.sol)\\n\\npragma solidity ^0.8.0;\\n\\nimport \\\"./OwnableUpgradeable.sol\\\";\\nimport \\\"../proxy/utils/Initializable.sol\\\";\\n\\n/**\\n * @dev Contract module which provides access control mechanism, where\\n * there is an account (an owner) that can be granted exclusive access to\\n * specific functions.\\n *\\n * By default, the owner account will be the one that deploys the contract. This\\n * can later be changed with {transferOwnership} and {acceptOwnership}.\\n *\\n * This module is used through inheritance. It will make available all functions\\n * from parent (Ownable).\\n */\\nabstract contract Ownable2StepUpgradeable is Initializable, OwnableUpgradeable {\\n    function __Ownable2Step_init() internal onlyInitializing {\\n        __Ownable_init_unchained();\\n    }\\n\\n    function __Ownable2Step_init_unchained() internal onlyInitializing {\\n    }\\n    address private _pendingOwner;\\n\\n    event OwnershipTransferStarted(address indexed previousOwner, address indexed newOwner);\\n\\n    /**\\n     * @dev Returns the address of the pending owner.\\n     */\\n    function pendingOwner() public view virtual returns (address) {\\n        return _pendingOwner;\\n    }\\n\\n    /**\\n     * @dev Starts the ownership transfer of the contract to a new account. Replaces the pending transfer if there is one.\\n     * Can only be called by the current owner.\\n     */\\n    function transferOwnership(address newOwner) public virtual override onlyOwner {\\n        _pendingOwner = newOwner;\\n        emit OwnershipTransferStarted(owner(), newOwner);\\n    }\\n\\n    /**\\n     * @dev Transfers ownership of the contract to a new account (`newOwner`) and deletes any pending owner.\\n     * Internal function without access restriction.\\n     */\\n    function _transferOwnership(address newOwner) internal virtual override {\\n        delete _pendingOwner;\\n        super._transferOwnership(newOwner);\\n    }\\n\\n    /**\\n     * @dev The new owner accepts the ownership transfer.\\n     */\\n    function acceptOwnership() external {\\n        address sender = _msgSender();\\n        require(pendingOwner() == sender, \\\"Ownable2Step: caller is not the new owner\\\");\\n        _transferOwnership(sender);\\n    }\\n\\n    /**\\n     * @dev This empty reserved space is put in place to allow future versions to add new\\n     * variables without shifting down storage in the inheritance chain.\\n     * See https://docs.openzeppelin.com/contracts/4.x/upgradeable#storage_gaps\\n     */\\n    uint256[49] private __gap;\\n}\\n\",\"keccak256\":\"0xd712fb45b3ea0ab49679164e3895037adc26ce12879d5184feb040e01c1c07a9\",\"license\":\"MIT\"},\"@openzeppelin/contracts-upgradeable/access/OwnableUpgradeable.sol\":{\"content\":\"// SPDX-License-Identifier: MIT\\n// OpenZeppelin Contracts (last updated v4.7.0) (access/Ownable.sol)\\n\\npragma solidity ^0.8.0;\\n\\nimport \\\"../utils/ContextUpgradeable.sol\\\";\\nimport \\\"../proxy/utils/Initializable.sol\\\";\\n\\n/**\\n * @dev Contract module which provides a basic access control mechanism, where\\n * there is an account (an owner) that can be granted exclusive access to\\n * specific functions.\\n *\\n * By default, the owner account will be the one that deploys the contract. This\\n * can later be changed with {transferOwnership}.\\n *\\n * This module is used through inheritance. It will make available the modifier\\n * `onlyOwner`, which can be applied to your functions to restrict their use to\\n * the owner.\\n */\\nabstract contract OwnableUpgradeable is Initializable, ContextUpgradeable {\\n    address private _owner;\\n\\n    event OwnershipTransferred(address indexed previousOwner, address indexed newOwner);\\n\\n    /**\\n     * @dev Initializes the contract setting the deployer as the initial owner.\\n     */\\n    function __Ownable_init() internal onlyInitializing {\\n        __Ownable_init_unchained();\\n    }\\n\\n    function __Ownable_init_unchained() internal onlyInitializing {\\n        _transferOwnership(_msgSender());\\n    }\\n\\n    /**\\n     * @dev Throws if called by any account other than the owner.\\n     */\\n    modifier onlyOwner() {\\n        _checkOwner();\\n        _;\\n    }\\n\\n    /**\\n     * @dev Returns the address of the current owner.\\n     */\\n    function owner() public view virtual returns (address) {\\n        return _owner;\\n    }\\n\\n    /**\\n     * @dev Throws if the sender is not the owner.\\n     */\\n    function _checkOwner() internal view virtual {\\n        require(owner() == _msgSender(), \\\"Ownable: caller is not the owner\\\");\\n    }\\n\\n    /**\\n     * @dev Leaves the contract without owner. It will not be possible to call\\n     * `onlyOwner` functions anymore. Can only be called by the current owner.\\n     *\\n     * NOTE: Renouncing ownership will leave the contract without an owner,\\n     * thereby removing any functionality that is only available to the owner.\\n     */\\n    function renounceOwnership() public virtual onlyOwner {\\n        _transferOwnership(address(0));\\n    }\\n\\n    /**\\n     * @dev Transfers ownership of the contract to a new account (`newOwner`).\\n     * Can only be called by the current owner.\\n     */\\n    function transferOwnership(address newOwner) public virtual onlyOwner {\\n        require(newOwner != address(0), \\\"Ownable: new owner is the zero address\\\");\\n        _transferOwnership(newOwner);\\n    }\\n\\n    /**\\n     * @dev Transfers ownership of the contract to a new account (`newOwner`).\\n     * Internal function without access restriction.\\n     */\\n    function _transferOwnership(address newOwner) internal virtual {\\n        address oldOwner = _owner;\\n        _owner = newOwner;\\n        emit OwnershipTransferred(oldOwner, newOwner);\\n    }\\n\\n    /**\\n     * @dev This empty reserved space is put in place to allow future versions to add new\\n     * variables without shifting down storage in the inheritance chain.\\n     * See https://docs.openzeppelin.com/contracts/4.x/upgradeable#storage_gaps\\n     */\\n    uint256[49] private __gap;\\n}\\n\",\"keccak256\":\"0x247c62047745915c0af6b955470a72d1696ebad4352d7d3011aef1a2463cd888\",\"license\":\"MIT\"},\"@openzeppelin/contracts-upgradeable/proxy/utils/Initializable.sol\":{\"content\":\"// SPDX-License-Identifier: MIT\\n// OpenZeppelin Contracts (last updated v4.8.0) (proxy/utils/Initializable.sol)\\n\\npragma solidity ^0.8.2;\\n\\nimport \\\"../../utils/AddressUpgradeable.sol\\\";\\n\\n/**\\n * @dev This is a base contract to aid in writing upgradeable contracts, or any kind of contract that will be deployed\\n * behind a proxy. Since proxied contracts do not make use of a constructor, it's common to move constructor logic to an\\n * external initializer function, usually called `initialize`. It then becomes necessary to protect this initializer\\n * function so it can only be called once. The {initializer} modifier provided by this contract will have this effect.\\n *\\n * The initialization functions use a version number. Once a version number is used, it is consumed and cannot be\\n * reused. This mechanism prevents re-execution of each \\\"step\\\" but allows the creation of new initialization steps in\\n * case an upgrade adds a module that needs to be initialized.\\n *\\n * For example:\\n *\\n * [.hljs-theme-light.nopadding]\\n * ```\\n * contract MyToken is ERC20Upgradeable {\\n *     function initialize() initializer public {\\n *         __ERC20_init(\\\"MyToken\\\", \\\"MTK\\\");\\n *     }\\n * }\\n * contract MyTokenV2 is MyToken, ERC20PermitUpgradeable {\\n *     function initializeV2() reinitializer(2) public {\\n *         __ERC20Permit_init(\\\"MyToken\\\");\\n *     }\\n * }\\n * ```\\n *\\n * TIP: To avoid leaving the proxy in an uninitialized state, the initializer function should be called as early as\\n * possible by providing the encoded function call as the `_data` argument to {ERC1967Proxy-constructor}.\\n *\\n * CAUTION: When used with inheritance, manual care must be taken to not invoke a parent initializer twice, or to ensure\\n * that all initializers are idempotent. This is not verified automatically as constructors are by Solidity.\\n *\\n * [CAUTION]\\n * ====\\n * Avoid leaving a contract uninitialized.\\n *\\n * An uninitialized contract can be taken over by an attacker. This applies to both a proxy and its implementation\\n * contract, which may impact the proxy. To prevent the implementation contract from being used, you should invoke\\n * the {_disableInitializers} function in the constructor to automatically lock it when it is deployed:\\n *\\n * [.hljs-theme-light.nopadding]\\n * ```\\n * /// @custom:oz-upgrades-unsafe-allow constructor\\n * constructor() {\\n *     _disableInitializers();\\n * }\\n * ```\\n * ====\\n */\\nabstract contract Initializable {\\n    /**\\n     * @dev Indicates that the contract has been initialized.\\n     * @custom:oz-retyped-from bool\\n     */\\n    uint8 private _initialized;\\n\\n    /**\\n     * @dev Indicates that the contract is in the process of being initialized.\\n     */\\n    bool private _initializing;\\n\\n    /**\\n     * @dev Triggered when the contract has been initialized or reinitialized.\\n     */\\n    event Initialized(uint8 version);\\n\\n    /**\\n     * @dev A modifier that defines a protected initializer function that can be invoked at most once. In its scope,\\n     * `onlyInitializing` functions can be used to initialize parent contracts.\\n     *\\n     * Similar to `reinitializer(1)`, except that functions marked with `initializer` can be nested in the context of a\\n     * constructor.\\n     *\\n     * Emits an {Initialized} event.\\n     */\\n    modifier initializer() {\\n        bool isTopLevelCall = !_initializing;\\n        require(\\n            (isTopLevelCall && _initialized < 1) || (!AddressUpgradeable.isContract(address(this)) && _initialized == 1),\\n            \\\"Initializable: contract is already initialized\\\"\\n        );\\n        _initialized = 1;\\n        if (isTopLevelCall) {\\n            _initializing = true;\\n        }\\n        _;\\n        if (isTopLevelCall) {\\n            _initializing = false;\\n            emit Initialized(1);\\n        }\\n    }\\n\\n    /**\\n     * @dev A modifier that defines a protected reinitializer function that can be invoked at most once, and only if the\\n     * contract hasn't been initialized to a greater version before. In its scope, `onlyInitializing` functions can be\\n     * used to initialize parent contracts.\\n     *\\n     * A reinitializer may be used after the original initialization step. This is essential to configure modules that\\n     * are added through upgrades and that require initialization.\\n     *\\n     * When `version` is 1, this modifier is similar to `initializer`, except that functions marked with `reinitializer`\\n     * cannot be nested. If one is invoked in the context of another, execution will revert.\\n     *\\n     * Note that versions can jump in increments greater than 1; this implies that if multiple reinitializers coexist in\\n     * a contract, executing them in the right order is up to the developer or operator.\\n     *\\n     * WARNING: setting the version to 255 will prevent any future reinitialization.\\n     *\\n     * Emits an {Initialized} event.\\n     */\\n    modifier reinitializer(uint8 version) {\\n        require(!_initializing && _initialized < version, \\\"Initializable: contract is already initialized\\\");\\n        _initialized = version;\\n        _initializing = true;\\n        _;\\n        _initializing = false;\\n        emit Initialized(version);\\n    }\\n\\n    /**\\n     * @dev Modifier to protect an initialization function so that it can only be invoked by functions with the\\n     * {initializer} and {reinitializer} modifiers, directly or indirectly.\\n     */\\n    modifier onlyInitializing() {\\n        require(_initializing, \\\"Initializable: contract is not initializing\\\");\\n        _;\\n    }\\n\\n    /**\\n     * @dev Locks the contract, preventing any future reinitialization. This cannot be part of an initializer call.\\n     * Calling this in the constructor of a contract will prevent that contract from being initialized or reinitialized\\n     * to any version. It is recommended to use this to lock implementation contracts that are designed to be called\\n     * through proxies.\\n     *\\n     * Emits an {Initialized} event the first time it is successfully executed.\\n     */\\n    function _disableInitializers() internal virtual {\\n        require(!_initializing, \\\"Initializable: contract is initializing\\\");\\n        if (_initialized < type(uint8).max) {\\n            _initialized = type(uint8).max;\\n            emit Initialized(type(uint8).max);\\n        }\\n    }\\n\\n    /**\\n     * @dev Internal function that returns the initialized version. Returns `_initialized`\\n     */\\n    function _getInitializedVersion() internal view returns (uint8) {\\n        return _initialized;\\n    }\\n\\n    /**\\n     * @dev Internal function that returns the initialized version. Returns `_initializing`\\n     */\\n    function _isInitializing() internal view returns (bool) {\\n        return _initializing;\\n    }\\n}\\n\",\"keccak256\":\"0xe798cadb41e2da274913e4b3183a80f50fb057a42238fe8467e077268100ec27\",\"license\":\"MIT\"},\"@openzeppelin/contracts-upgradeable/token/ERC20/IERC20Upgradeable.sol\":{\"content\":\"// SPDX-License-Identifier: MIT\\n// OpenZeppelin Contracts (last updated v4.6.0) (token/ERC20/IERC20.sol)\\n\\npragma solidity ^0.8.0;\\n\\n/**\\n * @dev Interface of the ERC20 standard as defined in the EIP.\\n */\\ninterface IERC20Upgradeable {\\n    /**\\n     * @dev Emitted when `value` tokens are moved from one account (`from`) to\\n     * another (`to`).\\n     *\\n     * Note that `value` may be zero.\\n     */\\n    event Transfer(address indexed from, address indexed to, uint256 value);\\n\\n    /**\\n     * @dev Emitted when the allowance of a `spender` for an `owner` is set by\\n     * a call to {approve}. `value` is the new allowance.\\n     */\\n    event Approval(address indexed owner, address indexed spender, uint256 value);\\n\\n    /**\\n     * @dev Returns the amount of tokens in existence.\\n     */\\n    function totalSupply() external view returns (uint256);\\n\\n    /**\\n     * @dev Returns the amount of tokens owned by `account`.\\n     */\\n    function balanceOf(address account) external view returns (uint256);\\n\\n    /**\\n     * @dev Moves `amount` tokens from the caller's account to `to`.\\n     *\\n     * Returns a boolean value indicating whether the operation succeeded.\\n     *\\n     * Emits a {Transfer} event.\\n     */\\n    function transfer(address to, uint256 amount) external returns (bool);\\n\\n    /**\\n     * @dev Returns the remaining number of tokens that `spender` will be\\n     * allowed to spend on behalf of `owner` through {transferFrom}. This is\\n     * zero by default.\\n     *\\n     * This value changes when {approve} or {transferFrom} are called.\\n     */\\n    function allowance(address owner, address spender) external view returns (uint256);\\n\\n    /**\\n     * @dev Sets `amount` as the allowance of `spender` over the caller's tokens.\\n     *\\n     * Returns a boolean value indicating whether the operation succeeded.\\n     *\\n     * IMPORTANT: Beware that changing an allowance with this method brings the risk\\n     * that someone may use both the old and the new allowance by unfortunate\\n     * transaction ordering. One possible solution to mitigate this race\\n     * condition is to first reduce the spender's allowance to 0 and set the\\n     * desired value afterwards:\\n     * https://github.com/ethereum/EIPs/issues/20#issuecomment-263524729\\n     *\\n     * Emits an {Approval} event.\\n     */\\n    function approve(address spender, uint256 amount) external returns (bool);\\n\\n    /**\\n     * @dev Moves `amount` tokens from `from` to `to` using the\\n     * allowance mechanism. `amount` is then deducted from the caller's\\n     * allowance.\\n     *\\n     * Returns a boolean value indicating whether the operation succeeded.\\n     *\\n     * Emits a {Transfer} event.\\n     */\\n    function transferFrom(\\n        address from,\\n        address to,\\n        uint256 amount\\n    ) external returns (bool);\\n}\\n\",\"keccak256\":\"0x4e733d3164f73f461eaf9d8087a7ad1ea180bdc8ba0d3d61b0e1ae16d8e63dff\",\"license\":\"MIT\"},\"@openzeppelin/contracts-upgradeable/token/ERC20/extensions/draft-IERC20PermitUpgradeable.sol\":{\"content\":\"// SPDX-License-Identifier: MIT\\n// OpenZeppelin Contracts v4.4.1 (token/ERC20/extensions/draft-IERC20Permit.sol)\\n\\npragma solidity ^0.8.0;\\n\\n/**\\n * @dev Interface of the ERC20 Permit extension allowing approvals to be made via signatures, as defined in\\n * https://eips.ethereum.org/EIPS/eip-2612[EIP-2612].\\n *\\n * Adds the {permit} method, which can be used to change an account's ERC20 allowance (see {IERC20-allowance}) by\\n * presenting a message signed by the account. By not relying on {IERC20-approve}, the token holder account doesn't\\n * need to send a transaction, and thus is not required to hold Ether at all.\\n */\\ninterface IERC20PermitUpgradeable {\\n    /**\\n     * @dev Sets `value` as the allowance of `spender` over ``owner``'s tokens,\\n     * given ``owner``'s signed approval.\\n     *\\n     * IMPORTANT: The same issues {IERC20-approve} has related to transaction\\n     * ordering also apply here.\\n     *\\n     * Emits an {Approval} event.\\n     *\\n     * Requirements:\\n     *\\n     * - `spender` cannot be the zero address.\\n     * - `deadline` must be a timestamp in the future.\\n     * - `v`, `r` and `s` must be a valid `secp256k1` signature from `owner`\\n     * over the EIP712-formatted function arguments.\\n     * - the signature must use ``owner``'s current nonce (see {nonces}).\\n     *\\n     * For more information on the signature format, see the\\n     * https://eips.ethereum.org/EIPS/eip-2612#specification[relevant EIP\\n     * section].\\n     */\\n    function permit(\\n        address owner,\\n        address spender,\\n        uint256 value,\\n        uint256 deadline,\\n        uint8 v,\\n        bytes32 r,\\n        bytes32 s\\n    ) external;\\n\\n    /**\\n     * @dev Returns the current nonce for `owner`. This value must be\\n     * included whenever a signature is generated for {permit}.\\n     *\\n     * Every successful call to {permit} increases ``owner``'s nonce by one. This\\n     * prevents a signature from being used multiple times.\\n     */\\n    function nonces(address owner) external view returns (uint256);\\n\\n    /**\\n     * @dev Returns the domain separator used in the encoding of the signature for {permit}, as defined by {EIP712}.\\n     */\\n    // solhint-disable-next-line func-name-mixedcase\\n    function DOMAIN_SEPARATOR() external view returns (bytes32);\\n}\\n\",\"keccak256\":\"0xcc70d8e2281fb3ff69e8ab242500f10142cd0a7fa8dd9e45882be270d4d09024\",\"license\":\"MIT\"},\"@openzeppelin/contracts-upgradeable/token/ERC20/utils/SafeERC20Upgradeable.sol\":{\"content\":\"// SPDX-License-Identifier: MIT\\n// OpenZeppelin Contracts (last updated v4.8.0) (token/ERC20/utils/SafeERC20.sol)\\n\\npragma solidity ^0.8.0;\\n\\nimport \\\"../IERC20Upgradeable.sol\\\";\\nimport \\\"../extensions/draft-IERC20PermitUpgradeable.sol\\\";\\nimport \\\"../../../utils/AddressUpgradeable.sol\\\";\\n\\n/**\\n * @title SafeERC20\\n * @dev Wrappers around ERC20 operations that throw on failure (when the token\\n * contract returns false). Tokens that return no value (and instead revert or\\n * throw on failure) are also supported, non-reverting calls are assumed to be\\n * successful.\\n * To use this library you can add a `using SafeERC20 for IERC20;` statement to your contract,\\n * which allows you to call the safe operations as `token.safeTransfer(...)`, etc.\\n */\\nlibrary SafeERC20Upgradeable {\\n    using AddressUpgradeable for address;\\n\\n    function safeTransfer(\\n        IERC20Upgradeable token,\\n        address to,\\n        uint256 value\\n    ) internal {\\n        _callOptionalReturn(token, abi.encodeWithSelector(token.transfer.selector, to, value));\\n    }\\n\\n    function safeTransferFrom(\\n        IERC20Upgradeable token,\\n        address from,\\n        address to,\\n        uint256 value\\n    ) internal {\\n        _callOptionalReturn(token, abi.encodeWithSelector(token.transferFrom.selector, from, to, value));\\n    }\\n\\n    /**\\n     * @dev Deprecated. This function has issues similar to the ones found in\\n     * {IERC20-approve}, and its usage is discouraged.\\n     *\\n     * Whenever possible, use {safeIncreaseAllowance} and\\n     * {safeDecreaseAllowance} instead.\\n     */\\n    function safeApprove(\\n        IERC20Upgradeable token,\\n        address spender,\\n        uint256 value\\n    ) internal {\\n        // safeApprove should only be called when setting an initial allowance,\\n        // or when resetting it to zero. To increase and decrease it, use\\n        // 'safeIncreaseAllowance' and 'safeDecreaseAllowance'\\n        require(\\n            (value == 0) || (token.allowance(address(this), spender) == 0),\\n            \\\"SafeERC20: approve from non-zero to non-zero allowance\\\"\\n        );\\n        _callOptionalReturn(token, abi.encodeWithSelector(token.approve.selector, spender, value));\\n    }\\n\\n    function safeIncreaseAllowance(\\n        IERC20Upgradeable token,\\n        address spender,\\n        uint256 value\\n    ) internal {\\n        uint256 newAllowance = token.allowance(address(this), spender) + value;\\n        _callOptionalReturn(token, abi.encodeWithSelector(token.approve.selector, spender, newAllowance));\\n    }\\n\\n    function safeDecreaseAllowance(\\n        IERC20Upgradeable token,\\n        address spender,\\n        uint256 value\\n    ) internal {\\n        unchecked {\\n            uint256 oldAllowance = token.allowance(address(this), spender);\\n            require(oldAllowance >= value, \\\"SafeERC20: decreased allowance below zero\\\");\\n            uint256 newAllowance = oldAllowance - value;\\n            _callOptionalReturn(token, abi.encodeWithSelector(token.approve.selector, spender, newAllowance));\\n        }\\n    }\\n\\n    function safePermit(\\n        IERC20PermitUpgradeable token,\\n        address owner,\\n        address spender,\\n        uint256 value,\\n        uint256 deadline,\\n        uint8 v,\\n        bytes32 r,\\n        bytes32 s\\n    ) internal {\\n        uint256 nonceBefore = token.nonces(owner);\\n        token.permit(owner, spender, value, deadline, v, r, s);\\n        uint256 nonceAfter = token.nonces(owner);\\n        require(nonceAfter == nonceBefore + 1, \\\"SafeERC20: permit did not succeed\\\");\\n    }\\n\\n    /**\\n     * @dev Imitates a Solidity high-level call (i.e. a regular function call to a contract), relaxing the requirement\\n     * on the return value: the return value is optional (but if data is returned, it must not be false).\\n     * @param token The token targeted by the call.\\n     * @param data The call data (encoded using abi.encode or one of its variants).\\n     */\\n    function _callOptionalReturn(IERC20Upgradeable token, bytes memory data) private {\\n        // We need to perform a low level call here, to bypass Solidity's return data size checking mechanism, since\\n        // we're implementing it ourselves. We use {Address-functionCall} to perform this call, which verifies that\\n        // the target address contains contract code and also asserts for success in the low-level call.\\n\\n        bytes memory returndata = address(token).functionCall(data, \\\"SafeERC20: low-level call failed\\\");\\n        if (returndata.length > 0) {\\n            // Return data is optional\\n            require(abi.decode(returndata, (bool)), \\\"SafeERC20: ERC20 operation did not succeed\\\");\\n        }\\n    }\\n}\\n\",\"keccak256\":\"0x220c4a5af915e656be2aaa85ca57505d102418e476b1e2ef6c62e0c6ac143871\",\"license\":\"MIT\"},\"@openzeppelin/contracts-upgradeable/utils/AddressUpgradeable.sol\":{\"content\":\"// SPDX-License-Identifier: MIT\\n// OpenZeppelin Contracts (last updated v4.8.0) (utils/Address.sol)\\n\\npragma solidity ^0.8.1;\\n\\n/**\\n * @dev Collection of functions related to the address type\\n */\\nlibrary AddressUpgradeable {\\n    /**\\n     * @dev Returns true if `account` is a contract.\\n     *\\n     * [IMPORTANT]\\n     * ====\\n     * It is unsafe to assume that an address for which this function returns\\n     * false is an externally-owned account (EOA) and not a contract.\\n     *\\n     * Among others, `isContract` will return false for the following\\n     * types of addresses:\\n     *\\n     *  - an externally-owned account\\n     *  - a contract in construction\\n     *  - an address where a contract will be created\\n     *  - an address where a contract lived, but was destroyed\\n     * ====\\n     *\\n     * [IMPORTANT]\\n     * ====\\n     * You shouldn't rely on `isContract` to protect against flash loan attacks!\\n     *\\n     * Preventing calls from contracts is highly discouraged. It breaks composability, breaks support for smart wallets\\n     * like Gnosis Safe, and does not provide security since it can be circumvented by calling from a contract\\n     * constructor.\\n     * ====\\n     */\\n    function isContract(address account) internal view returns (bool) {\\n        // This method relies on extcodesize/address.code.length, which returns 0\\n        // for contracts in construction, since the code is only stored at the end\\n        // of the constructor execution.\\n\\n        return account.code.length > 0;\\n    }\\n\\n    /**\\n     * @dev Replacement for Solidity's `transfer`: sends `amount` wei to\\n     * `recipient`, forwarding all available gas and reverting on errors.\\n     *\\n     * https://eips.ethereum.org/EIPS/eip-1884[EIP1884] increases the gas cost\\n     * of certain opcodes, possibly making contracts go over the 2300 gas limit\\n     * imposed by `transfer`, making them unable to receive funds via\\n     * `transfer`. {sendValue} removes this limitation.\\n     *\\n     * https://diligence.consensys.net/posts/2019/09/stop-using-soliditys-transfer-now/[Learn more].\\n     *\\n     * IMPORTANT: because control is transferred to `recipient`, care must be\\n     * taken to not create reentrancy vulnerabilities. Consider using\\n     * {ReentrancyGuard} or the\\n     * https://solidity.readthedocs.io/en/v0.5.11/security-considerations.html#use-the-checks-effects-interactions-pattern[checks-effects-interactions pattern].\\n     */\\n    function sendValue(address payable recipient, uint256 amount) internal {\\n        require(address(this).balance >= amount, \\\"Address: insufficient balance\\\");\\n\\n        (bool success, ) = recipient.call{value: amount}(\\\"\\\");\\n        require(success, \\\"Address: unable to send value, recipient may have reverted\\\");\\n    }\\n\\n    /**\\n     * @dev Performs a Solidity function call using a low level `call`. A\\n     * plain `call` is an unsafe replacement for a function call: use this\\n     * function instead.\\n     *\\n     * If `target` reverts with a revert reason, it is bubbled up by this\\n     * function (like regular Solidity function calls).\\n     *\\n     * Returns the raw returned data. To convert to the expected return value,\\n     * use https://solidity.readthedocs.io/en/latest/units-and-global-variables.html?highlight=abi.decode#abi-encoding-and-decoding-functions[`abi.decode`].\\n     *\\n     * Requirements:\\n     *\\n     * - `target` must be a contract.\\n     * - calling `target` with `data` must not revert.\\n     *\\n     * _Available since v3.1._\\n     */\\n    function functionCall(address target, bytes memory data) internal returns (bytes memory) {\\n        return functionCallWithValue(target, data, 0, \\\"Address: low-level call failed\\\");\\n    }\\n\\n    /**\\n     * @dev Same as {xref-Address-functionCall-address-bytes-}[`functionCall`], but with\\n     * `errorMessage` as a fallback revert reason when `target` reverts.\\n     *\\n     * _Available since v3.1._\\n     */\\n    function functionCall(\\n        address target,\\n        bytes memory data,\\n        string memory errorMessage\\n    ) internal returns (bytes memory) {\\n        return functionCallWithValue(target, data, 0, errorMessage);\\n    }\\n\\n    /**\\n     * @dev Same as {xref-Address-functionCall-address-bytes-}[`functionCall`],\\n     * but also transferring `value` wei to `target`.\\n     *\\n     * Requirements:\\n     *\\n     * - the calling contract must have an ETH balance of at least `value`.\\n     * - the called Solidity function must be `payable`.\\n     *\\n     * _Available since v3.1._\\n     */\\n    function functionCallWithValue(\\n        address target,\\n        bytes memory data,\\n        uint256 value\\n    ) internal returns (bytes memory) {\\n        return functionCallWithValue(target, data, value, \\\"Address: low-level call with value failed\\\");\\n    }\\n\\n    /**\\n     * @dev Same as {xref-Address-functionCallWithValue-address-bytes-uint256-}[`functionCallWithValue`], but\\n     * with `errorMessage` as a fallback revert reason when `target` reverts.\\n     *\\n     * _Available since v3.1._\\n     */\\n    function functionCallWithValue(\\n        address target,\\n        bytes memory data,\\n        uint256 value,\\n        string memory errorMessage\\n    ) internal returns (bytes memory) {\\n        require(address(this).balance >= value, \\\"Address: insufficient balance for call\\\");\\n        (bool success, bytes memory returndata) = target.call{value: value}(data);\\n        return verifyCallResultFromTarget(target, success, returndata, errorMessage);\\n    }\\n\\n    /**\\n     * @dev Same as {xref-Address-functionCall-address-bytes-}[`functionCall`],\\n     * but performing a static call.\\n     *\\n     * _Available since v3.3._\\n     */\\n    function functionStaticCall(address target, bytes memory data) internal view returns (bytes memory) {\\n        return functionStaticCall(target, data, \\\"Address: low-level static call failed\\\");\\n    }\\n\\n    /**\\n     * @dev Same as {xref-Address-functionCall-address-bytes-string-}[`functionCall`],\\n     * but performing a static call.\\n     *\\n     * _Available since v3.3._\\n     */\\n    function functionStaticCall(\\n        address target,\\n        bytes memory data,\\n        string memory errorMessage\\n    ) internal view returns (bytes memory) {\\n        (bool success, bytes memory returndata) = target.staticcall(data);\\n        return verifyCallResultFromTarget(target, success, returndata, errorMessage);\\n    }\\n\\n    /**\\n     * @dev Tool to verify that a low level call to smart-contract was successful, and revert (either by bubbling\\n     * the revert reason or using the provided one) in case of unsuccessful call or if target was not a contract.\\n     *\\n     * _Available since v4.8._\\n     */\\n    function verifyCallResultFromTarget(\\n        address target,\\n        bool success,\\n        bytes memory returndata,\\n        string memory errorMessage\\n    ) internal view returns (bytes memory) {\\n        if (success) {\\n            if (returndata.length == 0) {\\n                // only check isContract if the call was successful and the return data is empty\\n                // otherwise we already know that it was a contract\\n                require(isContract(target), \\\"Address: call to non-contract\\\");\\n            }\\n            return returndata;\\n        } else {\\n            _revert(returndata, errorMessage);\\n        }\\n    }\\n\\n    /**\\n     * @dev Tool to verify that a low level call was successful, and revert if it wasn't, either by bubbling the\\n     * revert reason or using the provided one.\\n     *\\n     * _Available since v4.3._\\n     */\\n    function verifyCallResult(\\n        bool success,\\n        bytes memory returndata,\\n        string memory errorMessage\\n    ) internal pure returns (bytes memory) {\\n        if (success) {\\n            return returndata;\\n        } else {\\n            _revert(returndata, errorMessage);\\n        }\\n    }\\n\\n    function _revert(bytes memory returndata, string memory errorMessage) private pure {\\n        // Look for revert reason and bubble it up if present\\n        if (returndata.length > 0) {\\n            // The easiest way to bubble the revert reason is using memory via assembly\\n            /// @solidity memory-safe-assembly\\n            assembly {\\n                let returndata_size := mload(returndata)\\n                revert(add(32, returndata), returndata_size)\\n            }\\n        } else {\\n            revert(errorMessage);\\n        }\\n    }\\n}\\n\",\"keccak256\":\"0x2edcb41c121abc510932e8d83ff8b82cf9cdde35e7c297622f5c29ef0af25183\",\"license\":\"MIT\"},\"@openzeppelin/contracts-upgradeable/utils/ContextUpgradeable.sol\":{\"content\":\"// SPDX-License-Identifier: MIT\\n// OpenZeppelin Contracts v4.4.1 (utils/Context.sol)\\n\\npragma solidity ^0.8.0;\\nimport \\\"../proxy/utils/Initializable.sol\\\";\\n\\n/**\\n * @dev Provides information about the current execution context, including the\\n * sender of the transaction and its data. While these are generally available\\n * via msg.sender and msg.data, they should not be accessed in such a direct\\n * manner, since when dealing with meta-transactions the account sending and\\n * paying for execution may not be the actual sender (as far as an application\\n * is concerned).\\n *\\n * This contract is only required for intermediate, library-like contracts.\\n */\\nabstract contract ContextUpgradeable is Initializable {\\n    function __Context_init() internal onlyInitializing {\\n    }\\n\\n    function __Context_init_unchained() internal onlyInitializing {\\n    }\\n    function _msgSender() internal view virtual returns (address) {\\n        return msg.sender;\\n    }\\n\\n    function _msgData() internal view virtual returns (bytes calldata) {\\n        return msg.data;\\n    }\\n\\n    /**\\n     * @dev This empty reserved space is put in place to allow future versions to add new\\n     * variables without shifting down storage in the inheritance chain.\\n     * See https://docs.openzeppelin.com/contracts/4.x/upgradeable#storage_gaps\\n     */\\n    uint256[50] private __gap;\\n}\\n\",\"keccak256\":\"0x963ea7f0b48b032eef72fe3a7582edf78408d6f834115b9feadd673a4d5bd149\",\"license\":\"MIT\"},\"@openzeppelin/contracts/access/AccessControl.sol\":{\"content\":\"// SPDX-License-Identifier: MIT\\n// OpenZeppelin Contracts (last updated v4.8.0) (access/AccessControl.sol)\\n\\npragma solidity ^0.8.0;\\n\\nimport \\\"./IAccessControl.sol\\\";\\nimport \\\"../utils/Context.sol\\\";\\nimport \\\"../utils/Strings.sol\\\";\\nimport \\\"../utils/introspection/ERC165.sol\\\";\\n\\n/**\\n * @dev Contract module that allows children to implement role-based access\\n * control mechanisms. This is a lightweight version that doesn't allow enumerating role\\n * members except through off-chain means by accessing the contract event logs. Some\\n * applications may benefit from on-chain enumerability, for those cases see\\n * {AccessControlEnumerable}.\\n *\\n * Roles are referred to by their `bytes32` identifier. These should be exposed\\n * in the external API and be unique. The best way to achieve this is by\\n * using `public constant` hash digests:\\n *\\n * ```\\n * bytes32 public constant MY_ROLE = keccak256(\\\"MY_ROLE\\\");\\n * ```\\n *\\n * Roles can be used to represent a set of permissions. To restrict access to a\\n * function call, use {hasRole}:\\n *\\n * ```\\n * function foo() public {\\n *     require(hasRole(MY_ROLE, msg.sender));\\n *     ...\\n * }\\n * ```\\n *\\n * Roles can be granted and revoked dynamically via the {grantRole} and\\n * {revokeRole} functions. Each role has an associated admin role, and only\\n * accounts that have a role's admin role can call {grantRole} and {revokeRole}.\\n *\\n * By default, the admin role for all roles is `DEFAULT_ADMIN_ROLE`, which means\\n * that only accounts with this role will be able to grant or revoke other\\n * roles. More complex role relationships can be created by using\\n * {_setRoleAdmin}.\\n *\\n * WARNING: The `DEFAULT_ADMIN_ROLE` is also its own admin: it has permission to\\n * grant and revoke this role. Extra precautions should be taken to secure\\n * accounts that have been granted it.\\n */\\nabstract contract AccessControl is Context, IAccessControl, ERC165 {\\n    struct RoleData {\\n        mapping(address => bool) members;\\n        bytes32 adminRole;\\n    }\\n\\n    mapping(bytes32 => RoleData) private _roles;\\n\\n    bytes32 public constant DEFAULT_ADMIN_ROLE = 0x00;\\n\\n    /**\\n     * @dev Modifier that checks that an account has a specific role. Reverts\\n     * with a standardized message including the required role.\\n     *\\n     * The format of the revert reason is given by the following regular expression:\\n     *\\n     *  /^AccessControl: account (0x[0-9a-f]{40}) is missing role (0x[0-9a-f]{64})$/\\n     *\\n     * _Available since v4.1._\\n     */\\n    modifier onlyRole(bytes32 role) {\\n        _checkRole(role);\\n        _;\\n    }\\n\\n    /**\\n     * @dev See {IERC165-supportsInterface}.\\n     */\\n    function supportsInterface(bytes4 interfaceId) public view virtual override returns (bool) {\\n        return interfaceId == type(IAccessControl).interfaceId || super.supportsInterface(interfaceId);\\n    }\\n\\n    /**\\n     * @dev Returns `true` if `account` has been granted `role`.\\n     */\\n    function hasRole(bytes32 role, address account) public view virtual override returns (bool) {\\n        return _roles[role].members[account];\\n    }\\n\\n    /**\\n     * @dev Revert with a standard message if `_msgSender()` is missing `role`.\\n     * Overriding this function changes the behavior of the {onlyRole} modifier.\\n     *\\n     * Format of the revert message is described in {_checkRole}.\\n     *\\n     * _Available since v4.6._\\n     */\\n    function _checkRole(bytes32 role) internal view virtual {\\n        _checkRole(role, _msgSender());\\n    }\\n\\n    /**\\n     * @dev Revert with a standard message if `account` is missing `role`.\\n     *\\n     * The format of the revert reason is given by the following regular expression:\\n     *\\n     *  /^AccessControl: account (0x[0-9a-f]{40}) is missing role (0x[0-9a-f]{64})$/\\n     */\\n    function _checkRole(bytes32 role, address account) internal view virtual {\\n        if (!hasRole(role, account)) {\\n            revert(\\n                string(\\n                    abi.encodePacked(\\n                        \\\"AccessControl: account \\\",\\n                        Strings.toHexString(account),\\n                        \\\" is missing role \\\",\\n                        Strings.toHexString(uint256(role), 32)\\n                    )\\n                )\\n            );\\n        }\\n    }\\n\\n    /**\\n     * @dev Returns the admin role that controls `role`. See {grantRole} and\\n     * {revokeRole}.\\n     *\\n     * To change a role's admin, use {_setRoleAdmin}.\\n     */\\n    function getRoleAdmin(bytes32 role) public view virtual override returns (bytes32) {\\n        return _roles[role].adminRole;\\n    }\\n\\n    /**\\n     * @dev Grants `role` to `account`.\\n     *\\n     * If `account` had not been already granted `role`, emits a {RoleGranted}\\n     * event.\\n     *\\n     * Requirements:\\n     *\\n     * - the caller must have ``role``'s admin role.\\n     *\\n     * May emit a {RoleGranted} event.\\n     */\\n    function grantRole(bytes32 role, address account) public virtual override onlyRole(getRoleAdmin(role)) {\\n        _grantRole(role, account);\\n    }\\n\\n    /**\\n     * @dev Revokes `role` from `account`.\\n     *\\n     * If `account` had been granted `role`, emits a {RoleRevoked} event.\\n     *\\n     * Requirements:\\n     *\\n     * - the caller must have ``role``'s admin role.\\n     *\\n     * May emit a {RoleRevoked} event.\\n     */\\n    function revokeRole(bytes32 role, address account) public virtual override onlyRole(getRoleAdmin(role)) {\\n        _revokeRole(role, account);\\n    }\\n\\n    /**\\n     * @dev Revokes `role` from the calling account.\\n     *\\n     * Roles are often managed via {grantRole} and {revokeRole}: this function's\\n     * purpose is to provide a mechanism for accounts to lose their privileges\\n     * if they are compromised (such as when a trusted device is misplaced).\\n     *\\n     * If the calling account had been revoked `role`, emits a {RoleRevoked}\\n     * event.\\n     *\\n     * Requirements:\\n     *\\n     * - the caller must be `account`.\\n     *\\n     * May emit a {RoleRevoked} event.\\n     */\\n    function renounceRole(bytes32 role, address account) public virtual override {\\n        require(account == _msgSender(), \\\"AccessControl: can only renounce roles for self\\\");\\n\\n        _revokeRole(role, account);\\n    }\\n\\n    /**\\n     * @dev Grants `role` to `account`.\\n     *\\n     * If `account` had not been already granted `role`, emits a {RoleGranted}\\n     * event. Note that unlike {grantRole}, this function doesn't perform any\\n     * checks on the calling account.\\n     *\\n     * May emit a {RoleGranted} event.\\n     *\\n     * [WARNING]\\n     * ====\\n     * This function should only be called from the constructor when setting\\n     * up the initial roles for the system.\\n     *\\n     * Using this function in any other way is effectively circumventing the admin\\n     * system imposed by {AccessControl}.\\n     * ====\\n     *\\n     * NOTE: This function is deprecated in favor of {_grantRole}.\\n     */\\n    function _setupRole(bytes32 role, address account) internal virtual {\\n        _grantRole(role, account);\\n    }\\n\\n    /**\\n     * @dev Sets `adminRole` as ``role``'s admin role.\\n     *\\n     * Emits a {RoleAdminChanged} event.\\n     */\\n    function _setRoleAdmin(bytes32 role, bytes32 adminRole) internal virtual {\\n        bytes32 previousAdminRole = getRoleAdmin(role);\\n        _roles[role].adminRole = adminRole;\\n        emit RoleAdminChanged(role, previousAdminRole, adminRole);\\n    }\\n\\n    /**\\n     * @dev Grants `role` to `account`.\\n     *\\n     * Internal function without access restriction.\\n     *\\n     * May emit a {RoleGranted} event.\\n     */\\n    function _grantRole(bytes32 role, address account) internal virtual {\\n        if (!hasRole(role, account)) {\\n            _roles[role].members[account] = true;\\n            emit RoleGranted(role, account, _msgSender());\\n        }\\n    }\\n\\n    /**\\n     * @dev Revokes `role` from `account`.\\n     *\\n     * Internal function without access restriction.\\n     *\\n     * May emit a {RoleRevoked} event.\\n     */\\n    function _revokeRole(bytes32 role, address account) internal virtual {\\n        if (hasRole(role, account)) {\\n            _roles[role].members[account] = false;\\n            emit RoleRevoked(role, account, _msgSender());\\n        }\\n    }\\n}\\n\",\"keccak256\":\"0x67e3daf189111d6d5b0464ed09cf9f0605a22c4b965a7fcecd707101faff008a\",\"license\":\"MIT\"},\"@openzeppelin/contracts/access/IAccessControl.sol\":{\"content\":\"// SPDX-License-Identifier: MIT\\n// OpenZeppelin Contracts v4.4.1 (access/IAccessControl.sol)\\n\\npragma solidity ^0.8.0;\\n\\n/**\\n * @dev External interface of AccessControl declared to support ERC165 detection.\\n */\\ninterface IAccessControl {\\n    /**\\n     * @dev Emitted when `newAdminRole` is set as ``role``'s admin role, replacing `previousAdminRole`\\n     *\\n     * `DEFAULT_ADMIN_ROLE` is the starting admin for all roles, despite\\n     * {RoleAdminChanged} not being emitted signaling this.\\n     *\\n     * _Available since v3.1._\\n     */\\n    event RoleAdminChanged(bytes32 indexed role, bytes32 indexed previousAdminRole, bytes32 indexed newAdminRole);\\n\\n    /**\\n     * @dev Emitted when `account` is granted `role`.\\n     *\\n     * `sender` is the account that originated the contract call, an admin role\\n     * bearer except when using {AccessControl-_setupRole}.\\n     */\\n    event RoleGranted(bytes32 indexed role, address indexed account, address indexed sender);\\n\\n    /**\\n     * @dev Emitted when `account` is revoked `role`.\\n     *\\n     * `sender` is the account that originated the contract call:\\n     *   - if using `revokeRole`, it is the admin role bearer\\n     *   - if using `renounceRole`, it is the role bearer (i.e. `account`)\\n     */\\n    event RoleRevoked(bytes32 indexed role, address indexed account, address indexed sender);\\n\\n    /**\\n     * @dev Returns `true` if `account` has been granted `role`.\\n     */\\n    function hasRole(bytes32 role, address account) external view returns (bool);\\n\\n    /**\\n     * @dev Returns the admin role that controls `role`. See {grantRole} and\\n     * {revokeRole}.\\n     *\\n     * To change a role's admin, use {AccessControl-_setRoleAdmin}.\\n     */\\n    function getRoleAdmin(bytes32 role) external view returns (bytes32);\\n\\n    /**\\n     * @dev Grants `role` to `account`.\\n     *\\n     * If `account` had not been already granted `role`, emits a {RoleGranted}\\n     * event.\\n     *\\n     * Requirements:\\n     *\\n     * - the caller must have ``role``'s admin role.\\n     */\\n    function grantRole(bytes32 role, address account) external;\\n\\n    /**\\n     * @dev Revokes `role` from `account`.\\n     *\\n     * If `account` had been granted `role`, emits a {RoleRevoked} event.\\n     *\\n     * Requirements:\\n     *\\n     * - the caller must have ``role``'s admin role.\\n     */\\n    function revokeRole(bytes32 role, address account) external;\\n\\n    /**\\n     * @dev Revokes `role` from the calling account.\\n     *\\n     * Roles are often managed via {grantRole} and {revokeRole}: this function's\\n     * purpose is to provide a mechanism for accounts to lose their privileges\\n     * if they are compromised (such as when a trusted device is misplaced).\\n     *\\n     * If the calling account had been granted `role`, emits a {RoleRevoked}\\n     * event.\\n     *\\n     * Requirements:\\n     *\\n     * - the caller must be `account`.\\n     */\\n    function renounceRole(bytes32 role, address account) external;\\n}\\n\",\"keccak256\":\"0x59ce320a585d7e1f163cd70390a0ef2ff9cec832e2aa544293a00692465a7a57\",\"license\":\"MIT\"},\"@openzeppelin/contracts/utils/Context.sol\":{\"content\":\"// SPDX-License-Identifier: MIT\\n// OpenZeppelin Contracts v4.4.1 (utils/Context.sol)\\n\\npragma solidity ^0.8.0;\\n\\n/**\\n * @dev Provides information about the current execution context, including the\\n * sender of the transaction and its data. While these are generally available\\n * via msg.sender and msg.data, they should not be accessed in such a direct\\n * manner, since when dealing with meta-transactions the account sending and\\n * paying for execution may not be the actual sender (as far as an application\\n * is concerned).\\n *\\n * This contract is only required for intermediate, library-like contracts.\\n */\\nabstract contract Context {\\n    function _msgSender() internal view virtual returns (address) {\\n        return msg.sender;\\n    }\\n\\n    function _msgData() internal view virtual returns (bytes calldata) {\\n        return msg.data;\\n    }\\n}\\n\",\"keccak256\":\"0xe2e337e6dde9ef6b680e07338c493ebea1b5fd09b43424112868e9cc1706bca7\",\"license\":\"MIT\"},\"@openzeppelin/contracts/utils/Strings.sol\":{\"content\":\"// SPDX-License-Identifier: MIT\\n// OpenZeppelin Contracts (last updated v4.8.0) (utils/Strings.sol)\\n\\npragma solidity ^0.8.0;\\n\\nimport \\\"./math/Math.sol\\\";\\n\\n/**\\n * @dev String operations.\\n */\\nlibrary Strings {\\n    bytes16 private constant _SYMBOLS = \\\"0123456789abcdef\\\";\\n    uint8 private constant _ADDRESS_LENGTH = 20;\\n\\n    /**\\n     * @dev Converts a `uint256` to its ASCII `string` decimal representation.\\n     */\\n    function toString(uint256 value) internal pure returns (string memory) {\\n        unchecked {\\n            uint256 length = Math.log10(value) + 1;\\n            string memory buffer = new string(length);\\n            uint256 ptr;\\n            /// @solidity memory-safe-assembly\\n            assembly {\\n                ptr := add(buffer, add(32, length))\\n            }\\n            while (true) {\\n                ptr--;\\n                /// @solidity memory-safe-assembly\\n                assembly {\\n                    mstore8(ptr, byte(mod(value, 10), _SYMBOLS))\\n                }\\n                value /= 10;\\n                if (value == 0) break;\\n            }\\n            return buffer;\\n        }\\n    }\\n\\n    /**\\n     * @dev Converts a `uint256` to its ASCII `string` hexadecimal representation.\\n     */\\n    function toHexString(uint256 value) internal pure returns (string memory) {\\n        unchecked {\\n            return toHexString(value, Math.log256(value) + 1);\\n        }\\n    }\\n\\n    /**\\n     * @dev Converts a `uint256` to its ASCII `string` hexadecimal representation with fixed length.\\n     */\\n    function toHexString(uint256 value, uint256 length) internal pure returns (string memory) {\\n        bytes memory buffer = new bytes(2 * length + 2);\\n        buffer[0] = \\\"0\\\";\\n        buffer[1] = \\\"x\\\";\\n        for (uint256 i = 2 * length + 1; i > 1; --i) {\\n            buffer[i] = _SYMBOLS[value & 0xf];\\n            value >>= 4;\\n        }\\n        require(value == 0, \\\"Strings: hex length insufficient\\\");\\n        return string(buffer);\\n    }\\n\\n    /**\\n     * @dev Converts an `address` with fixed length of 20 bytes to its not checksummed ASCII `string` hexadecimal representation.\\n     */\\n    function toHexString(address addr) internal pure returns (string memory) {\\n        return toHexString(uint256(uint160(addr)), _ADDRESS_LENGTH);\\n    }\\n}\\n\",\"keccak256\":\"0xa4d1d62251f8574deb032a35fc948386a9b4de74b812d4f545a1ac120486b48a\",\"license\":\"MIT\"},\"@openzeppelin/contracts/utils/introspection/ERC165.sol\":{\"content\":\"// SPDX-License-Identifier: MIT\\n// OpenZeppelin Contracts v4.4.1 (utils/introspection/ERC165.sol)\\n\\npragma solidity ^0.8.0;\\n\\nimport \\\"./IERC165.sol\\\";\\n\\n/**\\n * @dev Implementation of the {IERC165} interface.\\n *\\n * Contracts that want to implement ERC165 should inherit from this contract and override {supportsInterface} to check\\n * for the additional interface id that will be supported. For example:\\n *\\n * ```solidity\\n * function supportsInterface(bytes4 interfaceId) public view virtual override returns (bool) {\\n *     return interfaceId == type(MyInterface).interfaceId || super.supportsInterface(interfaceId);\\n * }\\n * ```\\n *\\n * Alternatively, {ERC165Storage} provides an easier to use but more expensive implementation.\\n */\\nabstract contract ERC165 is IERC165 {\\n    /**\\n     * @dev See {IERC165-supportsInterface}.\\n     */\\n    function supportsInterface(bytes4 interfaceId) public view virtual override returns (bool) {\\n        return interfaceId == type(IERC165).interfaceId;\\n    }\\n}\\n\",\"keccak256\":\"0xd10975de010d89fd1c78dc5e8a9a7e7f496198085c151648f20cba166b32582b\",\"license\":\"MIT\"},\"@openzeppelin/contracts/utils/introspection/IERC165.sol\":{\"content\":\"// SPDX-License-Identifier: MIT\\n// OpenZeppelin Contracts v4.4.1 (utils/introspection/IERC165.sol)\\n\\npragma solidity ^0.8.0;\\n\\n/**\\n * @dev Interface of the ERC165 standard, as defined in the\\n * https://eips.ethereum.org/EIPS/eip-165[EIP].\\n *\\n * Implementers can declare support of contract interfaces, which can then be\\n * queried by others ({ERC165Checker}).\\n *\\n * For an implementation, see {ERC165}.\\n */\\ninterface IERC165 {\\n    /**\\n     * @dev Returns true if this contract implements the interface defined by\\n     * `interfaceId`. See the corresponding\\n     * https://eips.ethereum.org/EIPS/eip-165#how-interfaces-are-identified[EIP section]\\n     * to learn more about how these ids are created.\\n     *\\n     * This function call must use less than 30 000 gas.\\n     */\\n    function supportsInterface(bytes4 interfaceId) external view returns (bool);\\n}\\n\",\"keccak256\":\"0x447a5f3ddc18419d41ff92b3773fb86471b1db25773e07f877f548918a185bf1\",\"license\":\"MIT\"},\"@openzeppelin/contracts/utils/math/Math.sol\":{\"content\":\"// SPDX-License-Identifier: MIT\\n// OpenZeppelin Contracts (last updated v4.8.0) (utils/math/Math.sol)\\n\\npragma solidity ^0.8.0;\\n\\n/**\\n * @dev Standard math utilities missing in the Solidity language.\\n */\\nlibrary Math {\\n    enum Rounding {\\n        Down, // Toward negative infinity\\n        Up, // Toward infinity\\n        Zero // Toward zero\\n    }\\n\\n    /**\\n     * @dev Returns the largest of two numbers.\\n     */\\n    function max(uint256 a, uint256 b) internal pure returns (uint256) {\\n        return a > b ? a : b;\\n    }\\n\\n    /**\\n     * @dev Returns the smallest of two numbers.\\n     */\\n    function min(uint256 a, uint256 b) internal pure returns (uint256) {\\n        return a < b ? a : b;\\n    }\\n\\n    /**\\n     * @dev Returns the average of two numbers. The result is rounded towards\\n     * zero.\\n     */\\n    function average(uint256 a, uint256 b) internal pure returns (uint256) {\\n        // (a + b) / 2 can overflow.\\n        return (a & b) + (a ^ b) / 2;\\n    }\\n\\n    /**\\n     * @dev Returns the ceiling of the division of two numbers.\\n     *\\n     * This differs from standard division with `/` in that it rounds up instead\\n     * of rounding down.\\n     */\\n    function ceilDiv(uint256 a, uint256 b) internal pure returns (uint256) {\\n        // (a + b - 1) / b can overflow on addition, so we distribute.\\n        return a == 0 ? 0 : (a - 1) / b + 1;\\n    }\\n\\n    /**\\n     * @notice Calculates floor(x * y / denominator) with full precision. Throws if result overflows a uint256 or denominator == 0\\n     * @dev Original credit to Remco Bloemen under MIT license (https://xn--2-umb.com/21/muldiv)\\n     * with further edits by Uniswap Labs also under MIT license.\\n     */\\n    function mulDiv(\\n        uint256 x,\\n        uint256 y,\\n        uint256 denominator\\n    ) internal pure returns (uint256 result) {\\n        unchecked {\\n            // 512-bit multiply [prod1 prod0] = x * y. Compute the product mod 2^256 and mod 2^256 - 1, then use\\n            // use the Chinese Remainder Theorem to reconstruct the 512 bit result. The result is stored in two 256\\n            // variables such that product = prod1 * 2^256 + prod0.\\n            uint256 prod0; // Least significant 256 bits of the product\\n            uint256 prod1; // Most significant 256 bits of the product\\n            assembly {\\n                let mm := mulmod(x, y, not(0))\\n                prod0 := mul(x, y)\\n                prod1 := sub(sub(mm, prod0), lt(mm, prod0))\\n            }\\n\\n            // Handle non-overflow cases, 256 by 256 division.\\n            if (prod1 == 0) {\\n                return prod0 / denominator;\\n            }\\n\\n            // Make sure the result is less than 2^256. Also prevents denominator == 0.\\n            require(denominator > prod1);\\n\\n            ///////////////////////////////////////////////\\n            // 512 by 256 division.\\n            ///////////////////////////////////////////////\\n\\n            // Make division exact by subtracting the remainder from [prod1 prod0].\\n            uint256 remainder;\\n            assembly {\\n                // Compute remainder using mulmod.\\n                remainder := mulmod(x, y, denominator)\\n\\n                // Subtract 256 bit number from 512 bit number.\\n                prod1 := sub(prod1, gt(remainder, prod0))\\n                prod0 := sub(prod0, remainder)\\n            }\\n\\n            // Factor powers of two out of denominator and compute largest power of two divisor of denominator. Always >= 1.\\n            // See https://cs.stackexchange.com/q/138556/92363.\\n\\n            // Does not overflow because the denominator cannot be zero at this stage in the function.\\n            uint256 twos = denominator & (~denominator + 1);\\n            assembly {\\n                // Divide denominator by twos.\\n                denominator := div(denominator, twos)\\n\\n                // Divide [prod1 prod0] by twos.\\n                prod0 := div(prod0, twos)\\n\\n                // Flip twos such that it is 2^256 / twos. If twos is zero, then it becomes one.\\n                twos := add(div(sub(0, twos), twos), 1)\\n            }\\n\\n            // Shift in bits from prod1 into prod0.\\n            prod0 |= prod1 * twos;\\n\\n            // Invert denominator mod 2^256. Now that denominator is an odd number, it has an inverse modulo 2^256 such\\n            // that denominator * inv = 1 mod 2^256. Compute the inverse by starting with a seed that is correct for\\n            // four bits. That is, denominator * inv = 1 mod 2^4.\\n            uint256 inverse = (3 * denominator) ^ 2;\\n\\n            // Use the Newton-Raphson iteration to improve the precision. Thanks to Hensel's lifting lemma, this also works\\n            // in modular arithmetic, doubling the correct bits in each step.\\n            inverse *= 2 - denominator * inverse; // inverse mod 2^8\\n            inverse *= 2 - denominator * inverse; // inverse mod 2^16\\n            inverse *= 2 - denominator * inverse; // inverse mod 2^32\\n            inverse *= 2 - denominator * inverse; // inverse mod 2^64\\n            inverse *= 2 - denominator * inverse; // inverse mod 2^128\\n            inverse *= 2 - denominator * inverse; // inverse mod 2^256\\n\\n            // Because the division is now exact we can divide by multiplying with the modular inverse of denominator.\\n            // This will give us the correct result modulo 2^256. Since the preconditions guarantee that the outcome is\\n            // less than 2^256, this is the final result. We don't need to compute the high bits of the result and prod1\\n            // is no longer required.\\n            result = prod0 * inverse;\\n            return result;\\n        }\\n    }\\n\\n    /**\\n     * @notice Calculates x * y / denominator with full precision, following the selected rounding direction.\\n     */\\n    function mulDiv(\\n        uint256 x,\\n        uint256 y,\\n        uint256 denominator,\\n        Rounding rounding\\n    ) internal pure returns (uint256) {\\n        uint256 result = mulDiv(x, y, denominator);\\n        if (rounding == Rounding.Up && mulmod(x, y, denominator) > 0) {\\n            result += 1;\\n        }\\n        return result;\\n    }\\n\\n    /**\\n     * @dev Returns the square root of a number. If the number is not a perfect square, the value is rounded down.\\n     *\\n     * Inspired by Henry S. Warren, Jr.'s \\\"Hacker's Delight\\\" (Chapter 11).\\n     */\\n    function sqrt(uint256 a) internal pure returns (uint256) {\\n        if (a == 0) {\\n            return 0;\\n        }\\n\\n        // For our first guess, we get the biggest power of 2 which is smaller than the square root of the target.\\n        //\\n        // We know that the \\\"msb\\\" (most significant bit) of our target number `a` is a power of 2 such that we have\\n        // `msb(a) <= a < 2*msb(a)`. This value can be written `msb(a)=2**k` with `k=log2(a)`.\\n        //\\n        // This can be rewritten `2**log2(a) <= a < 2**(log2(a) + 1)`\\n        // \\u2192 `sqrt(2**k) <= sqrt(a) < sqrt(2**(k+1))`\\n        // \\u2192 `2**(k/2) <= sqrt(a) < 2**((k+1)/2) <= 2**(k/2 + 1)`\\n        //\\n        // Consequently, `2**(log2(a) / 2)` is a good first approximation of `sqrt(a)` with at least 1 correct bit.\\n        uint256 result = 1 << (log2(a) >> 1);\\n\\n        // At this point `result` is an estimation with one bit of precision. We know the true value is a uint128,\\n        // since it is the square root of a uint256. Newton's method converges quadratically (precision doubles at\\n        // every iteration). We thus need at most 7 iteration to turn our partial result with one bit of precision\\n        // into the expected uint128 result.\\n        unchecked {\\n            result = (result + a / result) >> 1;\\n            result = (result + a / result) >> 1;\\n            result = (result + a / result) >> 1;\\n            result = (result + a / result) >> 1;\\n            result = (result + a / result) >> 1;\\n            result = (result + a / result) >> 1;\\n            result = (result + a / result) >> 1;\\n            return min(result, a / result);\\n        }\\n    }\\n\\n    /**\\n     * @notice Calculates sqrt(a), following the selected rounding direction.\\n     */\\n    function sqrt(uint256 a, Rounding rounding) internal pure returns (uint256) {\\n        unchecked {\\n            uint256 result = sqrt(a);\\n            return result + (rounding == Rounding.Up && result * result < a ? 1 : 0);\\n        }\\n    }\\n\\n    /**\\n     * @dev Return the log in base 2, rounded down, of a positive value.\\n     * Returns 0 if given 0.\\n     */\\n    function log2(uint256 value) internal pure returns (uint256) {\\n        uint256 result = 0;\\n        unchecked {\\n            if (value >> 128 > 0) {\\n                value >>= 128;\\n                result += 128;\\n            }\\n            if (value >> 64 > 0) {\\n                value >>= 64;\\n                result += 64;\\n            }\\n            if (value >> 32 > 0) {\\n                value >>= 32;\\n                result += 32;\\n            }\\n            if (value >> 16 > 0) {\\n                value >>= 16;\\n                result += 16;\\n            }\\n            if (value >> 8 > 0) {\\n                value >>= 8;\\n                result += 8;\\n            }\\n            if (value >> 4 > 0) {\\n                value >>= 4;\\n                result += 4;\\n            }\\n            if (value >> 2 > 0) {\\n                value >>= 2;\\n                result += 2;\\n            }\\n            if (value >> 1 > 0) {\\n                result += 1;\\n            }\\n        }\\n        return result;\\n    }\\n\\n    /**\\n     * @dev Return the log in base 2, following the selected rounding direction, of a positive value.\\n     * Returns 0 if given 0.\\n     */\\n    function log2(uint256 value, Rounding rounding) internal pure returns (uint256) {\\n        unchecked {\\n            uint256 result = log2(value);\\n            return result + (rounding == Rounding.Up && 1 << result < value ? 1 : 0);\\n        }\\n    }\\n\\n    /**\\n     * @dev Return the log in base 10, rounded down, of a positive value.\\n     * Returns 0 if given 0.\\n     */\\n    function log10(uint256 value) internal pure returns (uint256) {\\n        uint256 result = 0;\\n        unchecked {\\n            if (value >= 10**64) {\\n                value /= 10**64;\\n                result += 64;\\n            }\\n            if (value >= 10**32) {\\n                value /= 10**32;\\n                result += 32;\\n            }\\n            if (value >= 10**16) {\\n                value /= 10**16;\\n                result += 16;\\n            }\\n            if (value >= 10**8) {\\n                value /= 10**8;\\n                result += 8;\\n            }\\n            if (value >= 10**4) {\\n                value /= 10**4;\\n                result += 4;\\n            }\\n            if (value >= 10**2) {\\n                value /= 10**2;\\n                result += 2;\\n            }\\n            if (value >= 10**1) {\\n                result += 1;\\n            }\\n        }\\n        return result;\\n    }\\n\\n    /**\\n     * @dev Return the log in base 10, following the selected rounding direction, of a positive value.\\n     * Returns 0 if given 0.\\n     */\\n    function log10(uint256 value, Rounding rounding) internal pure returns (uint256) {\\n        unchecked {\\n            uint256 result = log10(value);\\n            return result + (rounding == Rounding.Up && 10**result < value ? 1 : 0);\\n        }\\n    }\\n\\n    /**\\n     * @dev Return the log in base 256, rounded down, of a positive value.\\n     * Returns 0 if given 0.\\n     *\\n     * Adding one to the result gives the number of pairs of hex symbols needed to represent `value` as a hex string.\\n     */\\n    function log256(uint256 value) internal pure returns (uint256) {\\n        uint256 result = 0;\\n        unchecked {\\n            if (value >> 128 > 0) {\\n                value >>= 128;\\n                result += 16;\\n            }\\n            if (value >> 64 > 0) {\\n                value >>= 64;\\n                result += 8;\\n            }\\n            if (value >> 32 > 0) {\\n                value >>= 32;\\n                result += 4;\\n            }\\n            if (value >> 16 > 0) {\\n                value >>= 16;\\n                result += 2;\\n            }\\n            if (value >> 8 > 0) {\\n                result += 1;\\n            }\\n        }\\n        return result;\\n    }\\n\\n    /**\\n     * @dev Return the log in base 10, following the selected rounding direction, of a positive value.\\n     * Returns 0 if given 0.\\n     */\\n    function log256(uint256 value, Rounding rounding) internal pure returns (uint256) {\\n        unchecked {\\n            uint256 result = log256(value);\\n            return result + (rounding == Rounding.Up && 1 << (result * 8) < value ? 1 : 0);\\n        }\\n    }\\n}\\n\",\"keccak256\":\"0xa1e8e83cd0087785df04ac79fb395d9f3684caeaf973d9e2c71caef723a3a5d6\",\"license\":\"MIT\"},\"@venusprotocol/oracle/contracts/PriceOracle.sol\":{\"content\":\"// SPDX-License-Identifier: BSD-3-Clause\\n// SPDX-FileCopyrightText: 2020 Compound Labs, Inc.\\n// SPDX-FileCopyrightText: 2022 Venus\\npragma solidity 0.8.13;\\n\\nabstract contract PriceOracle {\\n    /**\\n     * @notice Get the underlying price of a vToken asset\\n     * @param vToken The vToken address to get the underlying price of\\n     * @return The underlying asset price mantissa (scaled by 1e18).\\n     *  Zero means the price is unavailable.\\n     */\\n    function getUnderlyingPrice(address vToken) external view virtual returns (uint256);\\n\\n    function updatePrice(address vToken) external virtual;\\n}\\n\",\"keccak256\":\"0xf48847cd872ff2036b952a3b4b2e506ae3f56f6ba0692f54dc741a23990ccd6d\",\"license\":\"BSD-3-Clause\"},\"contracts/ComptrollerInterface.sol\":{\"content\":\"// SPDX-License-Identifier: BSD-3-Clause\\npragma solidity ^0.8.10;\\n\\nimport \\\"@venusprotocol/oracle/contracts/PriceOracle.sol\\\";\\nimport \\\"./VToken.sol\\\";\\n\\nabstract contract ComptrollerInterface {\\n    /// @notice Indicator that this is a Comptroller contract (for inspection)\\n    bool public constant isComptroller = true;\\n\\n    /*** Assets You Are In ***/\\n\\n    function enterMarkets(address[] calldata vTokens) external virtual returns (uint256[] memory);\\n\\n    function exitMarket(address vToken) external virtual returns (uint256);\\n\\n    /*** Policy Hooks ***/\\n\\n    function preMintHook(\\n        address vToken,\\n        address minter,\\n        uint256 mintAmount\\n    ) external virtual;\\n\\n    function preRedeemHook(\\n        address vToken,\\n        address redeemer,\\n        uint256 redeemTokens\\n    ) external virtual;\\n\\n    function preBorrowHook(\\n        address vToken,\\n        address borrower,\\n        uint256 borrowAmount\\n    ) external virtual;\\n\\n    function preRepayHook(\\n        address vToken,\\n        address payer,\\n        address borrower,\\n        uint256 repayAmount\\n    ) external virtual;\\n\\n    function preLiquidateHook(\\n        address vTokenBorrowed,\\n        address vTokenCollateral,\\n        address liquidator,\\n        address borrower,\\n        uint256 repayAmount,\\n        bool skipLiquidityCheck\\n    ) external virtual;\\n\\n    function preSeizeHook(\\n        address vTokenCollateral,\\n        address vTokenBorrowed,\\n        address liquidator,\\n        address borrower,\\n        uint256 seizeTokens\\n    ) external virtual;\\n\\n    function preTransferHook(\\n        address vToken,\\n        address src,\\n        address dst,\\n        uint256 transferTokens\\n    ) external virtual;\\n\\n    /*** Liquidity/Liquidation Calculations ***/\\n\\n    function liquidateCalculateSeizeTokens(\\n        address vTokenBorrowed,\\n        address vTokenCollateral,\\n        uint256 repayAmount\\n    ) external view virtual returns (uint256, uint256);\\n\\n    function getAllMarkets() external view virtual returns (VToken[] memory);\\n}\\n\\nabstract contract ComptrollerViewInterface {\\n    function markets(address) external view virtual returns (bool, uint256);\\n\\n    function oracle() external view virtual returns (PriceOracle);\\n\\n    function getAssetsIn(address) external view virtual returns (VToken[] memory);\\n\\n    function compSpeeds(address) external view virtual returns (uint256);\\n\\n    function pauseGuardian() external view virtual returns (address);\\n\\n    function priceOracle() external view virtual returns (address);\\n\\n    function closeFactorMantissa() external view virtual returns (uint256);\\n\\n    function maxAssets() external view virtual returns (uint256);\\n\\n    function liquidationIncentiveMantissa() external view virtual returns (uint256);\\n\\n    function minLiquidatableCollateral() external view virtual returns (uint256);\\n\\n    function getXVSRewardsByMarket(address) external view virtual returns (uint256, uint256);\\n}\\n\",\"keccak256\":\"0x1eec3189ae5eb07aed1f75467e5b93d7f33b0f835a4f9bf90188b7d84152c2c1\",\"license\":\"BSD-3-Clause\"},\"contracts/ErrorReporter.sol\":{\"content\":\"// SPDX-License-Identifier: BSD-3-Clause\\npragma solidity 0.8.13;\\n\\ncontract TokenErrorReporter {\\n    uint256 public constant NO_ERROR = 0; // support legacy return codes\\n\\n    error TransferComptrollerRejection(uint256 errorCode);\\n    error TransferNotAllowed();\\n    error TransferNotEnough();\\n    error TransferTooMuch();\\n\\n    error MintComptrollerRejection(uint256 errorCode);\\n    error MintFreshnessCheck();\\n\\n    error RedeemComptrollerRejection(uint256 errorCode);\\n    error RedeemFreshnessCheck();\\n    error RedeemTransferOutNotPossible();\\n\\n    error BorrowComptrollerRejection(uint256 errorCode);\\n    error BorrowFreshnessCheck();\\n    error BorrowCashNotAvailable();\\n\\n    error RepayBorrowComptrollerRejection(uint256 errorCode);\\n    error RepayBorrowFreshnessCheck();\\n\\n    error HealBorrowUnauthorized();\\n    error ForceLiquidateBorrowUnauthorized();\\n\\n    error LiquidateComptrollerRejection(uint256 errorCode);\\n    error LiquidateFreshnessCheck();\\n    error LiquidateCollateralFreshnessCheck();\\n    error LiquidateAccrueBorrowInterestFailed(uint256 errorCode);\\n    error LiquidateAccrueCollateralInterestFailed(uint256 errorCode);\\n    error LiquidateLiquidatorIsBorrower();\\n    error LiquidateCloseAmountIsZero();\\n    error LiquidateCloseAmountIsUintMax();\\n    error LiquidateRepayBorrowFreshFailed(uint256 errorCode);\\n\\n    error LiquidateSeizeComptrollerRejection(uint256 errorCode);\\n    error LiquidateSeizeLiquidatorIsBorrower();\\n\\n    error SetComptrollerOwnerCheck();\\n\\n    error SetProtocolSeizeShareUnauthorized();\\n    error ProtocolSeizeShareTooBig();\\n\\n    error SetReserveFactorAdminCheck();\\n    error SetReserveFactorFreshCheck();\\n    error SetReserveFactorBoundsCheck();\\n\\n    error AddReservesFactorFreshCheck(uint256 actualAddAmount);\\n\\n    error ReduceReservesAdminCheck();\\n    error ReduceReservesFreshCheck();\\n    error ReduceReservesCashNotAvailable();\\n    error ReduceReservesCashValidation();\\n\\n    error SetInterestRateModelOwnerCheck();\\n    error SetInterestRateModelFreshCheck();\\n}\\n\",\"keccak256\":\"0x8fbd03b4bafb547ab51e17a3bcbc409eb4f83ae23dc807b0a87dc6b39bbeaac2\",\"license\":\"BSD-3-Clause\"},\"contracts/ExponentialNoError.sol\":{\"content\":\"// SPDX-License-Identifier: BSD-3-Clause\\npragma solidity 0.8.13;\\n\\n/**\\n * @title Exponential module for storing fixed-precision decimals\\n * @author Compound\\n * @notice Exp is a struct which stores decimals with a fixed precision of 18 decimal places.\\n *         Thus, if we wanted to store the 5.1, mantissa would store 5.1e18. That is:\\n *         `Exp({mantissa: 5100000000000000000})`.\\n */\\ncontract ExponentialNoError {\\n    uint256 constant expScale = 1e18;\\n    uint256 constant doubleScale = 1e36;\\n    uint256 constant halfExpScale = expScale / 2;\\n    uint256 constant mantissaOne = expScale;\\n\\n    struct Exp {\\n        uint256 mantissa;\\n    }\\n\\n    struct Double {\\n        uint256 mantissa;\\n    }\\n\\n    /**\\n     * @dev Truncates the given exp to a whole number value.\\n     *      For example, truncate(Exp{mantissa: 15 * expScale}) = 15\\n     */\\n    function truncate(Exp memory exp) internal pure returns (uint256) {\\n        // Note: We are not using careful math here as we're performing a division that cannot fail\\n        return exp.mantissa / expScale;\\n    }\\n\\n    /**\\n     * @dev Multiply an Exp by a scalar, then truncate to return an unsigned integer.\\n     */\\n    function mul_ScalarTruncate(Exp memory a, uint256 scalar) internal pure returns (uint256) {\\n        Exp memory product = mul_(a, scalar);\\n        return truncate(product);\\n    }\\n\\n    /**\\n     * @dev Multiply an Exp by a scalar, truncate, then add an to an unsigned integer, returning an unsigned integer.\\n     */\\n    function mul_ScalarTruncateAddUInt(\\n        Exp memory a,\\n        uint256 scalar,\\n        uint256 addend\\n    ) internal pure returns (uint256) {\\n        Exp memory product = mul_(a, scalar);\\n        return add_(truncate(product), addend);\\n    }\\n\\n    /**\\n     * @dev Checks if first Exp is less than second Exp.\\n     */\\n    function lessThanExp(Exp memory left, Exp memory right) internal pure returns (bool) {\\n        return left.mantissa < right.mantissa;\\n    }\\n\\n    /**\\n     * @dev Checks if left Exp <= right Exp.\\n     */\\n    function lessThanOrEqualExp(Exp memory left, Exp memory right) internal pure returns (bool) {\\n        return left.mantissa <= right.mantissa;\\n    }\\n\\n    /**\\n     * @dev Checks if left Exp > right Exp.\\n     */\\n    function greaterThanExp(Exp memory left, Exp memory right) internal pure returns (bool) {\\n        return left.mantissa > right.mantissa;\\n    }\\n\\n    /**\\n     * @dev returns true if Exp is exactly zero\\n     */\\n    function isZeroExp(Exp memory value) internal pure returns (bool) {\\n        return value.mantissa == 0;\\n    }\\n\\n    function safe224(uint256 n, string memory errorMessage) internal pure returns (uint224) {\\n        require(n < 2**224, errorMessage);\\n        return uint224(n);\\n    }\\n\\n    function safe32(uint256 n, string memory errorMessage) internal pure returns (uint32) {\\n        require(n < 2**32, errorMessage);\\n        return uint32(n);\\n    }\\n\\n    function add_(Exp memory a, Exp memory b) internal pure returns (Exp memory) {\\n        return Exp({ mantissa: add_(a.mantissa, b.mantissa) });\\n    }\\n\\n    function add_(Double memory a, Double memory b) internal pure returns (Double memory) {\\n        return Double({ mantissa: add_(a.mantissa, b.mantissa) });\\n    }\\n\\n    function add_(uint256 a, uint256 b) internal pure returns (uint256) {\\n        return a + b;\\n    }\\n\\n    function sub_(Exp memory a, Exp memory b) internal pure returns (Exp memory) {\\n        return Exp({ mantissa: sub_(a.mantissa, b.mantissa) });\\n    }\\n\\n    function sub_(Double memory a, Double memory b) internal pure returns (Double memory) {\\n        return Double({ mantissa: sub_(a.mantissa, b.mantissa) });\\n    }\\n\\n    function sub_(uint256 a, uint256 b) internal pure returns (uint256) {\\n        return a - b;\\n    }\\n\\n    function mul_(Exp memory a, Exp memory b) internal pure returns (Exp memory) {\\n        return Exp({ mantissa: mul_(a.mantissa, b.mantissa) / expScale });\\n    }\\n\\n    function mul_(Exp memory a, uint256 b) internal pure returns (Exp memory) {\\n        return Exp({ mantissa: mul_(a.mantissa, b) });\\n    }\\n\\n    function mul_(uint256 a, Exp memory b) internal pure returns (uint256) {\\n        return mul_(a, b.mantissa) / expScale;\\n    }\\n\\n    function mul_(Double memory a, Double memory b) internal pure returns (Double memory) {\\n        return Double({ mantissa: mul_(a.mantissa, b.mantissa) / doubleScale });\\n    }\\n\\n    function mul_(Double memory a, uint256 b) internal pure returns (Double memory) {\\n        return Double({ mantissa: mul_(a.mantissa, b) });\\n    }\\n\\n    function mul_(uint256 a, Double memory b) internal pure returns (uint256) {\\n        return mul_(a, b.mantissa) / doubleScale;\\n    }\\n\\n    function mul_(uint256 a, uint256 b) internal pure returns (uint256) {\\n        return a * b;\\n    }\\n\\n    function div_(Exp memory a, Exp memory b) internal pure returns (Exp memory) {\\n        return Exp({ mantissa: div_(mul_(a.mantissa, expScale), b.mantissa) });\\n    }\\n\\n    function div_(Exp memory a, uint256 b) internal pure returns (Exp memory) {\\n        return Exp({ mantissa: div_(a.mantissa, b) });\\n    }\\n\\n    function div_(uint256 a, Exp memory b) internal pure returns (uint256) {\\n        return div_(mul_(a, expScale), b.mantissa);\\n    }\\n\\n    function div_(Double memory a, Double memory b) internal pure returns (Double memory) {\\n        return Double({ mantissa: div_(mul_(a.mantissa, doubleScale), b.mantissa) });\\n    }\\n\\n    function div_(Double memory a, uint256 b) internal pure returns (Double memory) {\\n        return Double({ mantissa: div_(a.mantissa, b) });\\n    }\\n\\n    function div_(uint256 a, Double memory b) internal pure returns (uint256) {\\n        return div_(mul_(a, doubleScale), b.mantissa);\\n    }\\n\\n    function div_(uint256 a, uint256 b) internal pure returns (uint256) {\\n        return a / b;\\n    }\\n\\n    function fraction(uint256 a, uint256 b) internal pure returns (Double memory) {\\n        return Double({ mantissa: div_(mul_(a, doubleScale), b) });\\n    }\\n}\\n\",\"keccak256\":\"0x04cff4b2c96e3362a269e203b2af0c9407698bca663b7c9e1d03134b83a02533\",\"license\":\"BSD-3-Clause\"},\"contracts/Governance/AccessControlManager.sol\":{\"content\":\"// SPDX-License-Identifier: BSD-3-Clause\\npragma solidity 0.8.13;\\nimport \\\"@openzeppelin/contracts/access/AccessControl.sol\\\";\\n\\n/**\\n * @title Venus Access Control Contract\\n * @author 0xLucian\\n * @dev This contract is a wrapper of OpenZeppelin AccessControl\\n *\\t\\textending it in a way to standartize access control\\n *\\t\\twithin Venus Smart Contract Ecosystem\\n */\\ncontract AccessControlManager is AccessControl {\\n    /// @notice Emitted when an account is given a permission to a certain contract function\\n    /// @dev If contract address is 0x000..0 this means that the account is a default admin of this function and\\n    /// can call any contract function with this signature\\n    event PermissionGranted(address account, address contractAddress, string functionSig);\\n\\n    /// @notice Emitted when an account is revoked a permission to a certain contract function\\n    event PermissionRevoked(address account, address contractAddress, string functionSig);\\n\\n    constructor() {\\n        // Grant the contract deployer the default admin role: it will be able\\n        // to grant and revoke any roles\\n        _setupRole(DEFAULT_ADMIN_ROLE, msg.sender);\\n    }\\n\\n    /**\\n     * @notice Verifies if the given account can call a contract's guarded function\\n     * @dev Since restricted contracts using this function as a permission hook, we can get contracts address with msg.sender\\n     * @param account for which call permissions will be checked\\n     * @param functionSig restricted function signature e.g. \\\"functionName(uint256,bool)\\\"\\n     * @return false if the user account cannot call the particular contract function\\n     *\\n     */\\n    function isAllowedToCall(address account, string memory functionSig) public view returns (bool) {\\n        bytes32 role = keccak256(abi.encodePacked(msg.sender, functionSig));\\n\\n        if (hasRole(role, account)) {\\n            return true;\\n        } else {\\n            role = keccak256(abi.encodePacked(address(0), functionSig));\\n            return hasRole(role, account);\\n        }\\n    }\\n\\n    /**\\n     * @notice Verifies if the given account can call a contract's guarded function\\n     * @dev This function is used as a view function to check permissions rather than contract hook for access restriction check.\\n     * @param account for which call permissions will be checked against\\n     * @param contractAddress address of the restricted contract\\n     * @param functionSig signature of the restricted function e.g. \\\"functionName(uint256,bool)\\\"\\n     * @return false if the user account cannot call the particular contract function\\n     */\\n    function hasPermission(\\n        address account,\\n        address contractAddress,\\n        string memory functionSig\\n    ) public view returns (bool) {\\n        bytes32 role = keccak256(abi.encodePacked(contractAddress, functionSig));\\n        return hasRole(role, account);\\n    }\\n\\n    /**\\n     * @notice Gives a function call permission to one single account\\n     * @dev this function can be called only from Role Admin or DEFAULT_ADMIN_ROLE\\n     * @param contractAddress address of contract for which call permissions will be granted\\n     * @dev if contractAddress is zero address, the account can access the specified function\\n     *      on **any** contract managed by this ACL\\n     * @param functionSig signature e.g. \\\"functionName(uint256,bool)\\\"\\n     * @param accountToPermit account that will be given access to the contract function\\n     * @custom:events Emits a {RoleGranted} and {PermissionGranted} events.\\n     */\\n    function giveCallPermission(\\n        address contractAddress,\\n        string memory functionSig,\\n        address accountToPermit\\n    ) public {\\n        bytes32 role = keccak256(abi.encodePacked(contractAddress, functionSig));\\n        grantRole(role, accountToPermit);\\n        emit PermissionGranted(accountToPermit, contractAddress, functionSig);\\n    }\\n\\n    /**\\n     * @notice Revokes an account's permission to a particular function call\\n     * @dev this function can be called only from Role Admin or DEFAULT_ADMIN_ROLE\\n     * \\t\\tMay emit a {RoleRevoked} event.\\n     * @param contractAddress address of contract for which call permissions will be revoked\\n     * @param functionSig signature e.g. \\\"functionName(uint256,bool)\\\"\\n     * @custom:events Emits {RoleRevoked} and {PermissionRevoked} events.\\n     */\\n    function revokeCallPermission(\\n        address contractAddress,\\n        string memory functionSig,\\n        address accountToRevoke\\n    ) public {\\n        bytes32 role = keccak256(abi.encodePacked(contractAddress, functionSig));\\n        revokeRole(role, accountToRevoke);\\n        emit PermissionRevoked(accountToRevoke, contractAddress, functionSig);\\n    }\\n}\\n\",\"keccak256\":\"0xf02281de0ad0b75fe8fcf7515af784c02ea066255ec92b0e1b84f2357e17cb57\",\"license\":\"BSD-3-Clause\"},\"contracts/InterestRateModel.sol\":{\"content\":\"// SPDX-License-Identifier: BSD-3-Clause\\npragma solidity ^0.8.10;\\n\\n/**\\n * @title Compound's InterestRateModel Interface\\n * @author Compound\\n */\\nabstract contract InterestRateModel {\\n    /// @notice Indicator that this is an InterestRateModel contract (for inspection)\\n    bool public constant isInterestRateModel = true;\\n\\n    /**\\n     * @notice Calculates the current borrow interest rate per block\\n     * @param cash The total amount of cash the market has\\n     * @param borrows The total amount of borrows the market has outstanding\\n     * @param reserves The total amount of reserves the market has\\n     * @return The borrow rate per block (as a percentage, and scaled by 1e18)\\n     */\\n    function getBorrowRate(\\n        uint256 cash,\\n        uint256 borrows,\\n        uint256 reserves\\n    ) external view virtual returns (uint256);\\n\\n    /**\\n     * @notice Calculates the current supply interest rate per block\\n     * @param cash The total amount of cash the market has\\n     * @param borrows The total amount of borrows the market has outstanding\\n     * @param reserves The total amount of reserves the market has\\n     * @param reserveFactorMantissa The current reserve factor the market has\\n     * @return The supply rate per block (as a percentage, and scaled by 1e18)\\n     */\\n    function getSupplyRate(\\n        uint256 cash,\\n        uint256 borrows,\\n        uint256 reserves,\\n        uint256 reserveFactorMantissa\\n    ) external view virtual returns (uint256);\\n}\\n\",\"keccak256\":\"0xcae77bd641abf402dfcdb69c6e2418e26d4dc75ef454b1baf88271bd32724997\",\"license\":\"BSD-3-Clause\"},\"contracts/RiskFund/IProtocolShareReserve.sol\":{\"content\":\"// SPDX-License-Identifier: BSD-3-Clause\\npragma solidity 0.8.13;\\n\\ninterface IProtocolShareReserve {\\n    function updateAssetsState(address comptroller, address asset) external;\\n}\\n\",\"keccak256\":\"0xbd35ca4d8743872e18ea6bc14bb7d4aedb35c8e56b04f18600e197132f762d60\",\"license\":\"BSD-3-Clause\"},\"contracts/VToken.sol\":{\"content\":\"// SPDX-License-Identifier: BSD-3-Clause\\npragma solidity 0.8.13;\\n\\nimport \\\"@openzeppelin/contracts-upgradeable/access/Ownable2StepUpgradeable.sol\\\";\\nimport \\\"@openzeppelin/contracts-upgradeable/token/ERC20/utils/SafeERC20Upgradeable.sol\\\";\\n\\nimport \\\"./ComptrollerInterface.sol\\\";\\nimport \\\"./VTokenInterfaces.sol\\\";\\nimport \\\"./ErrorReporter.sol\\\";\\nimport \\\"./InterestRateModel.sol\\\";\\nimport \\\"./ExponentialNoError.sol\\\";\\nimport \\\"./Governance/AccessControlManager.sol\\\";\\nimport \\\"./RiskFund/IProtocolShareReserve.sol\\\";\\n\\n/**\\n * @title Venus VToken Contract\\n * @author Venus Dev Team\\n */\\ncontract VToken is Ownable2StepUpgradeable, VTokenInterface, ExponentialNoError, TokenErrorReporter {\\n    using SafeERC20Upgradeable for IERC20Upgradeable;\\n\\n    /// @custom:oz-upgrades-unsafe-allow constructor\\n    constructor() {\\n        // Note that the contract is upgradeable. Use initialize() or reinitializers\\n        // to set the state variables.\\n        _disableInitializers();\\n    }\\n\\n    /**\\n     * @notice Construct a new money market\\n     * @param underlying_ The address of the underlying asset\\n     * @param comptroller_ The address of the Comptroller\\n     * @param interestRateModel_ The address of the interest rate model\\n     * @param initialExchangeRateMantissa_ The initial exchange rate, scaled by 1e18\\n     * @param name_ ERC-20 name of this token\\n     * @param symbol_ ERC-20 symbol of this token\\n     * @param decimals_ ERC-20 decimal precision of this token\\n     * @param admin_ Address of the administrator of this token\\n     * @param riskManagement Addresses of risk fund contracts\\n     */\\n    function initialize(\\n        address underlying_,\\n        ComptrollerInterface comptroller_,\\n        InterestRateModel interestRateModel_,\\n        uint256 initialExchangeRateMantissa_,\\n        string memory name_,\\n        string memory symbol_,\\n        uint8 decimals_,\\n        address payable admin_,\\n        AccessControlManager accessControlManager_,\\n        RiskManagementInit memory riskManagement\\n    ) public initializer {\\n        // Initialize the market\\n        _initialize(\\n            underlying_,\\n            comptroller_,\\n            interestRateModel_,\\n            initialExchangeRateMantissa_,\\n            name_,\\n            symbol_,\\n            decimals_,\\n            admin_,\\n            accessControlManager_,\\n            riskManagement\\n        );\\n    }\\n\\n    /**\\n     * @notice Initialize the money market\\n     * @param underlying_ The address of the underlying asset\\n     * @param comptroller_ The address of the Comptroller\\n     * @param interestRateModel_ The address of the interest rate model\\n     * @param initialExchangeRateMantissa_ The initial exchange rate, scaled by 1e18\\n     * @param name_ EIP-20 name of this token\\n     * @param symbol_ EIP-20 symbol of this token\\n     * @param decimals_ EIP-20 decimal precision of this token\\n     */\\n    function _initialize(\\n        address underlying_,\\n        ComptrollerInterface comptroller_,\\n        InterestRateModel interestRateModel_,\\n        uint256 initialExchangeRateMantissa_,\\n        string memory name_,\\n        string memory symbol_,\\n        uint8 decimals_,\\n        address payable admin_,\\n        AccessControlManager accessControlManager_,\\n        VTokenInterface.RiskManagementInit memory riskManagement\\n    ) internal onlyInitializing {\\n        __Ownable2Step_init();\\n        require(accrualBlockNumber == 0 && borrowIndex == 0, \\\"market may only be initialized once\\\");\\n\\n        _setAccessControlAddress(accessControlManager_);\\n\\n        // Set initial exchange rate\\n        initialExchangeRateMantissa = initialExchangeRateMantissa_;\\n        require(initialExchangeRateMantissa > 0, \\\"initial exchange rate must be greater than zero.\\\");\\n\\n        _setComptroller(comptroller_);\\n\\n        // Initialize block number and borrow index (block number mocks depend on comptroller being set)\\n        accrualBlockNumber = _getBlockNumber();\\n        borrowIndex = mantissaOne;\\n\\n        // Set the interest rate model (depends on block number / borrow index)\\n        _setInterestRateModelFresh(interestRateModel_);\\n\\n        name = name_;\\n        symbol = symbol_;\\n        decimals = decimals_;\\n        shortfall = riskManagement.shortfall;\\n        riskFund = riskManagement.riskFund;\\n        protocolShareReserve = riskManagement.protocolShareReserve;\\n        protocolSeizeShareMantissa = 5e16; // 5%\\n\\n        // Set underlying and sanity check it\\n        underlying = underlying_;\\n        IERC20Upgradeable(underlying).totalSupply();\\n\\n        // The counter starts true to prevent changing it from zero to non-zero (i.e. smaller cost/refund)\\n        _notEntered = true;\\n        _transferOwnership(admin_);\\n    }\\n\\n    /**\\n     * @notice Transfer `tokens` tokens from `src` to `dst` by `spender`\\n     * @dev Called by both `transfer` and `transferFrom` internally\\n     * @param spender The address of the account performing the transfer\\n     * @param src The address of the source account\\n     * @param dst The address of the destination account\\n     * @param tokens The number of tokens to transfer\\n     */\\n    function _transferTokens(\\n        address spender,\\n        address src,\\n        address dst,\\n        uint256 tokens\\n    ) internal {\\n        /* Fail if transfer not allowed */\\n        comptroller.preTransferHook(address(this), src, dst, tokens);\\n\\n        /* Do not allow self-transfers */\\n        if (src == dst) {\\n            revert TransferNotAllowed();\\n        }\\n\\n        /* Get the allowance, infinite for the account owner */\\n        uint256 startingAllowance;\\n        if (spender == src) {\\n            startingAllowance = type(uint256).max;\\n        } else {\\n            startingAllowance = transferAllowances[src][spender];\\n        }\\n\\n        /* Do the calculations, checking for {under,over}flow */\\n        uint256 allowanceNew = startingAllowance - tokens;\\n        uint256 srvTokensNew = accountTokens[src] - tokens;\\n        uint256 dstTokensNew = accountTokens[dst] + tokens;\\n\\n        /////////////////////////\\n        // EFFECTS & INTERACTIONS\\n\\n        accountTokens[src] = srvTokensNew;\\n        accountTokens[dst] = dstTokensNew;\\n\\n        /* Eat some of the allowance (if necessary) */\\n        if (startingAllowance != type(uint256).max) {\\n            transferAllowances[src][spender] = allowanceNew;\\n        }\\n\\n        /* We emit a Transfer event */\\n        emit Transfer(src, dst, tokens);\\n    }\\n\\n    /**\\n     * @notice Transfer `amount` tokens from `msg.sender` to `dst`\\n     * @param dst The address of the destination account\\n     * @param amount The number of tokens to transfer\\n     * @return success True if the transfer suceeded, reverts otherwise\\n     * @custom:events Emits Transfer event on success\\n     * @custom:error TransferNotAllowed is thrown if trying to transfer to self\\n     * @custom:access Not restricted\\n     */\\n    function transfer(address dst, uint256 amount) external override nonReentrant returns (bool) {\\n        _transferTokens(msg.sender, msg.sender, dst, amount);\\n        return true;\\n    }\\n\\n    /**\\n     * @notice Transfer `amount` tokens from `src` to `dst`\\n     * @param src The address of the source account\\n     * @param dst The address of the destination account\\n     * @param amount The number of tokens to transfer\\n     * @return success True if the transfer suceeded, reverts otherwise\\n     * @custom:events Emits Transfer event on success\\n     * @custom:error TransferNotAllowed is thrown if trying to transfer to self\\n     * @custom:access Not restricted\\n     */\\n    function transferFrom(\\n        address src,\\n        address dst,\\n        uint256 amount\\n    ) external override nonReentrant returns (bool) {\\n        _transferTokens(msg.sender, src, dst, amount);\\n        return true;\\n    }\\n\\n    /**\\n     * @notice Approve `spender` to transfer up to `amount` from `src`\\n     * @dev This will overwrite the approval amount for `spender`\\n     *  and is subject to issues noted [here](https://eips.ethereum.org/EIPS/eip-20#approve)\\n     * @param spender The address of the account which may transfer tokens\\n     * @param amount The number of tokens that are approved (uint256.max means infinite)\\n     * @return success Whether or not the approval succeeded\\n     * @custom:events Emits Approval event\\n     * @custom:access Not restricted\\n     */\\n    function approve(address spender, uint256 amount) external override returns (bool) {\\n        address src = msg.sender;\\n        transferAllowances[src][spender] = amount;\\n        emit Approval(src, spender, amount);\\n        return true;\\n    }\\n\\n    /**\\n     * @notice Get the current allowance from `owner` for `spender`\\n     * @param owner The address of the account which owns the tokens to be spent\\n     * @param spender The address of the account which may transfer tokens\\n     * @return amount The number of tokens allowed to be spent (-1 means infinite)\\n     */\\n    function allowance(address owner, address spender) external view override returns (uint256) {\\n        return transferAllowances[owner][spender];\\n    }\\n\\n    /**\\n     * @notice Get the token balance of the `owner`\\n     * @param owner The address of the account to query\\n     * @return amount The number of tokens owned by `owner`\\n     */\\n    function balanceOf(address owner) external view override returns (uint256) {\\n        return accountTokens[owner];\\n    }\\n\\n    /**\\n     * @notice Get the underlying balance of the `owner`\\n     * @dev This also accrues interest in a transaction\\n     * @param owner The address of the account to query\\n     * @return amount The amount of underlying owned by `owner`\\n     */\\n    function balanceOfUnderlying(address owner) external override returns (uint256) {\\n        Exp memory exchangeRate = Exp({ mantissa: exchangeRateCurrent() });\\n        return mul_ScalarTruncate(exchangeRate, accountTokens[owner]);\\n    }\\n\\n    /**\\n     * @notice Get a snapshot of the account's balances, and the cached exchange rate\\n     * @dev This is used by comptroller to more efficiently perform liquidity checks.\\n     * @param account Address of the account to snapshot\\n     * @return error Always NO_ERROR for compatilibily with Venus core tooling\\n     * @return vTokenBalance User's balance of vTokens\\n     * @return borrowBalance Amount owed in terms of underlying\\n     * @return exchangeRate Stored exchange rate\\n     */\\n    function getAccountSnapshot(address account)\\n        external\\n        view\\n        override\\n        returns (\\n            uint256 error,\\n            uint256 vTokenBalance,\\n            uint256 borrowBalance,\\n            uint256 exchangeRate\\n        )\\n    {\\n        return (NO_ERROR, accountTokens[account], _borrowBalanceStored(account), _exchangeRateStored());\\n    }\\n\\n    /**\\n     * @dev Function to simply retrieve block number\\n     *  This exists mainly for inheriting test contracts to stub this result.\\n     */\\n    function _getBlockNumber() internal view virtual returns (uint256) {\\n        return block.number;\\n    }\\n\\n    /**\\n     * @notice Returns the current per-block borrow interest rate for this vToken\\n     * @return rate The borrow interest rate per block, scaled by 1e18\\n     */\\n    function borrowRatePerBlock() external view override returns (uint256) {\\n        return interestRateModel.getBorrowRate(_getCashPrior(), totalBorrows, totalReserves);\\n    }\\n\\n    /**\\n     * @notice Returns the current per-block supply interest rate for this v\\n     * @return rate The supply interest rate per block, scaled by 1e18\\n     */\\n    function supplyRatePerBlock() external view override returns (uint256) {\\n        return interestRateModel.getSupplyRate(_getCashPrior(), totalBorrows, totalReserves, reserveFactorMantissa);\\n    }\\n\\n    /**\\n     * @notice Returns the current total borrows plus accrued interest\\n     * @return totalBorrows The total borrows with interest\\n     */\\n    function totalBorrowsCurrent() external override nonReentrant returns (uint256) {\\n        accrueInterest();\\n        return totalBorrows;\\n    }\\n\\n    /**\\n     * @notice Accrue interest to updated borrowIndex and then calculate account's borrow balance using the updated borrowIndex\\n     * @param account The address whose balance should be calculated after updating borrowIndex\\n     * @return borrowBalance The calculated balance\\n     */\\n    function borrowBalanceCurrent(address account) external override nonReentrant returns (uint256) {\\n        accrueInterest();\\n        return _borrowBalanceStored(account);\\n    }\\n\\n    /**\\n     * @notice Return the borrow balance of account based on stored data\\n     * @param account The address whose balance should be calculated\\n     * @return borrowBalance The calculated balance\\n     */\\n    function borrowBalanceStored(address account) public view override returns (uint256) {\\n        return _borrowBalanceStored(account);\\n    }\\n\\n    /**\\n     * @notice Return the borrow balance of account based on stored data\\n     * @param account The address whose balance should be calculated\\n     * @return borrowBalance the calculated balance\\n     */\\n    function _borrowBalanceStored(address account) internal view returns (uint256) {\\n        /* Get borrowBalance and borrowIndex */\\n        BorrowSnapshot storage borrowSnapshot = accountBorrows[account];\\n\\n        /* If borrowBalance = 0 then borrowIndex is likely also 0.\\n         * Rather than failing the calculation with a division by 0, we immediately return 0 in this case.\\n         */\\n        if (borrowSnapshot.principal == 0) {\\n            return 0;\\n        }\\n\\n        /* Calculate new borrow balance using the interest index:\\n         *  recentBorrowBalance = borrower.borrowBalance * market.borrowIndex / borrower.borrowIndex\\n         */\\n        uint256 principalTimesIndex = borrowSnapshot.principal * borrowIndex;\\n\\n        return principalTimesIndex / borrowSnapshot.interestIndex;\\n    }\\n\\n    /**\\n     * @notice Accrue interest then return the up-to-date exchange rate\\n     * @return exchangeRate Calculated exchange rate scaled by 1e18\\n     */\\n    function exchangeRateCurrent() public override nonReentrant returns (uint256) {\\n        accrueInterest();\\n        return _exchangeRateStored();\\n    }\\n\\n    /**\\n     * @notice Calculates the exchange rate from the underlying to the VToken\\n     * @dev This function does not accrue interest before calculating the exchange rate\\n     * @return exchangeRate Calculated exchange rate scaled by 1e18\\n     */\\n    function exchangeRateStored() public view override returns (uint256) {\\n        return _exchangeRateStored();\\n    }\\n\\n    /**\\n     * @notice Calculates the exchange rate from the underlying to the VToken\\n     * @dev This function does not accrue interest before calculating the exchange rate\\n     * @return exchangeRate Calculated exchange rate scaled by 1e18\\n     */\\n    function _exchangeRateStored() internal view virtual returns (uint256) {\\n        uint256 _totalSupply = totalSupply;\\n        if (_totalSupply == 0) {\\n            /*\\n             * If there are no tokens minted:\\n             *  exchangeRate = initialExchangeRate\\n             */\\n            return initialExchangeRateMantissa;\\n        } else {\\n            /*\\n             * Otherwise:\\n             *  exchangeRate = (totalCash + totalBorrows + badDebt - totalReserves) / totalSupply\\n             */\\n            uint256 totalCash = _getCashPrior();\\n            uint256 cashPlusBorrowsMinusReserves = totalCash + totalBorrows + badDebt - totalReserves;\\n            uint256 exchangeRate = (cashPlusBorrowsMinusReserves * expScale) / _totalSupply;\\n\\n            return exchangeRate;\\n        }\\n    }\\n\\n    /**\\n     * @notice Get cash balance of this vToken in the underlying asset\\n     * @return cash The quantity of underlying asset owned by this contract\\n     */\\n    function getCash() external view override returns (uint256) {\\n        return _getCashPrior();\\n    }\\n\\n    /**\\n     * @notice Applies accrued interest to total borrows and reserves\\n     * @dev This calculates interest accrued from the last checkpointed block\\n     *   up to the current block and writes new checkpoint to storage.\\n     * @return Always NO_ERROR\\n     * @custom:events Emits AccrueInterest event on success\\n     * @custom:access Not restricted\\n     */\\n    function accrueInterest() public virtual override returns (uint256) {\\n        /* Remember the initial block number */\\n        uint256 currentBlockNumber = _getBlockNumber();\\n        uint256 accrualBlockNumberPrior = accrualBlockNumber;\\n\\n        /* Short-circuit accumulating 0 interest */\\n        if (accrualBlockNumberPrior == currentBlockNumber) {\\n            return NO_ERROR;\\n        }\\n\\n        /* Read the previous values out of storage */\\n        uint256 cashPrior = _getCashPrior();\\n        uint256 borrowsPrior = totalBorrows;\\n        uint256 reservesPrior = totalReserves;\\n        uint256 borrowIndexPrior = borrowIndex;\\n\\n        /* Calculate the current borrow interest rate */\\n        uint256 borrowRateMantissa = interestRateModel.getBorrowRate(cashPrior, borrowsPrior, reservesPrior);\\n        require(borrowRateMantissa <= borrowRateMaxMantissa, \\\"borrow rate is absurdly high\\\");\\n\\n        /* Calculate the number of blocks elapsed since the last accrual */\\n        uint256 blockDelta = currentBlockNumber - accrualBlockNumberPrior;\\n\\n        /*\\n         * Calculate the interest accumulated into borrows and reserves and the new index:\\n         *  simpleInterestFactor = borrowRate * blockDelta\\n         *  interestAccumulated = simpleInterestFactor * totalBorrows\\n         *  totalBorrowsNew = interestAccumulated + totalBorrows\\n         *  totalReservesNew = interestAccumulated * reserveFactor + totalReserves\\n         *  borrowIndexNew = simpleInterestFactor * borrowIndex + borrowIndex\\n         */\\n\\n        Exp memory simpleInterestFactor = mul_(Exp({ mantissa: borrowRateMantissa }), blockDelta);\\n        uint256 interestAccumulated = mul_ScalarTruncate(simpleInterestFactor, borrowsPrior);\\n        uint256 totalBorrowsNew = interestAccumulated + borrowsPrior;\\n        uint256 totalReservesNew = mul_ScalarTruncateAddUInt(\\n            Exp({ mantissa: reserveFactorMantissa }),\\n            interestAccumulated,\\n            reservesPrior\\n        );\\n        uint256 borrowIndexNew = mul_ScalarTruncateAddUInt(simpleInterestFactor, borrowIndexPrior, borrowIndexPrior);\\n\\n        /////////////////////////\\n        // EFFECTS & INTERACTIONS\\n        // (No safe failures beyond this point)\\n\\n        /* We write the previously calculated values into storage */\\n        accrualBlockNumber = currentBlockNumber;\\n        borrowIndex = borrowIndexNew;\\n        totalBorrows = totalBorrowsNew;\\n        totalReserves = totalReservesNew;\\n\\n        /* We emit an AccrueInterest event */\\n        emit AccrueInterest(cashPrior, interestAccumulated, borrowIndexNew, totalBorrowsNew);\\n\\n        return NO_ERROR;\\n    }\\n\\n    /**\\n     * @notice Sender supplies assets into the market and receives vTokens in exchange\\n     * @dev Accrues interest whether or not the operation succeeds, unless reverted\\n     * @param mintAmount The amount of the underlying asset to supply\\n     * @return error Always NO_ERROR for compatilibily with Venus core tooling\\n     * @custom:events Emits Mint and Transfer events; may emit AccrueInterest\\n     * @custom:access Not restricted\\n     */\\n    function mint(uint256 mintAmount) external override nonReentrant returns (uint256) {\\n        accrueInterest();\\n        // _mintFresh emits the actual Mint event if successful and logs on errors, so we don't need to\\n        _mintFresh(msg.sender, msg.sender, mintAmount);\\n        return NO_ERROR;\\n    }\\n\\n    /**\\n     * @notice Sender calls on-behalf of minter. minter supplies assets into the market and receives vTokens in exchange\\n     * @dev Accrues interest whether or not the operation succeeds, unless reverted\\n     * @param mintAmount The amount of the underlying asset to supply\\n     * @return error Always NO_ERROR for compatilibily with Venus core tooling\\n     * @custom:events Emits Mint and Transfer events; may emit AccrueInterest\\n     * @custom:access Not restricted\\n     */\\n    function mintBehalf(address minter, uint256 mintAmount) external override nonReentrant returns (uint256) {\\n        accrueInterest();\\n        // _mintFresh emits the actual Mint event if successful and logs on errors, so we don't need to\\n        _mintFresh(msg.sender, minter, mintAmount);\\n        return NO_ERROR;\\n    }\\n\\n    /**\\n     * @notice User supplies assets into the market and receives vTokens in exchange\\n     * @dev Assumes interest has already been accrued up to the current block\\n     * @param payer The address of the account which is sending the assets for supply\\n     * @param minter The address of the account which is supplying the assets\\n     * @param mintAmount The amount of the underlying asset to supply\\n     */\\n    function _mintFresh(\\n        address payer,\\n        address minter,\\n        uint256 mintAmount\\n    ) internal {\\n        /* Fail if mint not allowed */\\n        comptroller.preMintHook(address(this), minter, mintAmount);\\n\\n        /* Verify market's block number equals current block number */\\n        if (accrualBlockNumber != _getBlockNumber()) {\\n            revert MintFreshnessCheck();\\n        }\\n\\n        Exp memory exchangeRate = Exp({ mantissa: _exchangeRateStored() });\\n\\n        /////////////////////////\\n        // EFFECTS & INTERACTIONS\\n        // (No safe failures beyond this point)\\n\\n        /*\\n         *  We call `_doTransferIn` for the minter and the mintAmount.\\n         *  Note: The vToken must handle variations between ERC-20 and ETH underlying.\\n         *  `_doTransferIn` reverts if anything goes wrong, since we can't be sure if\\n         *  side-effects occurred. The function returns the amount actually transferred,\\n         *  in case of a fee. On success, the vToken holds an additional `actualMintAmount`\\n         *  of cash.\\n         */\\n        uint256 actualMintAmount = _doTransferIn(payer, mintAmount);\\n\\n        /*\\n         * We get the current exchange rate and calculate the number of vTokens to be minted:\\n         *  mintTokens = actualMintAmount / exchangeRate\\n         */\\n\\n        uint256 mintTokens = div_(actualMintAmount, exchangeRate);\\n\\n        /*\\n         * We calculate the new total supply of vTokens and minter token balance, checking for overflow:\\n         *  totalSupplyNew = totalSupply + mintTokens\\n         *  accountTokensNew = accountTokens[minter] + mintTokens\\n         * And write them into storage\\n         */\\n        totalSupply = totalSupply + mintTokens;\\n        accountTokens[minter] = accountTokens[minter] + mintTokens;\\n\\n        /* We emit a Mint event, and a Transfer event */\\n        emit Mint(minter, actualMintAmount, mintTokens);\\n        emit Transfer(address(0), minter, mintTokens);\\n    }\\n\\n    /**\\n     * @notice Sender redeems vTokens in exchange for the underlying asset\\n     * @dev Accrues interest whether or not the operation succeeds, unless reverted\\n     * @param redeemTokens The number of vTokens to redeem into underlying\\n     * @return error Always NO_ERROR for compatilibily with Venus core tooling\\n     * @custom:events Emits Redeem and Transfer events; may emit AccrueInterest\\n     * @custom:error RedeemTransferOutNotPossible is thrown when the protocol has insufficient cash\\n     * @custom:access Not restricted\\n     */\\n    function redeem(uint256 redeemTokens) external override nonReentrant returns (uint256) {\\n        accrueInterest();\\n        // _redeemFresh emits redeem-specific logs on errors, so we don't need to\\n        _redeemFresh(payable(msg.sender), redeemTokens, 0);\\n        return NO_ERROR;\\n    }\\n\\n    /**\\n     * @notice Sender redeems vTokens in exchange for a specified amount of underlying asset\\n     * @dev Accrues interest whether or not the operation succeeds, unless reverted\\n     * @param redeemAmount The amount of underlying to receive from redeeming vTokens\\n     * @return error Always NO_ERROR for compatilibily with Venus core tooling\\n     */\\n    function redeemUnderlying(uint256 redeemAmount) external override nonReentrant returns (uint256) {\\n        accrueInterest();\\n        // _redeemFresh emits redeem-specific logs on errors, so we don't need to\\n        _redeemFresh(payable(msg.sender), 0, redeemAmount);\\n        return NO_ERROR;\\n    }\\n\\n    /**\\n     * @notice User redeems vTokens in exchange for the underlying asset\\n     * @dev Assumes interest has already been accrued up to the current block\\n     * @param redeemer The address of the account which is redeeming the tokens\\n     * @param redeemTokensIn The number of vTokens to redeem into underlying (only one of redeemTokensIn or redeemAmountIn may be non-zero)\\n     * @param redeemAmountIn The number of underlying tokens to receive from redeeming vTokens (only one of redeemTokensIn or redeemAmountIn may be non-zero)\\n     */\\n    function _redeemFresh(\\n        address payable redeemer,\\n        uint256 redeemTokensIn,\\n        uint256 redeemAmountIn\\n    ) internal {\\n        require(redeemTokensIn == 0 || redeemAmountIn == 0, \\\"one of redeemTokensIn or redeemAmountIn must be zero\\\");\\n\\n        /* Verify market's block number equals current block number */\\n        if (accrualBlockNumber != _getBlockNumber()) {\\n            revert RedeemFreshnessCheck();\\n        }\\n\\n        /* exchangeRate = invoke Exchange Rate Stored() */\\n        Exp memory exchangeRate = Exp({ mantissa: _exchangeRateStored() });\\n\\n        uint256 redeemTokens;\\n        uint256 redeemAmount;\\n        /* If redeemTokensIn > 0: */\\n        if (redeemTokensIn > 0) {\\n            /*\\n             * We calculate the exchange rate and the amount of underlying to be redeemed:\\n             *  redeemTokens = redeemTokensIn\\n             *  redeemAmount = redeemTokensIn x exchangeRateCurrent\\n             */\\n            redeemTokens = redeemTokensIn;\\n            redeemAmount = mul_ScalarTruncate(exchangeRate, redeemTokensIn);\\n        } else {\\n            /*\\n             * We get the current exchange rate and calculate the amount to be redeemed:\\n             *  redeemTokens = redeemAmountIn / exchangeRate\\n             *  redeemAmount = redeemAmountIn\\n             */\\n            redeemTokens = div_(redeemAmountIn, exchangeRate);\\n            redeemAmount = redeemAmountIn;\\n        }\\n\\n        // Require tokens is zero or amount is also zero\\n        if (redeemTokens == 0 && redeemAmount > 0) {\\n            revert(\\\"redeemTokens zero\\\");\\n        }\\n\\n        /* Fail if redeem not allowed */\\n        comptroller.preRedeemHook(address(this), redeemer, redeemTokens);\\n\\n        /* Fail gracefully if protocol has insufficient cash */\\n        if (_getCashPrior() < redeemAmount) {\\n            revert RedeemTransferOutNotPossible();\\n        }\\n\\n        /////////////////////////\\n        // EFFECTS & INTERACTIONS\\n        // (No safe failures beyond this point)\\n\\n        /*\\n         * We write the previously calculated values into storage.\\n         *  Note: Avoid token reentrancy attacks by writing reduced supply before external transfer.\\n         */\\n        totalSupply = totalSupply - redeemTokens;\\n        accountTokens[redeemer] = accountTokens[redeemer] - redeemTokens;\\n\\n        /*\\n         * We invoke _doTransferOut for the redeemer and the redeemAmount.\\n         *  Note: The vToken must handle variations between ERC-20 and ETH underlying.\\n         *  On success, the vToken has redeemAmount less of cash.\\n         *  _doTransferOut reverts if anything goes wrong, since we can't be sure if side effects occurred.\\n         */\\n        _doTransferOut(redeemer, redeemAmount);\\n\\n        /* We emit a Transfer event, and a Redeem event */\\n        emit Transfer(redeemer, address(this), redeemTokens);\\n        emit Redeem(redeemer, redeemAmount, redeemTokens);\\n    }\\n\\n    /**\\n     * @notice Sender borrows assets from the protocol to their own address\\n     * @param borrowAmount The amount of the underlying asset to borrow\\n     * @return error Always NO_ERROR for compatilibily with Venus core tooling\\n     * @custom:events Emits Borrow event; may emit AccrueInterest\\n     * @custom:error BorrowCashNotAvailable is thrown when the protocol has insufficient cash\\n     * @custom:access Not restricted\\n     */\\n    function borrow(uint256 borrowAmount) external override nonReentrant returns (uint256) {\\n        accrueInterest();\\n        // borrowFresh emits borrow-specific logs on errors, so we don't need to\\n        _borrowFresh(payable(msg.sender), borrowAmount);\\n        return NO_ERROR;\\n    }\\n\\n    /**\\n     * @notice Users borrow assets from the protocol to their own address\\n     * @param borrowAmount The amount of the underlying asset to borrow\\n     */\\n    function _borrowFresh(address payable borrower, uint256 borrowAmount) internal {\\n        /* Fail if borrow not allowed */\\n        comptroller.preBorrowHook(address(this), borrower, borrowAmount);\\n\\n        /* Verify market's block number equals current block number */\\n        if (accrualBlockNumber != _getBlockNumber()) {\\n            revert BorrowFreshnessCheck();\\n        }\\n\\n        /* Fail gracefully if protocol has insufficient underlying cash */\\n        if (_getCashPrior() < borrowAmount) {\\n            revert BorrowCashNotAvailable();\\n        }\\n\\n        /*\\n         * We calculate the new borrower and total borrow balances, failing on overflow:\\n         *  accountBorrowNew = accountBorrow + borrowAmount\\n         *  totalBorrowsNew = totalBorrows + borrowAmount\\n         */\\n        uint256 accountBorrowsPrev = _borrowBalanceStored(borrower);\\n        uint256 accountBorrowsNew = accountBorrowsPrev + borrowAmount;\\n        uint256 totalBorrowsNew = totalBorrows + borrowAmount;\\n\\n        /////////////////////////\\n        // EFFECTS & INTERACTIONS\\n        // (No safe failures beyond this point)\\n\\n        /*\\n         * We write the previously calculated values into storage.\\n         *  Note: Avoid token reentrancy attacks by writing increased borrow before external transfer.\\n        `*/\\n        accountBorrows[borrower].principal = accountBorrowsNew;\\n        accountBorrows[borrower].interestIndex = borrowIndex;\\n        totalBorrows = totalBorrowsNew;\\n\\n        /*\\n         * We invoke _doTransferOut for the borrower and the borrowAmount.\\n         *  Note: The vToken must handle variations between ERC-20 and ETH underlying.\\n         *  On success, the vToken borrowAmount less of cash.\\n         *  _doTransferOut reverts if anything goes wrong, since we can't be sure if side effects occurred.\\n         */\\n        _doTransferOut(borrower, borrowAmount);\\n\\n        /* We emit a Borrow event */\\n        emit Borrow(borrower, borrowAmount, accountBorrowsNew, totalBorrowsNew);\\n    }\\n\\n    /**\\n     * @notice Sender repays their own borrow\\n     * @param repayAmount The amount to repay, or -1 for the full outstanding amount\\n     * @return error Always NO_ERROR for compatilibily with Venus core tooling\\n     * @custom:events Emits RepayBorrow event; may emit AccrueInterest\\n     * @custom:access Not restricted\\n     */\\n    function repayBorrow(uint256 repayAmount) external override nonReentrant returns (uint256) {\\n        accrueInterest();\\n        // _repayBorrowFresh emits repay-borrow-specific logs on errors, so we don't need to\\n        _repayBorrowFresh(msg.sender, msg.sender, repayAmount);\\n        return NO_ERROR;\\n    }\\n\\n    /**\\n     * @notice Sender repays a borrow belonging to borrower\\n     * @param borrower the account with the debt being payed off\\n     * @param repayAmount The amount to repay, or -1 for the full outstanding amount\\n     * @return error Always NO_ERROR for compatilibily with Venus core tooling\\n     * @custom:events Emits RepayBorrow event; may emit AccrueInterest\\n     * @custom:access Not restricted\\n     */\\n    function repayBorrowBehalf(address borrower, uint256 repayAmount) external override nonReentrant returns (uint256) {\\n        accrueInterest();\\n        // _repayBorrowFresh emits repay-borrow-specific logs on errors, so we don't need to\\n        _repayBorrowFresh(msg.sender, borrower, repayAmount);\\n        return NO_ERROR;\\n    }\\n\\n    /**\\n     * @notice Borrows are repaid by another user (possibly the borrower).\\n     * @param payer the account paying off the borrow\\n     * @param borrower the account with the debt being payed off\\n     * @param repayAmount the amount of underlying tokens being returned, or -1 for the full outstanding amount\\n     * @return (uint) the actual repayment amount.\\n     */\\n    function _repayBorrowFresh(\\n        address payer,\\n        address borrower,\\n        uint256 repayAmount\\n    ) internal returns (uint256) {\\n        /* Fail if repayBorrow not allowed */\\n        comptroller.preRepayHook(address(this), payer, borrower, repayAmount);\\n\\n        /* Verify market's block number equals current block number */\\n        if (accrualBlockNumber != _getBlockNumber()) {\\n            revert RepayBorrowFreshnessCheck();\\n        }\\n\\n        /* We fetch the amount the borrower owes, with accumulated interest */\\n        uint256 accountBorrowsPrev = _borrowBalanceStored(borrower);\\n\\n        uint256 repayAmountFinal = repayAmount > accountBorrowsPrev ? accountBorrowsPrev : repayAmount;\\n\\n        /////////////////////////\\n        // EFFECTS & INTERACTIONS\\n        // (No safe failures beyond this point)\\n\\n        /*\\n         * We call _doTransferIn for the payer and the repayAmount\\n         *  Note: The vToken must handle variations between ERC-20 and ETH underlying.\\n         *  On success, the vToken holds an additional repayAmount of cash.\\n         *  _doTransferIn reverts if anything goes wrong, since we can't be sure if side effects occurred.\\n         *   it returns the amount actually transferred, in case of a fee.\\n         */\\n        uint256 actualRepayAmount = _doTransferIn(payer, repayAmountFinal);\\n\\n        /*\\n         * We calculate the new borrower and total borrow balances, failing on underflow:\\n         *  accountBorrowsNew = accountBorrows - actualRepayAmount\\n         *  totalBorrowsNew = totalBorrows - actualRepayAmount\\n         */\\n        uint256 accountBorrowsNew = accountBorrowsPrev - actualRepayAmount;\\n        uint256 totalBorrowsNew = totalBorrows - actualRepayAmount;\\n\\n        /* We write the previously calculated values into storage */\\n        accountBorrows[borrower].principal = accountBorrowsNew;\\n        accountBorrows[borrower].interestIndex = borrowIndex;\\n        totalBorrows = totalBorrowsNew;\\n\\n        /* We emit a RepayBorrow event */\\n        emit RepayBorrow(payer, borrower, actualRepayAmount, accountBorrowsNew, totalBorrowsNew);\\n\\n        return actualRepayAmount;\\n    }\\n\\n    /**\\n     * @notice The sender liquidates the borrowers collateral.\\n     *  The collateral seized is transferred to the liquidator.\\n     * @param borrower The borrower of this vToken to be liquidated\\n     * @param repayAmount The amount of the underlying borrowed asset to repay\\n     * @param vTokenCollateral The market in which to seize collateral from the borrower\\n     * @return error Always NO_ERROR for compatilibily with Venus core tooling\\n     * @custom:events Emits LiquidateBorrow event; may emit AccrueInterest\\n     * @custom:error LiquidateAccrueCollateralInterestFailed is thrown when it is not possible to accrue interest on the collateral vToken\\n     * @custom:error LiquidateCollateralFreshnessCheck is thrown when interest has not been accrued on the collateral vToken\\n     * @custom:error LiquidateLiquidatorIsBorrower is thrown when trying to liquidate self\\n     * @custom:error LiquidateCloseAmountIsZero is thrown when repayment amount is zero\\n     * @custom:error LiquidateCloseAmountIsUintMax is thrown when repayment amount is UINT_MAX\\n     * @custom:access Not restricted\\n     */\\n    function liquidateBorrow(\\n        address borrower,\\n        uint256 repayAmount,\\n        VTokenInterface vTokenCollateral\\n    ) external override returns (uint256) {\\n        _liquidateBorrow(msg.sender, borrower, repayAmount, vTokenCollateral, false);\\n        return NO_ERROR;\\n    }\\n\\n    /**\\n     * @notice The sender liquidates the borrowers collateral.\\n     *  The collateral seized is transferred to the liquidator.\\n     * @param liquidator The address repaying the borrow and seizing collateral\\n     * @param borrower The borrower of this vToken to be liquidated\\n     * @param vTokenCollateral The market in which to seize collateral from the borrower\\n     * @param repayAmount The amount of the underlying borrowed asset to repay\\n     * @param skipLiquidityCheck If set to true, allows to liquidate up to 100% of the borrow\\n     *   regardless of the account liquidity\\n     */\\n    function _liquidateBorrow(\\n        address liquidator,\\n        address borrower,\\n        uint256 repayAmount,\\n        VTokenInterface vTokenCollateral,\\n        bool skipLiquidityCheck\\n    ) internal nonReentrant {\\n        accrueInterest();\\n\\n        uint256 error = vTokenCollateral.accrueInterest();\\n        if (error != NO_ERROR) {\\n            // accrueInterest emits logs on errors, but we still want to log the fact that an attempted liquidation failed\\n            revert LiquidateAccrueCollateralInterestFailed(error);\\n        }\\n\\n        // _liquidateBorrowFresh emits borrow-specific logs on errors, so we don't need to\\n        _liquidateBorrowFresh(liquidator, borrower, repayAmount, vTokenCollateral, skipLiquidityCheck);\\n    }\\n\\n    /**\\n     * @notice The liquidator liquidates the borrowers collateral.\\n     *  The collateral seized is transferred to the liquidator.\\n     * @param liquidator The address repaying the borrow and seizing collateral\\n     * @param borrower The borrower of this vToken to be liquidated\\n     * @param vTokenCollateral The market in which to seize collateral from the borrower\\n     * @param repayAmount The amount of the underlying borrowed asset to repay\\n     * @param skipLiquidityCheck If set to true, allows to liquidate up to 100% of the borrow\\n     *   regardless of the account liquidity\\n     */\\n    function _liquidateBorrowFresh(\\n        address liquidator,\\n        address borrower,\\n        uint256 repayAmount,\\n        VTokenInterface vTokenCollateral,\\n        bool skipLiquidityCheck\\n    ) internal {\\n        /* Fail if liquidate not allowed */\\n        comptroller.preLiquidateHook(\\n            address(this),\\n            address(vTokenCollateral),\\n            liquidator,\\n            borrower,\\n            repayAmount,\\n            skipLiquidityCheck\\n        );\\n\\n        /* Verify market's block number equals current block number */\\n        if (accrualBlockNumber != _getBlockNumber()) {\\n            revert LiquidateFreshnessCheck();\\n        }\\n\\n        /* Verify vTokenCollateral market's block number equals current block number */\\n        if (vTokenCollateral.accrualBlockNumber() != _getBlockNumber()) {\\n            revert LiquidateCollateralFreshnessCheck();\\n        }\\n\\n        /* Fail if borrower = liquidator */\\n        if (borrower == liquidator) {\\n            revert LiquidateLiquidatorIsBorrower();\\n        }\\n\\n        /* Fail if repayAmount = 0 */\\n        if (repayAmount == 0) {\\n            revert LiquidateCloseAmountIsZero();\\n        }\\n\\n        /* Fail if repayAmount = -1 */\\n        if (repayAmount == type(uint256).max) {\\n            revert LiquidateCloseAmountIsUintMax();\\n        }\\n\\n        /* Fail if repayBorrow fails */\\n        uint256 actualRepayAmount = _repayBorrowFresh(liquidator, borrower, repayAmount);\\n\\n        /////////////////////////\\n        // EFFECTS & INTERACTIONS\\n        // (No safe failures beyond this point)\\n\\n        /* We calculate the number of collateral tokens that will be seized */\\n        (uint256 amountSeizeError, uint256 seizeTokens) = comptroller.liquidateCalculateSeizeTokens(\\n            address(this),\\n            address(vTokenCollateral),\\n            actualRepayAmount\\n        );\\n        require(amountSeizeError == NO_ERROR, \\\"LIQUIDATE_COMPTROLLER_CALCULATE_AMOUNT_SEIZE_FAILED\\\");\\n\\n        /* Revert if borrower collateral token balance < seizeTokens */\\n        require(vTokenCollateral.balanceOf(borrower) >= seizeTokens, \\\"LIQUIDATE_SEIZE_TOO_MUCH\\\");\\n\\n        // If this is also the collateral, call _seize internally to avoid re-entrancy, otherwise make an external call\\n        if (address(vTokenCollateral) == address(this)) {\\n            _seize(address(this), liquidator, borrower, seizeTokens);\\n        } else {\\n            vTokenCollateral.seize(liquidator, borrower, seizeTokens);\\n        }\\n\\n        /* We emit a LiquidateBorrow event */\\n        emit LiquidateBorrow(liquidator, borrower, actualRepayAmount, address(vTokenCollateral), seizeTokens);\\n    }\\n\\n    /**\\n     * @notice Repays a certain amount of debt, treats the rest of the borrow as bad debt, essentially\\n     *   \\\"forgiving\\\" the borrower. Healing is a situation that should rarely happen. However, some pools\\n     *   may list risky assets or be configured improperly \\u2013 we want to still handle such cases gracefully.\\n     *   We assume that Comptroller does the seizing, so this function is only available to Comptroller.\\n     * @dev This function does not call any Comptroller hooks (like \\\"healAllowed\\\"), because we assume\\n     *   the Comptroller does all the necessary checks before calling this function.\\n     * @param payer account who repays the debt\\n     * @param borrower account to heal\\n     * @param repayAmount amount to repay\\n     * @custom:events Emits RepayBorrow, BadDebtIncreased events; may emit AccrueInterest\\n     * @custom:error HealBorrowUnauthorized is thrown when the request does not come from Comptroller\\n     * @custom:access Only Comptroller\\n     */\\n    function healBorrow(\\n        address payer,\\n        address borrower,\\n        uint256 repayAmount\\n    ) external override nonReentrant {\\n        if (msg.sender != address(comptroller)) {\\n            revert HealBorrowUnauthorized();\\n        }\\n\\n        uint256 accountBorrowsPrev = _borrowBalanceStored(borrower);\\n        uint256 totalBorrowsNew = totalBorrows;\\n\\n        uint256 actualRepayAmount;\\n        if (repayAmount != 0) {\\n            // _doTransferIn reverts if anything goes wrong, since we can't be sure if side effects occurred.\\n            // We violate checks-effects-interactions here to account for tokens that take transfer fees\\n            actualRepayAmount = _doTransferIn(payer, repayAmount);\\n            totalBorrowsNew = totalBorrowsNew - actualRepayAmount;\\n            emit RepayBorrow(payer, borrower, actualRepayAmount, 0, totalBorrowsNew);\\n        }\\n\\n        // The transaction will fail if trying to repay too much\\n        uint256 badDebtDelta = accountBorrowsPrev - actualRepayAmount;\\n        if (badDebtDelta != 0) {\\n            uint256 badDebtOld = badDebt;\\n            uint256 badDebtNew = badDebtOld + badDebtDelta;\\n            totalBorrowsNew = totalBorrowsNew - badDebtDelta;\\n            badDebt = badDebtNew;\\n\\n            // We treat healing as \\\"repayment\\\", where vToken is the payer\\n            emit RepayBorrow(address(this), borrower, badDebtDelta, accountBorrowsPrev - badDebtDelta, totalBorrowsNew);\\n            emit BadDebtIncreased(borrower, badDebtDelta, badDebtOld, badDebtNew);\\n        }\\n\\n        accountBorrows[borrower].principal = 0;\\n        accountBorrows[borrower].interestIndex = borrowIndex;\\n        totalBorrows = totalBorrowsNew;\\n    }\\n\\n    /**\\n     * @notice The extended version of liquidations, callable only by Comptroller. May skip\\n     *  the close factor check. The collateral seized is transferred to the liquidator.\\n     * @param liquidator The address repaying the borrow and seizing collateral\\n     * @param borrower The borrower of this vToken to be liquidated\\n     * @param repayAmount The amount of the underlying borrowed asset to repay\\n     * @param vTokenCollateral The market in which to seize collateral from the borrower\\n     * @param skipLiquidityCheck If set to true, allows to liquidate up to 100% of the borrow\\n     *   regardless of the account liquidity\\n     * @custom:events Emits LiquidateBorrow event; may emit AccrueInterest\\n     * @custom:error ForceLiquidateBorrowUnauthorized is thrown when the request does not come from Comptroller\\n     * @custom:error LiquidateAccrueCollateralInterestFailed is thrown when it is not possible to accrue interest on the collateral vToken\\n     * @custom:error LiquidateCollateralFreshnessCheck is thrown when interest has not been accrued on the collateral vToken\\n     * @custom:error LiquidateLiquidatorIsBorrower is thrown when trying to liquidate self\\n     * @custom:error LiquidateCloseAmountIsZero is thrown when repayment amount is zero\\n     * @custom:error LiquidateCloseAmountIsUintMax is thrown when repayment amount is UINT_MAX\\n     * @custom:access Only Comptroller\\n     */\\n    function forceLiquidateBorrow(\\n        address liquidator,\\n        address borrower,\\n        uint256 repayAmount,\\n        VTokenInterface vTokenCollateral,\\n        bool skipLiquidityCheck\\n    ) external override {\\n        if (msg.sender != address(comptroller)) {\\n            revert ForceLiquidateBorrowUnauthorized();\\n        }\\n        _liquidateBorrow(liquidator, borrower, repayAmount, vTokenCollateral, skipLiquidityCheck);\\n    }\\n\\n    /**\\n     * @notice Transfers collateral tokens (this market) to the liquidator.\\n     * @dev Will fail unless called by another vToken during the process of liquidation.\\n     *  Its absolutely critical to use msg.sender as the borrowed vToken and not a parameter.\\n     * @param liquidator The account receiving seized collateral\\n     * @param borrower The account having collateral seized\\n     * @param seizeTokens The number of vTokens to seize\\n     * @custom:events Emits Transfer, ReservesAdded events\\n     * @custom:error LiquidateSeizeLiquidatorIsBorrower is thrown when trying to liquidate self\\n     * @custom:access Not restricted\\n     */\\n    function seize(\\n        address liquidator,\\n        address borrower,\\n        uint256 seizeTokens\\n    ) external override nonReentrant {\\n        _seize(msg.sender, liquidator, borrower, seizeTokens);\\n    }\\n\\n    /**\\n     * @notice Transfers collateral tokens (this market) to the liquidator.\\n     * @dev Called only during an in-kind liquidation, or by liquidateBorrow during the liquidation of another VToken.\\n     *  Its absolutely critical to use msg.sender as the seizer vToken and not a parameter.\\n     * @param seizerContract The contract seizing the collateral (either borrowed vToken or Comptroller)\\n     * @param liquidator The account receiving seized collateral\\n     * @param borrower The account having collateral seized\\n     * @param seizeTokens The number of vTokens to seize\\n     */\\n    function _seize(\\n        address seizerContract,\\n        address liquidator,\\n        address borrower,\\n        uint256 seizeTokens\\n    ) internal {\\n        /* Fail if seize not allowed */\\n        comptroller.preSeizeHook(address(this), seizerContract, liquidator, borrower, seizeTokens);\\n\\n        /* Fail if borrower = liquidator */\\n        if (borrower == liquidator) {\\n            revert LiquidateSeizeLiquidatorIsBorrower();\\n        }\\n\\n        /*\\n         * We calculate the new borrower and liquidator token balances, failing on underflow/overflow:\\n         *  borrowerTokensNew = accountTokens[borrower] - seizeTokens\\n         *  liquidatorTokensNew = accountTokens[liquidator] + seizeTokens\\n         */\\n        uint256 protocolSeizeTokens = mul_(seizeTokens, Exp({ mantissa: protocolSeizeShareMantissa }));\\n        uint256 liquidatorSeizeTokens = seizeTokens - protocolSeizeTokens;\\n        Exp memory exchangeRate = Exp({ mantissa: _exchangeRateStored() });\\n        uint256 protocolSeizeAmount = mul_ScalarTruncate(exchangeRate, protocolSeizeTokens);\\n        uint256 totalReservesNew = totalReserves + protocolSeizeAmount;\\n\\n        /////////////////////////\\n        // EFFECTS & INTERACTIONS\\n        // (No safe failures beyond this point)\\n\\n        /* We write the calculated values into storage */\\n        totalReserves = totalReservesNew;\\n        totalSupply = totalSupply - protocolSeizeTokens;\\n        accountTokens[borrower] = accountTokens[borrower] - seizeTokens;\\n        accountTokens[liquidator] = accountTokens[liquidator] + liquidatorSeizeTokens;\\n\\n        /* Emit a Transfer event */\\n        emit Transfer(borrower, liquidator, liquidatorSeizeTokens);\\n        emit Transfer(borrower, address(this), protocolSeizeTokens);\\n        emit ReservesAdded(address(this), protocolSeizeAmount, totalReservesNew);\\n    }\\n\\n    /*** Admin Functions ***/\\n\\n    /**\\n     * @notice Sets a new comptroller for the market\\n     * @dev Admin function to set a new comptroller\\n     * @custom:events Emits NewComptroller event\\n     * @custom:error SetComptrollerOwnerCheck is thrown when the call is not from owner\\n     * @custom:access Only Governance\\n     */\\n    function setComptroller(ComptrollerInterface newComptroller) public override {\\n        // Check caller is admin\\n        if (msg.sender != owner()) {\\n            revert SetComptrollerOwnerCheck();\\n        }\\n\\n        _setComptroller(newComptroller);\\n    }\\n\\n    function _setComptroller(ComptrollerInterface newComptroller) internal {\\n        ComptrollerInterface oldComptroller = comptroller;\\n        // Ensure invoke comptroller.isComptroller() returns true\\n        require(newComptroller.isComptroller(), \\\"marker method returned false\\\");\\n\\n        // Set market's comptroller to newComptroller\\n        comptroller = newComptroller;\\n\\n        // Emit NewComptroller(oldComptroller, newComptroller)\\n        emit NewComptroller(oldComptroller, newComptroller);\\n    }\\n\\n    /**\\n     * @notice sets protocol share accumulated from liquidations\\n     * @dev must be less than liquidation incentive - 1\\n     * @param newProtocolSeizeShareMantissa_ new protocol share mantissa\\n     * @custom:events Emits NewProtocolSeizeShare event on success\\n     * @custom:error SetProtocolSeizeShareUnauthorized is thrown when the call is not authorized by AccessControlManager\\n     * @custom:error ProtocolSeizeShareTooBig is thrown when the new seize share is too high\\n     * @custom:access Controlled by AccessControlManager\\n     */\\n    function setProtocolSeizeShare(uint256 newProtocolSeizeShareMantissa_) external {\\n        bool canCallFunction = AccessControlManager(accessControlManager).isAllowedToCall(\\n            msg.sender,\\n            \\\"setProtocolSeizeShare(uint256)\\\"\\n        );\\n        // Check caller is allowed to call this function\\n        if (!canCallFunction) {\\n            revert SetProtocolSeizeShareUnauthorized();\\n        }\\n\\n        uint256 liquidationIncentive = ComptrollerViewInterface(address(comptroller)).liquidationIncentiveMantissa();\\n        if (newProtocolSeizeShareMantissa_ + 1e18 > liquidationIncentive) {\\n            revert ProtocolSeizeShareTooBig();\\n        }\\n\\n        uint256 oldProtocolSeizeShareMantissa = protocolSeizeShareMantissa;\\n        protocolSeizeShareMantissa = newProtocolSeizeShareMantissa_;\\n        emit NewProtocolSeizeShare(oldProtocolSeizeShareMantissa, newProtocolSeizeShareMantissa_);\\n    }\\n\\n    /**\\n     * @notice accrues interest and sets a new reserve factor for the protocol using _setReserveFactorFresh\\n     * @dev Admin function to accrue interest and set a new reserve factor\\n     * @custom:events Emits NewReserveFactor event; may emit AccrueInterest\\n     * @custom:error SetReserveFactorAdminCheck is thrown when the call is not authorized by AccessControlManager\\n     * @custom:error SetReserveFactorBoundsCheck is thrown when the new reserve factor is too high\\n     * @custom:access Controlled by AccessControlManager\\n     */\\n    function setReserveFactor(uint256 newReserveFactorMantissa) external override nonReentrant {\\n        bool canCallFunction = AccessControlManager(accessControlManager).isAllowedToCall(\\n            msg.sender,\\n            \\\"setReserveFactor(uint256)\\\"\\n        );\\n        // Check caller is allowed to call this function\\n        if (!canCallFunction) {\\n            revert SetReserveFactorAdminCheck();\\n        }\\n\\n        accrueInterest();\\n        _setReserveFactorFresh(newReserveFactorMantissa);\\n    }\\n\\n    /**\\n     * @notice Sets a new reserve factor for the protocol (*requires fresh interest accrual)\\n     * @dev Admin function to set a new reserve factor\\n     */\\n    function _setReserveFactorFresh(uint256 newReserveFactorMantissa) internal {\\n        // Verify market's block number equals current block number\\n        if (accrualBlockNumber != _getBlockNumber()) {\\n            revert SetReserveFactorFreshCheck();\\n        }\\n\\n        // Check newReserveFactor \\u2264 maxReserveFactor\\n        if (newReserveFactorMantissa > reserveFactorMaxMantissa) {\\n            revert SetReserveFactorBoundsCheck();\\n        }\\n\\n        uint256 oldReserveFactorMantissa = reserveFactorMantissa;\\n        reserveFactorMantissa = newReserveFactorMantissa;\\n\\n        emit NewReserveFactor(oldReserveFactorMantissa, newReserveFactorMantissa);\\n    }\\n\\n    /**\\n     * @notice The sender adds to reserves.\\n     * @param addAmount The amount fo underlying token to add as reserves\\n     * @custom:events Emits ReservesAdded event; may emit AccrueInterest\\n     * @custom:access Not restricted\\n     */\\n    function addReserves(uint256 addAmount) external override nonReentrant {\\n        accrueInterest();\\n        _addReservesFresh(addAmount);\\n    }\\n\\n    /**\\n     * @notice Add reserves by transferring from caller\\n     * @dev Requires fresh interest accrual\\n     * @param addAmount Amount of addition to reserves\\n     * @return actualAddAmount The actual amount added, excluding the potential token fees\\n     */\\n    function _addReservesFresh(uint256 addAmount) internal returns (uint256) {\\n        // totalReserves + actualAddAmount\\n        uint256 totalReservesNew;\\n        uint256 actualAddAmount;\\n\\n        // We fail gracefully unless market's block number equals current block number\\n        if (accrualBlockNumber != _getBlockNumber()) {\\n            revert AddReservesFactorFreshCheck(actualAddAmount);\\n        }\\n\\n        actualAddAmount = _doTransferIn(msg.sender, addAmount);\\n        totalReservesNew = totalReserves + actualAddAmount;\\n        totalReserves = totalReservesNew;\\n        emit ReservesAdded(msg.sender, actualAddAmount, totalReservesNew);\\n\\n        return actualAddAmount;\\n    }\\n\\n    /**\\n     * @notice Accrues interest and reduces reserves by transferring to the protocol reserve contract\\n     * @param reduceAmount Amount of reduction to reserves\\n     * @custom:events Emits ReservesReduced event; may emit AccrueInterest\\n     * @custom:error ReduceReservesCashNotAvailable is thrown when the vToken does not have sufficient cash\\n     * @custom:error ReduceReservesCashValidation is thrown when trying to withdraw more cash than the reserves have\\n     * @custom:access Not restricted\\n     */\\n    function reduceReserves(uint256 reduceAmount) external override nonReentrant {\\n        accrueInterest();\\n        _reduceReservesFresh(reduceAmount);\\n    }\\n\\n    /**\\n     * @notice Reduces reserves by transferring to the protocol reserve contract\\n     * @dev Requires fresh interest accrual\\n     * @param reduceAmount Amount of reduction to reserves\\n     */\\n    function _reduceReservesFresh(uint256 reduceAmount) internal {\\n        // totalReserves - reduceAmount\\n        uint256 totalReservesNew;\\n\\n        // We fail gracefully unless market's block number equals current block number\\n        if (accrualBlockNumber != _getBlockNumber()) {\\n            revert ReduceReservesFreshCheck();\\n        }\\n\\n        // Fail gracefully if protocol has insufficient underlying cash\\n        if (_getCashPrior() < reduceAmount) {\\n            revert ReduceReservesCashNotAvailable();\\n        }\\n\\n        // Check reduceAmount \\u2264 reserves[n] (totalReserves)\\n        if (reduceAmount > totalReserves) {\\n            revert ReduceReservesCashValidation();\\n        }\\n\\n        /////////////////////////\\n        // EFFECTS & INTERACTIONS\\n        // (No safe failures beyond this point)\\n\\n        totalReservesNew = totalReserves - reduceAmount;\\n\\n        // Store reserves[n+1] = reserves[n] - reduceAmount\\n        totalReserves = totalReservesNew;\\n\\n        // _doTransferOut reverts if anything goes wrong, since we can't be sure if side effects occurred.\\n        // Transferring an underlying asset to the protocolShareReserve contract to channel the funds for different use.\\n        _doTransferOut(protocolShareReserve, reduceAmount);\\n\\n        // Update the pool asset's state in the protocol share reserve for the above transfer.\\n        IProtocolShareReserve(protocolShareReserve).updateAssetsState(address(comptroller), underlying);\\n\\n        emit ReservesReduced(protocolShareReserve, reduceAmount, totalReservesNew);\\n    }\\n\\n    /**\\n     * @notice accrues interest and updates the interest rate model using _setInterestRateModelFresh\\n     * @dev Admin function to accrue interest and update the interest rate model\\n     * @param newInterestRateModel the new interest rate model to use\\n     * @custom:events Emits NewMarketInterestRateModel event; may emit AccrueInterest\\n     * @custom:error SetInterestRateModelOwnerCheck is thrown when the call is not authorized by AccessControlManager\\n     * @custom:access Controlled by AccessControlManager\\n     */\\n    function setInterestRateModel(InterestRateModel newInterestRateModel) public override {\\n        bool canCallFunction = AccessControlManager(accessControlManager).isAllowedToCall(\\n            msg.sender,\\n            \\\"setInterestRateModel(address)\\\"\\n        );\\n\\n        // Check if caller has call permissions\\n        if (!canCallFunction) {\\n            revert SetInterestRateModelOwnerCheck();\\n        }\\n\\n        accrueInterest();\\n        _setInterestRateModelFresh(newInterestRateModel);\\n    }\\n\\n    /**\\n     * @notice updates the interest rate model (*requires fresh interest accrual)\\n     * @dev Admin function to update the interest rate model\\n     * @param newInterestRateModel the new interest rate model to use\\n     */\\n    function _setInterestRateModelFresh(InterestRateModel newInterestRateModel) internal {\\n        // Used to store old model for use in the event that is emitted on success\\n        InterestRateModel oldInterestRateModel;\\n\\n        // We fail gracefully unless market's block number equals current block number\\n        if (accrualBlockNumber != _getBlockNumber()) {\\n            revert SetInterestRateModelFreshCheck();\\n        }\\n\\n        // Track the market's current interest rate model\\n        oldInterestRateModel = interestRateModel;\\n\\n        // Ensure invoke newInterestRateModel.isInterestRateModel() returns true\\n        require(newInterestRateModel.isInterestRateModel(), \\\"marker method returned false\\\");\\n\\n        // Set the interest rate model to newInterestRateModel\\n        interestRateModel = newInterestRateModel;\\n\\n        // Emit NewMarketInterestRateModel(oldInterestRateModel, newInterestRateModel)\\n        emit NewMarketInterestRateModel(oldInterestRateModel, newInterestRateModel);\\n    }\\n\\n    /**\\n     * @notice Sets the address of AccessControlManager\\n     * @dev Admin function to set address of AccessControlManager\\n     * @param newAccessControlManager The new address of the AccessControlManager\\n     * @custom:events Emits NewAccessControlManager event\\n     * @custom:access Only Governance\\n     */\\n    function setAccessControlAddress(AccessControlManager newAccessControlManager) external {\\n        require(msg.sender == owner(), \\\"only admin can set ACL address\\\");\\n        _setAccessControlAddress(newAccessControlManager);\\n    }\\n\\n    /**\\n     * @notice Sets the address of AccessControlManager\\n     * @dev Internal function to set address of AccessControlManager\\n     * @param newAccessControlManager The new address of the AccessControlManager\\n     */\\n    function _setAccessControlAddress(AccessControlManager newAccessControlManager) internal {\\n        AccessControlManager oldAccessControlManager = accessControlManager;\\n        accessControlManager = newAccessControlManager;\\n        emit NewAccessControlManager(oldAccessControlManager, accessControlManager);\\n    }\\n\\n    /*** Reentrancy Guard ***/\\n\\n    /**\\n     * @dev Prevents a contract from calling itself, directly or indirectly.\\n     */\\n    modifier nonReentrant() {\\n        require(_notEntered, \\\"re-entered\\\");\\n        _notEntered = false;\\n        _;\\n        _notEntered = true; // get a gas-refund post-Istanbul\\n    }\\n\\n    /*** Handling Bad Debt and Shortfall ***/\\n\\n    /**\\n     * @notice Updates bad debt\\n     * @dev Called only when bad debt is recovered from auction\\n     * @param recoveredAmount_ The amount of bad debt recovered\\n     * @custom:events Emits BadDebtRecovered event\\n     * @custom:access Only Shortfall contract\\n     */\\n    function badDebtRecovered(uint256 recoveredAmount_) external {\\n        require(msg.sender == shortfall, \\\"only shortfall contract can update bad debt\\\");\\n        require(recoveredAmount_ <= badDebt, \\\"more than bad debt recovered from auction\\\");\\n\\n        uint256 badDebtOld = badDebt;\\n        uint256 badDebtNew = badDebtOld - recoveredAmount_;\\n        badDebt = badDebtNew;\\n\\n        emit BadDebtRecovered(badDebtOld, badDebtNew);\\n    }\\n\\n    /**\\n     * @notice A public function to sweep accidental ERC-20 transfers to this contract. Tokens are sent to admin (timelock)\\n     * @param token The address of the ERC-20 token to sweep\\n     * @custom:access Only Governance\\n     */\\n    function sweepToken(IERC20Upgradeable token) external override {\\n        require(msg.sender == owner(), \\\"VToken::sweepToken: only admin can sweep tokens\\\");\\n        require(address(token) != underlying, \\\"VToken::sweepToken: can not sweep underlying token\\\");\\n        uint256 balance = token.balanceOf(address(this));\\n        token.safeTransfer(owner(), balance);\\n    }\\n\\n    /*** Safe Token ***/\\n\\n    /**\\n     * @notice Gets balance of this contract in terms of the underlying\\n     * @dev This excludes the value of the current message, if any\\n     * @return The quantity of underlying tokens owned by this contract\\n     */\\n    function _getCashPrior() internal view virtual returns (uint256) {\\n        IERC20Upgradeable token = IERC20Upgradeable(underlying);\\n        return token.balanceOf(address(this));\\n    }\\n\\n    /**\\n     * @dev Similar to ERC-20 transfer, but handles tokens that have transfer fees.\\n     *      This function returns the actual amount received,\\n     *      which may be less than `amount` if there is a fee attached to the transfer.\\n     */\\n    function _doTransferIn(address from, uint256 amount) internal virtual returns (uint256) {\\n        IERC20Upgradeable token = IERC20Upgradeable(underlying);\\n        uint256 balanceBefore = token.balanceOf(address(this));\\n        token.safeTransferFrom(from, address(this), amount);\\n        uint256 balanceAfter = token.balanceOf(address(this));\\n        // Return the amount that was *actually* transferred\\n        return balanceAfter - balanceBefore;\\n    }\\n\\n    /**\\n     * @dev Just a regular ERC-20 transfer, reverts on failure\\n     */\\n    function _doTransferOut(address payable to, uint256 amount) internal virtual {\\n        IERC20Upgradeable token = IERC20Upgradeable(underlying);\\n        token.safeTransfer(to, amount);\\n    }\\n}\\n\",\"keccak256\":\"0xa9f6db8dfce3de69105fe974873bc8e9617348053f2cf51b44f151259ff1f2ff\",\"license\":\"BSD-3-Clause\"},\"contracts/VTokenInterfaces.sol\":{\"content\":\"// SPDX-License-Identifier: BSD-3-Clause\\npragma solidity ^0.8.10;\\n\\nimport \\\"@openzeppelin/contracts-upgradeable/token/ERC20/IERC20Upgradeable.sol\\\";\\nimport \\\"@venusprotocol/oracle/contracts/PriceOracle.sol\\\";\\nimport \\\"./ComptrollerInterface.sol\\\";\\nimport \\\"./InterestRateModel.sol\\\";\\nimport \\\"./ErrorReporter.sol\\\";\\nimport \\\"./Governance/AccessControlManager.sol\\\";\\n\\ncontract VTokenStorage {\\n    /**\\n     * @dev Guard variable for re-entrancy checks\\n     */\\n    bool internal _notEntered;\\n\\n    /**\\n     * @notice Underlying asset for this VToken\\n     */\\n    address public underlying;\\n\\n    /**\\n     * @notice EIP-20 token name for this token\\n     */\\n    string public name;\\n\\n    /**\\n     * @notice EIP-20 token symbol for this token\\n     */\\n    string public symbol;\\n\\n    /**\\n     * @notice EIP-20 token decimals for this token\\n     */\\n    uint8 public decimals;\\n\\n    /**\\n     * @notice Risk fund contract address\\n     */\\n    address payable internal riskFund;\\n\\n    /**\\n     * @notice Protocol share Reserve contract address\\n     */\\n    address payable internal protocolShareReserve;\\n\\n    // Maximum borrow rate that can ever be applied (.0005% / block)\\n    uint256 internal constant borrowRateMaxMantissa = 0.0005e16;\\n\\n    // Maximum fraction of interest that can be set aside for reserves\\n    uint256 internal constant reserveFactorMaxMantissa = 1e18;\\n\\n    /**\\n     * @notice Contract which oversees inter-vToken operations\\n     */\\n    ComptrollerInterface public comptroller;\\n\\n    /**\\n     * @notice Model which tells what the current interest rate should be\\n     */\\n    InterestRateModel public interestRateModel;\\n\\n    // Initial exchange rate used when minting the first VTokens (used when totalSupply = 0)\\n    uint256 internal initialExchangeRateMantissa;\\n\\n    /**\\n     * @notice Fraction of interest currently set aside for reserves\\n     */\\n    uint256 public reserveFactorMantissa;\\n\\n    /**\\n     * @notice Block number that interest was last accrued at\\n     */\\n    uint256 public accrualBlockNumber;\\n\\n    /**\\n     * @notice Accumulator of the total earned interest rate since the opening of the market\\n     */\\n    uint256 public borrowIndex;\\n\\n    /**\\n     * @notice Total amount of outstanding borrows of the underlying in this market\\n     */\\n    uint256 public totalBorrows;\\n\\n    /**\\n     * @notice Total amount of reserves of the underlying held in this market\\n     */\\n    uint256 public totalReserves;\\n\\n    /**\\n     * @notice Total number of tokens in circulation\\n     */\\n    uint256 public totalSupply;\\n\\n    /**\\n     * @notice Total bad debt of the market\\n     */\\n    uint256 public badDebt;\\n\\n    // Official record of token balances for each account\\n    mapping(address => uint256) internal accountTokens;\\n\\n    // Approved token transfer amounts on behalf of others\\n    mapping(address => mapping(address => uint256)) internal transferAllowances;\\n\\n    /**\\n     * @notice Container for borrow balance information\\n     * @member principal Total balance (with accrued interest), after applying the most recent balance-changing action\\n     * @member interestIndex Global borrowIndex as of the most recent balance-changing action\\n     */\\n    struct BorrowSnapshot {\\n        uint256 principal;\\n        uint256 interestIndex;\\n    }\\n\\n    // Mapping of account addresses to outstanding borrow balances\\n    mapping(address => BorrowSnapshot) internal accountBorrows;\\n\\n    /**\\n     * @notice Share of seized collateral that is added to reserves\\n     */\\n    uint256 public protocolSeizeShareMantissa;\\n\\n    /**\\n     * @notice Storage of AccessControlManager\\n     */\\n    AccessControlManager public accessControlManager;\\n\\n    /**\\n     * @notice Storage of Shortfall contract address\\n     */\\n    address public shortfall;\\n}\\n\\nabstract contract VTokenInterface is VTokenStorage {\\n    struct RiskManagementInit {\\n        address shortfall;\\n        address payable riskFund;\\n        address payable protocolShareReserve;\\n    }\\n\\n    /**\\n     * @notice Indicator that this is a VToken contract (for inspection)\\n     */\\n    bool public constant isVToken = true;\\n\\n    /*** Market Events ***/\\n\\n    /**\\n     * @notice Event emitted when interest is accrued\\n     */\\n    event AccrueInterest(uint256 cashPrior, uint256 interestAccumulated, uint256 borrowIndex, uint256 totalBorrows);\\n\\n    /**\\n     * @notice Event emitted when tokens are minted\\n     */\\n    event Mint(address minter, uint256 mintAmount, uint256 mintTokens);\\n\\n    /**\\n     * @notice Event emitted when tokens are redeemed\\n     */\\n    event Redeem(address redeemer, uint256 redeemAmount, uint256 redeemTokens);\\n\\n    /**\\n     * @notice Event emitted when underlying is borrowed\\n     */\\n    event Borrow(address borrower, uint256 borrowAmount, uint256 accountBorrows, uint256 totalBorrows);\\n\\n    /**\\n     * @notice Event emitted when a borrow is repaid\\n     */\\n    event RepayBorrow(\\n        address payer,\\n        address borrower,\\n        uint256 repayAmount,\\n        uint256 accountBorrows,\\n        uint256 totalBorrows\\n    );\\n\\n    /**\\n     * @notice Event emitted when bad debt is accumulated on a market\\n     * @param borrower borrower to \\\"forgive\\\"\\n     * @param badDebtDelta amount of new bad debt recorded\\n     * @param badDebtOld previous bad debt value\\n     * @param badDebtNew new bad debt value\\n     */\\n    event BadDebtIncreased(address borrower, uint256 badDebtDelta, uint256 badDebtOld, uint256 badDebtNew);\\n\\n    /**\\n     * @notice Event emitted when bad debt is recovered via an auction\\n     * @param badDebtOld previous bad debt value\\n     * @param badDebtNew new bad debt value\\n     */\\n    event BadDebtRecovered(uint256 badDebtOld, uint256 badDebtNew);\\n\\n    /**\\n     * @notice Event emitted when a borrow is liquidated\\n     */\\n    event LiquidateBorrow(\\n        address liquidator,\\n        address borrower,\\n        uint256 repayAmount,\\n        address vTokenCollateral,\\n        uint256 seizeTokens\\n    );\\n\\n    /*** Admin Events ***/\\n\\n    /**\\n     * @notice Event emitted when comptroller is changed\\n     */\\n    event NewComptroller(ComptrollerInterface oldComptroller, ComptrollerInterface newComptroller);\\n\\n    /**\\n     * @notice Event emitted when comptroller is changed\\n     */\\n    event NewAccessControlManager(\\n        AccessControlManager oldAccessControlManager,\\n        AccessControlManager newAccessControlManager\\n    );\\n\\n    /**\\n     * @notice Event emitted when interestRateModel is changed\\n     */\\n    event NewMarketInterestRateModel(InterestRateModel oldInterestRateModel, InterestRateModel newInterestRateModel);\\n\\n    /**\\n     * @notice Event emitted when protocol seize share is changed\\n     */\\n    event NewProtocolSeizeShare(uint256 oldProtocolSeizeShareMantissa, uint256 newProtocolSeizeShareMantissa);\\n\\n    /**\\n     * @notice Event emitted when the reserve factor is changed\\n     */\\n    event NewReserveFactor(uint256 oldReserveFactorMantissa, uint256 newReserveFactorMantissa);\\n\\n    /**\\n     * @notice Event emitted when the reserves are added\\n     */\\n    event ReservesAdded(address benefactor, uint256 addAmount, uint256 newTotalReserves);\\n\\n    /**\\n     * @notice Event emitted when the reserves are reduced\\n     */\\n    event ReservesReduced(address admin, uint256 reduceAmount, uint256 newTotalReserves);\\n\\n    /**\\n     * @notice EIP20 Transfer event\\n     */\\n    event Transfer(address indexed from, address indexed to, uint256 amount);\\n\\n    /**\\n     * @notice EIP20 Approval event\\n     */\\n    event Approval(address indexed owner, address indexed spender, uint256 amount);\\n\\n    /*** User Interface ***/\\n\\n    function mint(uint256 mintAmount) external virtual returns (uint256);\\n\\n    function mintBehalf(address minter, uint256 mintAllowed) external virtual returns (uint256);\\n\\n    function redeem(uint256 redeemTokens) external virtual returns (uint256);\\n\\n    function redeemUnderlying(uint256 redeemAmount) external virtual returns (uint256);\\n\\n    function borrow(uint256 borrowAmount) external virtual returns (uint256);\\n\\n    function repayBorrow(uint256 repayAmount) external virtual returns (uint256);\\n\\n    function repayBorrowBehalf(address borrower, uint256 repayAmount) external virtual returns (uint256);\\n\\n    function liquidateBorrow(\\n        address borrower,\\n        uint256 repayAmount,\\n        VTokenInterface vTokenCollateral\\n    ) external virtual returns (uint256);\\n\\n    function healBorrow(\\n        address payer,\\n        address borrower,\\n        uint256 repayAmount\\n    ) external virtual;\\n\\n    function forceLiquidateBorrow(\\n        address liquidator,\\n        address borrower,\\n        uint256 repayAmount,\\n        VTokenInterface vTokenCollateral,\\n        bool skipCloseFactorCheck\\n    ) external virtual;\\n\\n    function seize(\\n        address liquidator,\\n        address borrower,\\n        uint256 seizeTokens\\n    ) external virtual;\\n\\n    function transfer(address dst, uint256 amount) external virtual returns (bool);\\n\\n    function transferFrom(\\n        address src,\\n        address dst,\\n        uint256 amount\\n    ) external virtual returns (bool);\\n\\n    function approve(address spender, uint256 amount) external virtual returns (bool);\\n\\n    function allowance(address owner, address spender) external view virtual returns (uint256);\\n\\n    function balanceOf(address owner) external view virtual returns (uint256);\\n\\n    function balanceOfUnderlying(address owner) external virtual returns (uint256);\\n\\n    function getAccountSnapshot(address account)\\n        external\\n        view\\n        virtual\\n        returns (\\n            uint256,\\n            uint256,\\n            uint256,\\n            uint256\\n        );\\n\\n    function borrowRatePerBlock() external view virtual returns (uint256);\\n\\n    function supplyRatePerBlock() external view virtual returns (uint256);\\n\\n    function totalBorrowsCurrent() external virtual returns (uint256);\\n\\n    function borrowBalanceCurrent(address account) external virtual returns (uint256);\\n\\n    function borrowBalanceStored(address account) external view virtual returns (uint256);\\n\\n    function exchangeRateCurrent() external virtual returns (uint256);\\n\\n    function exchangeRateStored() external view virtual returns (uint256);\\n\\n    function getCash() external view virtual returns (uint256);\\n\\n    function accrueInterest() external virtual returns (uint256);\\n\\n    function sweepToken(IERC20Upgradeable token) external virtual;\\n\\n    /*** Admin Functions ***/\\n\\n    function setComptroller(ComptrollerInterface newComptroller) external virtual;\\n\\n    function setReserveFactor(uint256 newReserveFactorMantissa) external virtual;\\n\\n    function reduceReserves(uint256 reduceAmount) external virtual;\\n\\n    function setInterestRateModel(InterestRateModel newInterestRateModel) external virtual;\\n\\n    function addReserves(uint256 addAmount) external virtual;\\n}\\n\",\"keccak256\":\"0x7c02f621817b29708d16893ba469c1edfe0188d1e274f03af0ce1be03a527248\",\"license\":\"BSD-3-Clause\"}},\"version\":1}",
  "bytecode": "0x60806040523480156200001157600080fd5b506200001c62000022565b620000e4565b600054610100900460ff16156200008f5760405162461bcd60e51b815260206004820152602760248201527f496e697469616c697a61626c653a20636f6e747261637420697320696e697469604482015266616c697a696e6760c81b606482015260840160405180910390fd5b60005460ff9081161015620000e2576000805460ff191660ff9081179091556040519081527f7f26b83ff96e1f2b6a682f133852f6798a09c465da95921460cefb38474024989060200160405180910390a15b565b61427d80620000f46000396000f3fe608060405234801561001057600080fd5b50600436106103a45760003560e01c80637821a514116101e9578063b2a02ff11161010f578063dd62ed3e116100ad578063f2fde38b1161007c578063f2fde38b146107b4578063f3fdb15a146107c7578063f5e3c462146107da578063f8f9da28146107ed57600080fd5b8063dd62ed3e14610744578063e30c39781461077d578063e8d56b8b1461078e578063ef60450c146107a157600080fd5b8063bd6d894d116100e9578063bd6d894d146106e3578063c37f68e2146106eb578063c5ebeaec1461071e578063db006a751461073157600080fd5b8063b2a02ff1146106b4578063b4a0bdf3146106c7578063bbcac557146106da57600080fd5b80638f840ddd11610187578063a6afed9511610156578063a6afed9514610688578063a9059cbb14610690578063aa5af0fd146106a3578063ae9d70b0146106ac57600080fd5b80638f840ddd1461065157806395d89b411461065a57806395dd919314610662578063a0712d681461067557600080fd5b80638bad38dd116101c35780638bad38dd146106075780638bbdb6db1461061a5780638bcd40161461062d5780638da5cb5b1461064057600080fd5b80637821a514146105d957806379ba5097146105ec578063852a12e3146105f457600080fd5b80633af9e669116102ce5780636752e7021161026c57806370a082311161023b57806370a082311461058d578063715018a6146105b657806373acee98146105be578063757212f0146105c657600080fd5b80636752e7021461055b57806369ab3250146105645780636c540baf1461056c5780636f307dc31461057557600080fd5b806344fe6ffe116102a857806344fe6ffe1461051957806347a0e3b11461052c57806347bd37181461053f5780635fe3b5671461054857600080fd5b80633af9e669146104f65780633b1d21a2146105095780633d9ea3a11461051157600080fd5b8063182df0f51161034657806323323e031161031557806323323e031461049e57806323b872dd146104b15780632608f818146104c4578063313ce567146104d757600080fd5b8063182df0f51461044557806319b1faef1461044d5780631be19560146104785780631c4469831461048b57600080fd5b80630e752702116103825780630e752702146103ff578063173b99041461042057806317bfdfbc1461042957806318160ddd1461043c57600080fd5b806306fdde03146103a957806307e27959146103c7578063095ea7b3146103dc575b600080fd5b6103b16107f5565b6040516103be9190613c11565b60405180910390f35b6103da6103d5366004613c44565b610883565b005b6103ef6103ea366004613c82565b6108da565b60405190151581526020016103be565b61041261040d366004613c44565b610948565b6040519081526020016103be565b610412609f5481565b610412610437366004613cae565b6109a2565b61041260a45481565b6104126109f7565b60ab54610460906001600160a01b031681565b6040516001600160a01b0390911681526020016103be565b6103da610486366004613cae565b610a06565b6103da610499366004613c44565b610b8d565b6104126104ac366004613c82565b610c9f565b6103ef6104bf366004613ccb565b610cf8565b6104126104d2366004613c82565b610d4a565b609a546104e49060ff1681565b60405160ff90911681526020016103be565b610412610504366004613cae565b610da5565b610412610deb565b6103ef600181565b6103da610527366004613ccb565b610df5565b6103da61053a366004613e36565b610fcf565b61041260a25481565b609c54610460906001600160a01b031681565b61041260a95481565b610412600081565b61041260a05481565b6097546104609061010090046001600160a01b031681565b61041261059b366004613cae565b6001600160a01b0316600090815260a6602052604090205490565b6103da6110f4565b610412611108565b6103da6105d4366004613c44565b611154565b6103da6105e7366004613c44565b611300565b6103da61133e565b610412610602366004613c44565b6113b8565b6103da610615366004613cae565b611411565b6103da610628366004613f29565b611445565b6103da61063b366004613cae565b611484565b6033546001600160a01b0316610460565b61041260a35481565b6103b1611559565b610412610670366004613cae565b611566565b610412610683366004613c44565b611577565b6104126115ba565b6103ef61069e366004613c82565b6117a7565b61041260a15481565b6104126117f8565b6103da6106c2366004613ccb565b611890565b60aa54610460906001600160a01b031681565b61041260a55481565b6104126118da565b6106fe6106f9366004613cae565b61192c565b6040805194855260208501939093529183015260608201526080016103be565b61041261072c366004613c44565b61196d565b61041261073f366004613c44565b6119af565b610412610752366004613f91565b6001600160a01b03918216600090815260a76020908152604080832093909416825291909152205490565b6065546001600160a01b0316610460565b6103da61079c366004613cae565b6119f3565b6103da6107af366004613c44565b611a56565b6103da6107c2366004613cae565b611b7d565b609d54610460906001600160a01b031681565b6104126107e8366004613fca565b611bee565b610412611c08565b609880546108029061400c565b80601f016020809104026020016040519081016040528092919081815260200182805461082e9061400c565b801561087b5780601f106108505761010080835404028352916020019161087b565b820191906000526020600020905b81548152906001019060200180831161085e57829003601f168201915b505050505081565b60975460ff166108ae5760405162461bcd60e51b81526004016108a590614046565b60405180910390fd5b6097805460ff191690556108c06115ba565b506108ca81611c5b565b506097805460ff19166001179055565b33600081815260a7602090815260408083206001600160a01b03871680855292528083208590555191929182907f8c5be1e5ebec7d5bd14f71427d1e84f3dd0314c0f7b2291e5b200ac8c7c3b925906109369087815260200190565b60405180910390a35060019392505050565b60975460009060ff1661096d5760405162461bcd60e51b81526004016108a590614046565b6097805460ff1916905561097f6115ba565b5061098b333384611db4565b50600090506097805460ff19166001179055919050565b60975460009060ff166109c75760405162461bcd60e51b81526004016108a590614046565b6097805460ff191690556109d96115ba565b506109e382611f16565b90506097805460ff19166001179055919050565b6000610a01611f6a565b905090565b6033546001600160a01b03163314610a785760405162461bcd60e51b815260206004820152602f60248201527f56546f6b656e3a3a7377656570546f6b656e3a206f6e6c792061646d696e206360448201526e616e20737765657020746f6b656e7360881b60648201526084016108a5565b6097546001600160a01b03610100909104811690821603610af65760405162461bcd60e51b815260206004820152603260248201527f56546f6b656e3a3a7377656570546f6b656e3a2063616e206e6f74207377656560448201527138103ab73232b9363cb4b733903a37b5b2b760711b60648201526084016108a5565b6040516370a0823160e01b81523060048201526000906001600160a01b038316906370a0823190602401602060405180830381865afa158015610b3d573d6000803e3d6000fd5b505050506040513d601f19601f82011682018060405250810190610b61919061406a565b9050610b89610b786033546001600160a01b031690565b6001600160a01b0384169083611fe3565b5050565b60975460ff16610baf5760405162461bcd60e51b81526004016108a590614046565b6097805460ff1916905560aa54604080516318c5e8ab60e01b81523360048201526024810191909152601960448201527f73657452657365727665466163746f722875696e74323536290000000000000060648201526000916001600160a01b0316906318c5e8ab90608401602060405180830381865afa158015610c38573d6000803e3d6000fd5b505050506040513d601f19601f82011682018060405250810190610c5c9190614083565b905080610c7c57604051631205b57b60e11b815260040160405180910390fd5b610c846115ba565b50610c8e8261204b565b50506097805460ff19166001179055565b60975460009060ff16610cc45760405162461bcd60e51b81526004016108a590614046565b6097805460ff19169055610cd66115ba565b50610ce23384846120d4565b5060006097805460ff1916600117905592915050565b60975460009060ff16610d1d5760405162461bcd60e51b81526004016108a590614046565b6097805460ff19169055610d333385858561225b565b5060016097805460ff191660011790559392505050565b60975460009060ff16610d6f5760405162461bcd60e51b81526004016108a590614046565b6097805460ff19169055610d816115ba565b50610d8d338484611db4565b50600090506097805460ff1916600117905592915050565b6000806040518060200160405280610dbb6118da565b90526001600160a01b038416600090815260a66020526040902054909150610de4908290612448565b9392505050565b6000610a01612460565b60975460ff16610e175760405162461bcd60e51b81526004016108a590614046565b6097805460ff19169055609c546001600160a01b03163314610e4c57604051632c40292560e01b815260040160405180910390fd5b6000610e5783611f16565b60a25490915060008315610ebe57610e6f86856124da565b9050610e7b81836140b6565b91507f1a2a22cb034d26d1854bdc6666a5b91fe25efbbb5dcad3b0355478d6f5c362a1868683600086604051610eb59594939291906140cd565b60405180910390a15b6000610eca82856140b6565b90508015610f905760a5546000610ee183836140fe565b9050610eed83866140b6565b60a582905594507f1a2a22cb034d26d1854bdc6666a5b91fe25efbbb5dcad3b0355478d6f5c362a1308985610f22818b6140b6565b89604051610f349594939291906140cd565b60405180910390a1604080516001600160a01b038a16815260208101859052908101839052606081018290527f90125ffdb441e57c4f6bf69789206424859f206bea5727f2d81ad2470826ef6a9060800160405180910390a150505b50506001600160a01b03909316600090815260a86020526040812090815560a15460019182015560a29390935550506097805460ff1916909117905550565b600054610100900460ff1615808015610fef5750600054600160ff909116105b806110095750303b158015611009575060005460ff166001145b61106c5760405162461bcd60e51b815260206004820152602e60248201527f496e697469616c697a61626c653a20636f6e747261637420697320616c72656160448201526d191e481a5b9a5d1a585b1a5e995960921b60648201526084016108a5565b6000805460ff19166001179055801561108f576000805461ff0019166101001790555b6110a18b8b8b8b8b8b8b8b8b8b6125e8565b80156110e7576000805461ff0019169055604051600181527f7f26b83ff96e1f2b6a682f133852f6798a09c465da95921460cefb38474024989060200160405180910390a15b5050505050505050505050565b6110fc612841565b611106600061289b565b565b60975460009060ff1661112d5760405162461bcd60e51b81526004016108a590614046565b6097805460ff1916905561113f6115ba565b505060a2546097805460ff1916600117905590565b60aa54604080516318c5e8ab60e01b81523360048201526024810191909152601e60448201527f73657450726f746f636f6c5365697a6553686172652875696e7432353629000060648201526000916001600160a01b0316906318c5e8ab90608401602060405180830381865afa1580156111d3573d6000803e3d6000fd5b505050506040513d601f19601f820116820180604052508101906111f79190614083565b905080611217576040516321433a4d60e01b815260040160405180910390fd5b609c5460408051634ada90af60e01b815290516000926001600160a01b031691634ada90af9160048083019260209291908290030181865afa158015611261573d6000803e3d6000fd5b505050506040513d601f19601f82011682018060405250810190611285919061406a565b90508061129a84670de0b6b3a76400006140fe565b11156112b95760405163034dd2c160e11b815260040160405180910390fd5b60a980549084905560408051828152602081018690527ff5815f353a60e815cce7553e4f60c533a59d26b1b5504ea4b6db8d60da3e4da2910160405180910390a150505050565b60975460ff166113225760405162461bcd60e51b81526004016108a590614046565b6097805460ff191690556113346115ba565b50610c8e816128b4565b60655433906001600160a01b031681146113ac5760405162461bcd60e51b815260206004820152602960248201527f4f776e61626c6532537465703a2063616c6c6572206973206e6f7420746865206044820152683732bb9037bbb732b960b91b60648201526084016108a5565b6113b58161289b565b50565b60975460009060ff166113dd5760405162461bcd60e51b81526004016108a590614046565b6097805460ff191690556113ef6115ba565b506113fc33600084612942565b5060006097805460ff19166001179055919050565b6033546001600160a01b0316331461143c5760405163d219dc1f60e01b815260040160405180910390fd5b6113b581612bc4565b609c546001600160a01b0316331461147057604051635c85a5e760e01b815260040160405180910390fd5b61147d8585858585612cd6565b5050505050565b60aa54604080516318c5e8ab60e01b81523360048201526024810191909152601d60448201527f736574496e746572657374526174654d6f64656c28616464726573732900000060648201526000916001600160a01b0316906318c5e8ab90608401602060405180830381865afa158015611503573d6000803e3d6000fd5b505050506040513d601f19601f820116820180604052508101906115279190614083565b9050806115475760405163407fded560e01b815260040160405180910390fd5b61154f6115ba565b50610b8982612db7565b609980546108029061400c565b600061157182611f16565b92915050565b60975460009060ff1661159c5760405162461bcd60e51b81526004016108a590614046565b6097805460ff191690556115ae6115ba565b506113fc3333846120d4565b60a05460009043908181036115d25760009250505090565b60006115dc612460565b60a25460a35460a154609d546040516315f2405360e01b81526004810186905260248101859052604481018490529495509293919290916000916001600160a01b0316906315f2405390606401602060405180830381865afa158015611646573d6000803e3d6000fd5b505050506040513d601f19601f8201168201806040525081019061166a919061406a565b905065048c273950008111156116c25760405162461bcd60e51b815260206004820152601c60248201527f626f72726f772072617465206973206162737572646c7920686967680000000060448201526064016108a5565b60006116ce87896140b6565b905060006116ea60405180602001604052808581525083612ef9565b905060006116f88288612448565b9050600061170688836140fe565b905060006117256040518060200160405280609f54815250848a612f2a565b9050600061173485898a612f2a565b60a08e905560a181905560a284905560a3839055604080518d815260208101879052908101829052606081018590529091507f4dec04e750ca11537cabcd8a9eab06494de08da3735bc8871cd41250e190bc049060800160405180910390a160009d505050505050505050505050505090565b60975460009060ff166117cc5760405162461bcd60e51b81526004016108a590614046565b6097805460ff191690556117e23380858561225b565b5060016097805460ff1916600117905592915050565b609d546000906001600160a01b031663b8168816611814612460565b60a25460a354609f546040516001600160e01b031960e087901b16815260048101949094526024840192909252604483015260648201526084015b602060405180830381865afa15801561186c573d6000803e3d6000fd5b505050506040513d601f19601f82011682018060405250810190610a01919061406a565b60975460ff166118b25760405162461bcd60e51b81526004016108a590614046565b6097805460ff191690556118c833848484612f4b565b50506097805460ff1916600117905550565b60975460009060ff166118ff5760405162461bcd60e51b81526004016108a590614046565b6097805460ff191690556119116115ba565b5061191a611f6a565b90506097805460ff1916600117905590565b6001600160a01b038116600090815260a66020526040812054819081908190819061195687611f16565b61195e611f6a565b93509350935093509193509193565b60975460009060ff166119925760405162461bcd60e51b81526004016108a590614046565b6097805460ff191690556119a46115ba565b506113fc3383613187565b60975460009060ff166119d45760405162461bcd60e51b81526004016108a590614046565b6097805460ff191690556119e66115ba565b506113fc33836000612942565b6033546001600160a01b03163314611a4d5760405162461bcd60e51b815260206004820152601e60248201527f6f6e6c792061646d696e2063616e207365742041434c2061646472657373000060448201526064016108a5565b6113b5816132f5565b60ab546001600160a01b03163314611ac45760405162461bcd60e51b815260206004820152602b60248201527f6f6e6c792073686f727466616c6c20636f6e74726163742063616e207570646160448201526a1d1948189859081919589d60aa1b60648201526084016108a5565b60a554811115611b285760405162461bcd60e51b815260206004820152602960248201527f6d6f7265207468616e206261642064656274207265636f76657265642066726f604482015268369030bab1ba34b7b760b91b60648201526084016108a5565b60a5546000611b3783836140b6565b60a581905560408051848152602081018390529192507f9e19ec7d2b8f8a94df8cc0072453ace318d221e3cbb2731d0eaa0baac856520f910160405180910390a1505050565b611b85612841565b606580546001600160a01b0383166001600160a01b03199091168117909155611bb66033546001600160a01b031690565b6001600160a01b03167f38d16b8cac22d99fc7c124b9cd0de2d3fa1faef420bfe791d8c362d765e2270060405160405180910390a350565b6000611bfe338585856000612cd6565b5060009392505050565b609d546000906001600160a01b03166315f24053611c24612460565b60a25460a3546040516001600160e01b031960e086901b16815260048101939093526024830191909152604482015260640161184f565b60004360a05414611c7f57604051630dff50cb60e41b815260040160405180910390fd5b81611c88612460565b1015611ca757604051633345e99960e01b815260040160405180910390fd5b60a354821115611cca576040516378d2980560e11b815260040160405180910390fd5b8160a354611cd891906140b6565b60a3819055609b54909150611cf6906001600160a01b03168361334f565b609b54609c5460975460405163aac59a7560e01b81526001600160a01b0392831660048201526101009091048216602482015291169063aac59a7590604401600060405180830381600087803b158015611d4f57600080fd5b505af1158015611d63573d6000803e3d6000fd5b5050609b546040517f3bad0c59cf2f06e7314077049f48a93578cd16f5ef92329f1dab1420a99c177e9350611da892506001600160a01b039091169085908590614116565b60405180910390a15050565b609c54604051630c2995e960e01b81523060048201526001600160a01b0385811660248301528481166044830152606482018490526000921690630c2995e990608401600060405180830381600087803b158015611e1157600080fd5b505af1158015611e25573d6000803e3d6000fd5b50505050611e304390565b60a05414611e515760405163c9021e2f60e01b815260040160405180910390fd5b6000611e5c84611f16565b90506000818411611e6d5783611e6f565b815b90506000611e7d87836124da565b90506000611e8b82856140b6565b905060008260a254611e9d91906140b6565b6001600160a01b038916600090815260a860205260409081902084815560a15460019091015560a2829055519091507f1a2a22cb034d26d1854bdc6666a5b91fe25efbbb5dcad3b0355478d6f5c362a190611f01908b908b908790879087906140cd565b60405180910390a15090979650505050505050565b6001600160a01b038116600090815260a86020526040812080548203611f3f5750600092915050565b60a1548154600091611f5091614137565b9050816001015481611f629190614156565b949350505050565b60a454600090808203611f7f575050609e5490565b6000611f89612460565b9050600060a35460a55460a25484611fa191906140fe565b611fab91906140fe565b611fb591906140b6565b9050600083611fcc670de0b6b3a764000084614137565b611fd69190614156565b95945050505050565b5090565b6040516001600160a01b03831660248201526044810182905261204690849063a9059cbb60e01b906064015b60408051601f198184030181529190526020810180516001600160e01b03166001600160e01b03199093169290921790915261336b565b505050565b4360a0541461206d57604051637dfca6b760e11b815260040160405180910390fd5b670de0b6b3a76400008111156120965760405163717220f360e11b815260040160405180910390fd5b609f80549082905560408051828152602081018490527faaa68312e2ea9d50e16af5068410ab56e1a1fd06037b1a35664812c30f8214609101611da8565b609c5460405163c0891ba960e01b81526001600160a01b039091169063c0891ba99061210890309086908690600401614178565b600060405180830381600087803b15801561212257600080fd5b505af1158015612136573d6000803e3d6000fd5b505050506121414390565b60a05414612162576040516338d8859760e01b815260040160405180910390fd5b60006040518060200160405280612177611f6a565b90529050600061218785846124da565b90506000612195828461343d565b90508060a4546121a591906140fe565b60a4556001600160a01b038516600090815260a660205260409020546121cc9082906140fe565b6001600160a01b038616600090815260a660205260409081902091909155517f4c209b5fc8ad50758f13e2e1088ba56a560dff690a1c6fef26394f4c03821c4f9061221c90879085908590614116565b60405180910390a16040518181526001600160a01b038616906000906000805160206142288339815191529060200160405180910390a3505050505050565b609c54604051636d0be88d60e01b81523060048201526001600160a01b03858116602483015284811660448301526064820184905290911690636d0be88d90608401600060405180830381600087803b1580156122b757600080fd5b505af11580156122cb573d6000803e3d6000fd5b50505050816001600160a01b0316836001600160a01b03160361230157604051638cd22d1960e01b815260040160405180910390fd5b6000836001600160a01b0316856001600160a01b031603612325575060001961234d565b506001600160a01b03808416600090815260a760209081526040808320938816835292905220545b600061235983836140b6565b6001600160a01b038616600090815260a66020526040812054919250906123819085906140b6565b6001600160a01b038616600090815260a66020526040812054919250906123a99086906140fe565b6001600160a01b03808916600090815260a6602052604080822086905591891681522081905590506000198414612403576001600160a01b03808816600090815260a760209081526040808320938c168352929052208390555b856001600160a01b0316876001600160a01b03166000805160206142288339815191528760405161243691815260200190565b60405180910390a35050505050505050565b6000806124558484612ef9565b9050611f628161345b565b6097546040516370a0823160e01b815230600482015260009161010090046001600160a01b03169081906370a0823190602401602060405180830381865afa1580156124b0573d6000803e3d6000fd5b505050506040513d601f19601f820116820180604052508101906124d4919061406a565b91505090565b6097546040516370a0823160e01b815230600482015260009161010090046001600160a01b031690829082906370a0823190602401602060405180830381865afa15801561252c573d6000803e3d6000fd5b505050506040513d601f19601f82011682018060405250810190612550919061406a565b90506125676001600160a01b038316863087613473565b6040516370a0823160e01b81523060048201526000906001600160a01b038416906370a0823190602401602060405180830381865afa1580156125ae573d6000803e3d6000fd5b505050506040513d601f19601f820116820180604052508101906125d2919061406a565b90506125de82826140b6565b9695505050505050565b600054610100900460ff1661260f5760405162461bcd60e51b81526004016108a59061419c565b61261761349a565b60a054158015612627575060a154155b61267f5760405162461bcd60e51b815260206004820152602360248201527f6d61726b6574206d6179206f6e6c7920626520696e697469616c697a6564206f6044820152626e636560e81b60648201526084016108a5565b612688826132f5565b609e879055866126f35760405162461bcd60e51b815260206004820152603060248201527f696e697469616c2065786368616e67652072617465206d75737420626520677260448201526f32b0ba32b9103a3430b7103d32b9379760811b60648201526084016108a5565b6126fc89612bc4565b4360a055670de0b6b3a764000060a15561271588612db7565b8551612728906098906020890190613b55565b50845161273c906099906020880190613b55565b50609a8054825160ab80546001600160a01b03199081166001600160a01b039384161790915560208086015160ff8a166001600160a81b031990951694909417610100948416850217909455604080860151609b80549093169084161790915566b1a2bc2ec5000060a95560978054610100600160a81b0319168f84168502179081905581516318160ddd60e01b81529151939004909116926318160ddd926004838101938290030181865afa1580156127fa573d6000803e3d6000fd5b505050506040513d601f19601f8201168201806040525081019061281e919061406a565b506097805460ff191660011790556128358361289b565b50505050505050505050565b6033546001600160a01b031633146111065760405162461bcd60e51b815260206004820181905260248201527f4f776e61626c653a2063616c6c6572206973206e6f7420746865206f776e657260448201526064016108a5565b606580546001600160a01b03191690556113b5816134c9565b600080804360a054146128dd576040516338acf79960e01b8152600481018290526024016108a5565b6128e733856124da565b90508060a3546128f791906140fe565b91508160a3819055507fa91e67c5ea634cd43a12c5a482724b03de01e85ca68702a53d0c2f45cb7c1dc533828460405161293393929190614116565b60405180910390a19392505050565b81158061294d575080155b6129b65760405162461bcd60e51b815260206004820152603460248201527f6f6e65206f662072656465656d546f6b656e73496e206f722072656465656d416044820152736d6f756e74496e206d757374206265207a65726f60601b60648201526084016108a5565b4360a054146129d8576040516397b5cfcd60e01b815260040160405180910390fd5b600060405180602001604052806129ed611f6a565b905290506000808415612a0e57849150612a078386612448565b9050612a1e565b612a18848461343d565b91508390505b81158015612a2c5750600081115b15612a6d5760405162461bcd60e51b815260206004820152601160248201527072656465656d546f6b656e73207a65726f60781b60448201526064016108a5565b609c54604051634732387560e11b81526001600160a01b0390911690638e6470ea90612aa19030908a908790600401614178565b600060405180830381600087803b158015612abb57600080fd5b505af1158015612acf573d6000803e3d6000fd5b5050505080612adc612460565b1015612afb576040516391240a1b60e01b815260040160405180910390fd5b8160a454612b0991906140b6565b60a4556001600160a01b038616600090815260a66020526040902054612b309083906140b6565b6001600160a01b038716600090815260a66020526040902055612b53868261334f565b60405182815230906001600160a01b038816906000805160206142288339815191529060200160405180910390a37fe5b754fb1abb7f01b499791d0b820ae3b6af3424ac1c59768edb53f4ec31a929868284604051612bb493929190614116565b60405180910390a1505050505050565b609c5460408051623f1ee960e11b815290516001600160a01b0392831692841691627e3dd29160048083019260209291908290030181865afa158015612c0e573d6000803e3d6000fd5b505050506040513d601f19601f82011682018060405250810190612c329190614083565b612c7e5760405162461bcd60e51b815260206004820152601c60248201527f6d61726b6572206d6574686f642072657475726e65642066616c73650000000060448201526064016108a5565b609c80546001600160a01b0319166001600160a01b0384811691821790925560408051928416835260208301919091527f7ac369dbd14fa5ea3f473ed67cc9d598964a77501540ba6751eb0b3decf5870d9101611da8565b60975460ff16612cf85760405162461bcd60e51b81526004016108a590614046565b6097805460ff19169055612d0a6115ba565b506000826001600160a01b031663a6afed956040518163ffffffff1660e01b81526004016020604051808303816000875af1158015612d4d573d6000803e3d6000fd5b505050506040513d601f19601f82011682018060405250810190612d71919061406a565b90508015612d9557604051633eea49b760e11b8152600481018290526024016108a5565b612da2868686868661351b565b50506097805460ff1916600117905550505050565b60004360a05414612ddb57604051630be2a5cb60e11b815260040160405180910390fd5b609d60009054906101000a90046001600160a01b03169050816001600160a01b0316632191f92a6040518163ffffffff1660e01b8152600401602060405180830381865afa158015612e31573d6000803e3d6000fd5b505050506040513d601f19601f82011682018060405250810190612e559190614083565b612ea15760405162461bcd60e51b815260206004820152601c60248201527f6d61726b6572206d6574686f642072657475726e65642066616c73650000000060448201526064016108a5565b609d80546001600160a01b0319166001600160a01b0384811691821790925560408051928416835260208301919091527fedffc32e068c7c95dfd4bdfd5c4d939a084d6b11c4199eac8436ed234d72f9269101611da8565b6040805160208101909152600081526040518060200160405280612f21856000015185613956565b90529392505050565b600080612f378585612ef9565b9050611fd6612f458261345b565b84613962565b609c54604051637666d5e360e11b81523060048201526001600160a01b03868116602483015285811660448301528481166064830152608482018490529091169063eccdabc69060a401600060405180830381600087803b158015612faf57600080fd5b505af1158015612fc3573d6000803e3d6000fd5b50505050826001600160a01b0316826001600160a01b031603612ff957604051633a94626760e11b815260040160405180910390fd5b600061301582604051806020016040528060a95481525061396e565b9050600061302382846140b6565b90506000604051806020016040528061303a611f6a565b90529050600061304a8285612448565b905060008160a35461305c91906140fe565b60a381905560a4549091506130729086906140b6565b60a4556001600160a01b038716600090815260a660205260409020546130999087906140b6565b6001600160a01b03808916600090815260a6602052604080822093909355908a16815220546130c99085906140fe565b6001600160a01b03808a16600081815260a6602052604090819020939093559151908916906000805160206142288339815191529061310b9088815260200190565b60405180910390a360405185815230906001600160a01b038916906000805160206142288339815191529060200160405180910390a37fa91e67c5ea634cd43a12c5a482724b03de01e85ca68702a53d0c2f45cb7c1dc530838360405161317493929190614116565b60405180910390a1505050505050505050565b609c5460405163df71403b60e01b81526001600160a01b039091169063df71403b906131bb90309086908690600401614178565b600060405180830381600087803b1580156131d557600080fd5b505af11580156131e9573d6000803e3d6000fd5b505050506131f44390565b60a0541461321557604051630e8d8c6160e21b815260040160405180910390fd5b8061321e612460565b101561323d576040516348c2588160e01b815260040160405180910390fd5b600061324883611f16565b9050600061325683836140fe565b905060008360a25461326891906140fe565b6001600160a01b038616600090815260a86020526040902083815560a15460019091015560a2819055905061329d858561334f565b604080516001600160a01b038716815260208101869052908101839052606081018290527f13ed6866d4e1ee6da46f845c46d7e54120883d75c5ea9a2dacc1c4ca8984ab809060800160405180910390a15050505050565b60aa80546001600160a01b038381166001600160a01b031983168117909355604080519190921680825260208201939093527f66fd58e82f7b31a2a5c30e0888f3093efe4e111b00cd2b0c31fe014601293aa09101611da8565b60975461010090046001600160a01b0316612046818484611fe3565b60006133c0826040518060400160405280602081526020017f5361666545524332303a206c6f772d6c6576656c2063616c6c206661696c6564815250856001600160a01b03166139919092919063ffffffff16565b80519091501561204657808060200190518101906133de9190614083565b6120465760405162461bcd60e51b815260206004820152602a60248201527f5361666545524332303a204552433230206f7065726174696f6e20646964206e6044820152691bdd081cdd58d8d9595960b21b60648201526084016108a5565b6000610de461345484670de0b6b3a7640000613956565b83516139a0565b805160009061157190670de0b6b3a764000090614156565b613494846323b872dd60e01b85858560405160240161200f93929190614178565b50505050565b600054610100900460ff166134c15760405162461bcd60e51b81526004016108a59061419c565b6111066139ac565b603380546001600160a01b038381166001600160a01b0319831681179093556040519116919082907f8be0079c531659141344cd1fd0a4f28419497f9722a3daafe3b4186f6b6457e090600090a35050565b609c54604051637eca7def60e01b81523060048201526001600160a01b038481166024830152878116604483015286811660648301526084820186905283151560a483015290911690637eca7def9060c401600060405180830381600087803b15801561358757600080fd5b505af115801561359b573d6000803e3d6000fd5b505050506135a64390565b60a054146135c7576040516380965b1b60e01b815260040160405180910390fd5b43826001600160a01b0316636c540baf6040518163ffffffff1660e01b8152600401602060405180830381865afa158015613606573d6000803e3d6000fd5b505050506040513d601f19601f8201168201806040525081019061362a919061406a565b1461364857604051631046f38d60e31b815260040160405180910390fd5b846001600160a01b0316846001600160a01b03160361367a57604051631bd1a62160e21b815260040160405180910390fd5b8260000361369b5760405163d29da7ef60e01b815260040160405180910390fd5b60001983036136bd57604051635982c5bb60e11b815260040160405180910390fd5b60006136ca868686611db4565b609c5460405163c488847b60e01b815291925060009182916001600160a01b03169063c488847b9061370490309089908890600401614178565b6040805180830381865afa158015613720573d6000803e3d6000fd5b505050506040513d601f19601f8201168201806040525081019061374491906141e7565b91509150600082146137b45760405162461bcd60e51b815260206004820152603360248201527f4c49515549444154455f434f4d5054524f4c4c45525f43414c43554c4154455f604482015272105353d5539517d4d152569157d19052531151606a1b60648201526084016108a5565b6040516370a0823160e01b81526001600160a01b0388811660048301528291908716906370a0823190602401602060405180830381865afa1580156137fd573d6000803e3d6000fd5b505050506040513d601f19601f82011682018060405250810190613821919061406a565b101561386f5760405162461bcd60e51b815260206004820152601860248201527f4c49515549444154455f5345495a455f544f4f5f4d554348000000000000000060448201526064016108a5565b306001600160a01b038616036138905761388b30898984612f4b565b6138f3565b60405163b2a02ff160e01b81526001600160a01b0386169063b2a02ff1906138c0908b908b908690600401614178565b600060405180830381600087803b1580156138da57600080fd5b505af11580156138ee573d6000803e3d6000fd5b505050505b604080516001600160a01b038a811682528981166020830152818301869052871660608201526080810183905290517f298637f684da70674f26509b10f07ec2fbc77a335ab1e7d6215a4b2484d8bb529181900360a00190a15050505050505050565b6000610de48284614137565b6000610de482846140fe565b6000670de0b6b3a7640000613987848460000151613956565b610de49190614156565b6060611f6284846000856139dc565b6000610de48284614156565b600054610100900460ff166139d35760405162461bcd60e51b81526004016108a59061419c565b6111063361289b565b606082471015613a3d5760405162461bcd60e51b815260206004820152602660248201527f416464726573733a20696e73756666696369656e742062616c616e636520666f6044820152651c8818d85b1b60d21b60648201526084016108a5565b600080866001600160a01b03168587604051613a59919061420b565b60006040518083038185875af1925050503d8060008114613a96576040519150601f19603f3d011682016040523d82523d6000602084013e613a9b565b606091505b5091509150613aac87838387613ab7565b979650505050505050565b60608315613b26578251600003613b1f576001600160a01b0385163b613b1f5760405162461bcd60e51b815260206004820152601d60248201527f416464726573733a2063616c6c20746f206e6f6e2d636f6e747261637400000060448201526064016108a5565b5081611f62565b611f628383815115613b3b5781518083602001fd5b8060405162461bcd60e51b81526004016108a59190613c11565b828054613b619061400c565b90600052602060002090601f016020900481019282613b835760008555613bc9565b82601f10613b9c57805160ff1916838001178555613bc9565b82800160010185558215613bc9579182015b82811115613bc9578251825591602001919060010190613bae565b50611fdf9291505b80821115611fdf5760008155600101613bd1565b60005b83811015613c00578181015183820152602001613be8565b838111156134945750506000910152565b6020815260008251806020840152613c30816040850160208701613be5565b601f01601f19169190910160400192915050565b600060208284031215613c5657600080fd5b5035919050565b6001600160a01b03811681146113b557600080fd5b8035613c7d81613c5d565b919050565b60008060408385031215613c9557600080fd5b8235613ca081613c5d565b946020939093013593505050565b600060208284031215613cc057600080fd5b8135610de481613c5d565b600080600060608486031215613ce057600080fd5b8335613ceb81613c5d565b92506020840135613cfb81613c5d565b929592945050506040919091013590565b634e487b7160e01b600052604160045260246000fd5b600082601f830112613d3357600080fd5b813567ffffffffffffffff80821115613d4e57613d4e613d0c565b604051601f8301601f19908116603f01168101908282118183101715613d7657613d76613d0c565b81604052838152866020858801011115613d8f57600080fd5b836020870160208301376000602085830101528094505050505092915050565b803560ff81168114613c7d57600080fd5b600060608284031215613dd257600080fd5b6040516060810181811067ffffffffffffffff82111715613df557613df5613d0c565b6040529050808235613e0681613c5d565b81526020830135613e1681613c5d565b60208201526040830135613e2981613c5d565b6040919091015292915050565b6000806000806000806000806000806101808b8d031215613e5657600080fd5b613e5f8b613c72565b9950613e6d60208c01613c72565b9850613e7b60408c01613c72565b975060608b0135965060808b013567ffffffffffffffff80821115613e9f57600080fd5b613eab8e838f01613d22565b975060a08d0135915080821115613ec157600080fd5b50613ece8d828e01613d22565b955050613edd60c08c01613daf565b9350613eeb60e08c01613c72565b9250613efa6101008c01613c72565b9150613f0a8c6101208d01613dc0565b90509295989b9194979a5092959850565b80151581146113b557600080fd5b600080600080600060a08688031215613f4157600080fd5b8535613f4c81613c5d565b94506020860135613f5c81613c5d565b9350604086013592506060860135613f7381613c5d565b91506080860135613f8381613f1b565b809150509295509295909350565b60008060408385031215613fa457600080fd5b8235613faf81613c5d565b91506020830135613fbf81613c5d565b809150509250929050565b600080600060608486031215613fdf57600080fd5b8335613fea81613c5d565b925060208401359150604084013561400181613c5d565b809150509250925092565b600181811c9082168061402057607f821691505b60208210810361404057634e487b7160e01b600052602260045260246000fd5b50919050565b6020808252600a90820152691c994b595b9d195c995960b21b604082015260600190565b60006020828403121561407c57600080fd5b5051919050565b60006020828403121561409557600080fd5b8151610de481613f1b565b634e487b7160e01b600052601160045260246000fd5b6000828210156140c8576140c86140a0565b500390565b6001600160a01b03958616815293909416602084015260408301919091526060820152608081019190915260a00190565b60008219821115614111576141116140a0565b500190565b6001600160a01b039390931683526020830191909152604082015260600190565b6000816000190483118215151615614151576141516140a0565b500290565b60008261417357634e487b7160e01b600052601260045260246000fd5b500490565b6001600160a01b039384168152919092166020820152604081019190915260600190565b6020808252602b908201527f496e697469616c697a61626c653a20636f6e7472616374206973206e6f74206960408201526a6e697469616c697a696e6760a81b606082015260800190565b600080604083850312156141fa57600080fd5b505080516020909101519092909150565b6000825161421d818460208701613be5565b919091019291505056feddf252ad1be2c89b69c2b068fc378daa952ba7f163c4a11628f55a4df523b3efa2646970667358221220fa1363b812bb2e7b47797b49218d2dee0a11a758b12f8a5c46bef3aa5aabfefe64736f6c634300080d0033",
  "deployedBytecode": "0x608060405234801561001057600080fd5b50600436106103a45760003560e01c80637821a514116101e9578063b2a02ff11161010f578063dd62ed3e116100ad578063f2fde38b1161007c578063f2fde38b146107b4578063f3fdb15a146107c7578063f5e3c462146107da578063f8f9da28146107ed57600080fd5b8063dd62ed3e14610744578063e30c39781461077d578063e8d56b8b1461078e578063ef60450c146107a157600080fd5b8063bd6d894d116100e9578063bd6d894d146106e3578063c37f68e2146106eb578063c5ebeaec1461071e578063db006a751461073157600080fd5b8063b2a02ff1146106b4578063b4a0bdf3146106c7578063bbcac557146106da57600080fd5b80638f840ddd11610187578063a6afed9511610156578063a6afed9514610688578063a9059cbb14610690578063aa5af0fd146106a3578063ae9d70b0146106ac57600080fd5b80638f840ddd1461065157806395d89b411461065a57806395dd919314610662578063a0712d681461067557600080fd5b80638bad38dd116101c35780638bad38dd146106075780638bbdb6db1461061a5780638bcd40161461062d5780638da5cb5b1461064057600080fd5b80637821a514146105d957806379ba5097146105ec578063852a12e3146105f457600080fd5b80633af9e669116102ce5780636752e7021161026c57806370a082311161023b57806370a082311461058d578063715018a6146105b657806373acee98146105be578063757212f0146105c657600080fd5b80636752e7021461055b57806369ab3250146105645780636c540baf1461056c5780636f307dc31461057557600080fd5b806344fe6ffe116102a857806344fe6ffe1461051957806347a0e3b11461052c57806347bd37181461053f5780635fe3b5671461054857600080fd5b80633af9e669146104f65780633b1d21a2146105095780633d9ea3a11461051157600080fd5b8063182df0f51161034657806323323e031161031557806323323e031461049e57806323b872dd146104b15780632608f818146104c4578063313ce567146104d757600080fd5b8063182df0f51461044557806319b1faef1461044d5780631be19560146104785780631c4469831461048b57600080fd5b80630e752702116103825780630e752702146103ff578063173b99041461042057806317bfdfbc1461042957806318160ddd1461043c57600080fd5b806306fdde03146103a957806307e27959146103c7578063095ea7b3146103dc575b600080fd5b6103b16107f5565b6040516103be9190613c11565b60405180910390f35b6103da6103d5366004613c44565b610883565b005b6103ef6103ea366004613c82565b6108da565b60405190151581526020016103be565b61041261040d366004613c44565b610948565b6040519081526020016103be565b610412609f5481565b610412610437366004613cae565b6109a2565b61041260a45481565b6104126109f7565b60ab54610460906001600160a01b031681565b6040516001600160a01b0390911681526020016103be565b6103da610486366004613cae565b610a06565b6103da610499366004613c44565b610b8d565b6104126104ac366004613c82565b610c9f565b6103ef6104bf366004613ccb565b610cf8565b6104126104d2366004613c82565b610d4a565b609a546104e49060ff1681565b60405160ff90911681526020016103be565b610412610504366004613cae565b610da5565b610412610deb565b6103ef600181565b6103da610527366004613ccb565b610df5565b6103da61053a366004613e36565b610fcf565b61041260a25481565b609c54610460906001600160a01b031681565b61041260a95481565b610412600081565b61041260a05481565b6097546104609061010090046001600160a01b031681565b61041261059b366004613cae565b6001600160a01b0316600090815260a6602052604090205490565b6103da6110f4565b610412611108565b6103da6105d4366004613c44565b611154565b6103da6105e7366004613c44565b611300565b6103da61133e565b610412610602366004613c44565b6113b8565b6103da610615366004613cae565b611411565b6103da610628366004613f29565b611445565b6103da61063b366004613cae565b611484565b6033546001600160a01b0316610460565b61041260a35481565b6103b1611559565b610412610670366004613cae565b611566565b610412610683366004613c44565b611577565b6104126115ba565b6103ef61069e366004613c82565b6117a7565b61041260a15481565b6104126117f8565b6103da6106c2366004613ccb565b611890565b60aa54610460906001600160a01b031681565b61041260a55481565b6104126118da565b6106fe6106f9366004613cae565b61192c565b6040805194855260208501939093529183015260608201526080016103be565b61041261072c366004613c44565b61196d565b61041261073f366004613c44565b6119af565b610412610752366004613f91565b6001600160a01b03918216600090815260a76020908152604080832093909416825291909152205490565b6065546001600160a01b0316610460565b6103da61079c366004613cae565b6119f3565b6103da6107af366004613c44565b611a56565b6103da6107c2366004613cae565b611b7d565b609d54610460906001600160a01b031681565b6104126107e8366004613fca565b611bee565b610412611c08565b609880546108029061400c565b80601f016020809104026020016040519081016040528092919081815260200182805461082e9061400c565b801561087b5780601f106108505761010080835404028352916020019161087b565b820191906000526020600020905b81548152906001019060200180831161085e57829003601f168201915b505050505081565b60975460ff166108ae5760405162461bcd60e51b81526004016108a590614046565b60405180910390fd5b6097805460ff191690556108c06115ba565b506108ca81611c5b565b506097805460ff19166001179055565b33600081815260a7602090815260408083206001600160a01b03871680855292528083208590555191929182907f8c5be1e5ebec7d5bd14f71427d1e84f3dd0314c0f7b2291e5b200ac8c7c3b925906109369087815260200190565b60405180910390a35060019392505050565b60975460009060ff1661096d5760405162461bcd60e51b81526004016108a590614046565b6097805460ff1916905561097f6115ba565b5061098b333384611db4565b50600090506097805460ff19166001179055919050565b60975460009060ff166109c75760405162461bcd60e51b81526004016108a590614046565b6097805460ff191690556109d96115ba565b506109e382611f16565b90506097805460ff19166001179055919050565b6000610a01611f6a565b905090565b6033546001600160a01b03163314610a785760405162461bcd60e51b815260206004820152602f60248201527f56546f6b656e3a3a7377656570546f6b656e3a206f6e6c792061646d696e206360448201526e616e20737765657020746f6b656e7360881b60648201526084016108a5565b6097546001600160a01b03610100909104811690821603610af65760405162461bcd60e51b815260206004820152603260248201527f56546f6b656e3a3a7377656570546f6b656e3a2063616e206e6f74207377656560448201527138103ab73232b9363cb4b733903a37b5b2b760711b60648201526084016108a5565b6040516370a0823160e01b81523060048201526000906001600160a01b038316906370a0823190602401602060405180830381865afa158015610b3d573d6000803e3d6000fd5b505050506040513d601f19601f82011682018060405250810190610b61919061406a565b9050610b89610b786033546001600160a01b031690565b6001600160a01b0384169083611fe3565b5050565b60975460ff16610baf5760405162461bcd60e51b81526004016108a590614046565b6097805460ff1916905560aa54604080516318c5e8ab60e01b81523360048201526024810191909152601960448201527f73657452657365727665466163746f722875696e74323536290000000000000060648201526000916001600160a01b0316906318c5e8ab90608401602060405180830381865afa158015610c38573d6000803e3d6000fd5b505050506040513d601f19601f82011682018060405250810190610c5c9190614083565b905080610c7c57604051631205b57b60e11b815260040160405180910390fd5b610c846115ba565b50610c8e8261204b565b50506097805460ff19166001179055565b60975460009060ff16610cc45760405162461bcd60e51b81526004016108a590614046565b6097805460ff19169055610cd66115ba565b50610ce23384846120d4565b5060006097805460ff1916600117905592915050565b60975460009060ff16610d1d5760405162461bcd60e51b81526004016108a590614046565b6097805460ff19169055610d333385858561225b565b5060016097805460ff191660011790559392505050565b60975460009060ff16610d6f5760405162461bcd60e51b81526004016108a590614046565b6097805460ff19169055610d816115ba565b50610d8d338484611db4565b50600090506097805460ff1916600117905592915050565b6000806040518060200160405280610dbb6118da565b90526001600160a01b038416600090815260a66020526040902054909150610de4908290612448565b9392505050565b6000610a01612460565b60975460ff16610e175760405162461bcd60e51b81526004016108a590614046565b6097805460ff19169055609c546001600160a01b03163314610e4c57604051632c40292560e01b815260040160405180910390fd5b6000610e5783611f16565b60a25490915060008315610ebe57610e6f86856124da565b9050610e7b81836140b6565b91507f1a2a22cb034d26d1854bdc6666a5b91fe25efbbb5dcad3b0355478d6f5c362a1868683600086604051610eb59594939291906140cd565b60405180910390a15b6000610eca82856140b6565b90508015610f905760a5546000610ee183836140fe565b9050610eed83866140b6565b60a582905594507f1a2a22cb034d26d1854bdc6666a5b91fe25efbbb5dcad3b0355478d6f5c362a1308985610f22818b6140b6565b89604051610f349594939291906140cd565b60405180910390a1604080516001600160a01b038a16815260208101859052908101839052606081018290527f90125ffdb441e57c4f6bf69789206424859f206bea5727f2d81ad2470826ef6a9060800160405180910390a150505b50506001600160a01b03909316600090815260a86020526040812090815560a15460019182015560a29390935550506097805460ff1916909117905550565b600054610100900460ff1615808015610fef5750600054600160ff909116105b806110095750303b158015611009575060005460ff166001145b61106c5760405162461bcd60e51b815260206004820152602e60248201527f496e697469616c697a61626c653a20636f6e747261637420697320616c72656160448201526d191e481a5b9a5d1a585b1a5e995960921b60648201526084016108a5565b6000805460ff19166001179055801561108f576000805461ff0019166101001790555b6110a18b8b8b8b8b8b8b8b8b8b6125e8565b80156110e7576000805461ff0019169055604051600181527f7f26b83ff96e1f2b6a682f133852f6798a09c465da95921460cefb38474024989060200160405180910390a15b5050505050505050505050565b6110fc612841565b611106600061289b565b565b60975460009060ff1661112d5760405162461bcd60e51b81526004016108a590614046565b6097805460ff1916905561113f6115ba565b505060a2546097805460ff1916600117905590565b60aa54604080516318c5e8ab60e01b81523360048201526024810191909152601e60448201527f73657450726f746f636f6c5365697a6553686172652875696e7432353629000060648201526000916001600160a01b0316906318c5e8ab90608401602060405180830381865afa1580156111d3573d6000803e3d6000fd5b505050506040513d601f19601f820116820180604052508101906111f79190614083565b905080611217576040516321433a4d60e01b815260040160405180910390fd5b609c5460408051634ada90af60e01b815290516000926001600160a01b031691634ada90af9160048083019260209291908290030181865afa158015611261573d6000803e3d6000fd5b505050506040513d601f19601f82011682018060405250810190611285919061406a565b90508061129a84670de0b6b3a76400006140fe565b11156112b95760405163034dd2c160e11b815260040160405180910390fd5b60a980549084905560408051828152602081018690527ff5815f353a60e815cce7553e4f60c533a59d26b1b5504ea4b6db8d60da3e4da2910160405180910390a150505050565b60975460ff166113225760405162461bcd60e51b81526004016108a590614046565b6097805460ff191690556113346115ba565b50610c8e816128b4565b60655433906001600160a01b031681146113ac5760405162461bcd60e51b815260206004820152602960248201527f4f776e61626c6532537465703a2063616c6c6572206973206e6f7420746865206044820152683732bb9037bbb732b960b91b60648201526084016108a5565b6113b58161289b565b50565b60975460009060ff166113dd5760405162461bcd60e51b81526004016108a590614046565b6097805460ff191690556113ef6115ba565b506113fc33600084612942565b5060006097805460ff19166001179055919050565b6033546001600160a01b0316331461143c5760405163d219dc1f60e01b815260040160405180910390fd5b6113b581612bc4565b609c546001600160a01b0316331461147057604051635c85a5e760e01b815260040160405180910390fd5b61147d8585858585612cd6565b5050505050565b60aa54604080516318c5e8ab60e01b81523360048201526024810191909152601d60448201527f736574496e746572657374526174654d6f64656c28616464726573732900000060648201526000916001600160a01b0316906318c5e8ab90608401602060405180830381865afa158015611503573d6000803e3d6000fd5b505050506040513d601f19601f820116820180604052508101906115279190614083565b9050806115475760405163407fded560e01b815260040160405180910390fd5b61154f6115ba565b50610b8982612db7565b609980546108029061400c565b600061157182611f16565b92915050565b60975460009060ff1661159c5760405162461bcd60e51b81526004016108a590614046565b6097805460ff191690556115ae6115ba565b506113fc3333846120d4565b60a05460009043908181036115d25760009250505090565b60006115dc612460565b60a25460a35460a154609d546040516315f2405360e01b81526004810186905260248101859052604481018490529495509293919290916000916001600160a01b0316906315f2405390606401602060405180830381865afa158015611646573d6000803e3d6000fd5b505050506040513d601f19601f8201168201806040525081019061166a919061406a565b905065048c273950008111156116c25760405162461bcd60e51b815260206004820152601c60248201527f626f72726f772072617465206973206162737572646c7920686967680000000060448201526064016108a5565b60006116ce87896140b6565b905060006116ea60405180602001604052808581525083612ef9565b905060006116f88288612448565b9050600061170688836140fe565b905060006117256040518060200160405280609f54815250848a612f2a565b9050600061173485898a612f2a565b60a08e905560a181905560a284905560a3839055604080518d815260208101879052908101829052606081018590529091507f4dec04e750ca11537cabcd8a9eab06494de08da3735bc8871cd41250e190bc049060800160405180910390a160009d505050505050505050505050505090565b60975460009060ff166117cc5760405162461bcd60e51b81526004016108a590614046565b6097805460ff191690556117e23380858561225b565b5060016097805460ff1916600117905592915050565b609d546000906001600160a01b031663b8168816611814612460565b60a25460a354609f546040516001600160e01b031960e087901b16815260048101949094526024840192909252604483015260648201526084015b602060405180830381865afa15801561186c573d6000803e3d6000fd5b505050506040513d601f19601f82011682018060405250810190610a01919061406a565b60975460ff166118b25760405162461bcd60e51b81526004016108a590614046565b6097805460ff191690556118c833848484612f4b565b50506097805460ff1916600117905550565b60975460009060ff166118ff5760405162461bcd60e51b81526004016108a590614046565b6097805460ff191690556119116115ba565b5061191a611f6a565b90506097805460ff1916600117905590565b6001600160a01b038116600090815260a66020526040812054819081908190819061195687611f16565b61195e611f6a565b93509350935093509193509193565b60975460009060ff166119925760405162461bcd60e51b81526004016108a590614046565b6097805460ff191690556119a46115ba565b506113fc3383613187565b60975460009060ff166119d45760405162461bcd60e51b81526004016108a590614046565b6097805460ff191690556119e66115ba565b506113fc33836000612942565b6033546001600160a01b03163314611a4d5760405162461bcd60e51b815260206004820152601e60248201527f6f6e6c792061646d696e2063616e207365742041434c2061646472657373000060448201526064016108a5565b6113b5816132f5565b60ab546001600160a01b03163314611ac45760405162461bcd60e51b815260206004820152602b60248201527f6f6e6c792073686f727466616c6c20636f6e74726163742063616e207570646160448201526a1d1948189859081919589d60aa1b60648201526084016108a5565b60a554811115611b285760405162461bcd60e51b815260206004820152602960248201527f6d6f7265207468616e206261642064656274207265636f76657265642066726f604482015268369030bab1ba34b7b760b91b60648201526084016108a5565b60a5546000611b3783836140b6565b60a581905560408051848152602081018390529192507f9e19ec7d2b8f8a94df8cc0072453ace318d221e3cbb2731d0eaa0baac856520f910160405180910390a1505050565b611b85612841565b606580546001600160a01b0383166001600160a01b03199091168117909155611bb66033546001600160a01b031690565b6001600160a01b03167f38d16b8cac22d99fc7c124b9cd0de2d3fa1faef420bfe791d8c362d765e2270060405160405180910390a350565b6000611bfe338585856000612cd6565b5060009392505050565b609d546000906001600160a01b03166315f24053611c24612460565b60a25460a3546040516001600160e01b031960e086901b16815260048101939093526024830191909152604482015260640161184f565b60004360a05414611c7f57604051630dff50cb60e41b815260040160405180910390fd5b81611c88612460565b1015611ca757604051633345e99960e01b815260040160405180910390fd5b60a354821115611cca576040516378d2980560e11b815260040160405180910390fd5b8160a354611cd891906140b6565b60a3819055609b54909150611cf6906001600160a01b03168361334f565b609b54609c5460975460405163aac59a7560e01b81526001600160a01b0392831660048201526101009091048216602482015291169063aac59a7590604401600060405180830381600087803b158015611d4f57600080fd5b505af1158015611d63573d6000803e3d6000fd5b5050609b546040517f3bad0c59cf2f06e7314077049f48a93578cd16f5ef92329f1dab1420a99c177e9350611da892506001600160a01b039091169085908590614116565b60405180910390a15050565b609c54604051630c2995e960e01b81523060048201526001600160a01b0385811660248301528481166044830152606482018490526000921690630c2995e990608401600060405180830381600087803b158015611e1157600080fd5b505af1158015611e25573d6000803e3d6000fd5b50505050611e304390565b60a05414611e515760405163c9021e2f60e01b815260040160405180910390fd5b6000611e5c84611f16565b90506000818411611e6d5783611e6f565b815b90506000611e7d87836124da565b90506000611e8b82856140b6565b905060008260a254611e9d91906140b6565b6001600160a01b038916600090815260a860205260409081902084815560a15460019091015560a2829055519091507f1a2a22cb034d26d1854bdc6666a5b91fe25efbbb5dcad3b0355478d6f5c362a190611f01908b908b908790879087906140cd565b60405180910390a15090979650505050505050565b6001600160a01b038116600090815260a86020526040812080548203611f3f5750600092915050565b60a1548154600091611f5091614137565b9050816001015481611f629190614156565b949350505050565b60a454600090808203611f7f575050609e5490565b6000611f89612460565b9050600060a35460a55460a25484611fa191906140fe565b611fab91906140fe565b611fb591906140b6565b9050600083611fcc670de0b6b3a764000084614137565b611fd69190614156565b95945050505050565b5090565b6040516001600160a01b03831660248201526044810182905261204690849063a9059cbb60e01b906064015b60408051601f198184030181529190526020810180516001600160e01b03166001600160e01b03199093169290921790915261336b565b505050565b4360a0541461206d57604051637dfca6b760e11b815260040160405180910390fd5b670de0b6b3a76400008111156120965760405163717220f360e11b815260040160405180910390fd5b609f80549082905560408051828152602081018490527faaa68312e2ea9d50e16af5068410ab56e1a1fd06037b1a35664812c30f8214609101611da8565b609c5460405163c0891ba960e01b81526001600160a01b039091169063c0891ba99061210890309086908690600401614178565b600060405180830381600087803b15801561212257600080fd5b505af1158015612136573d6000803e3d6000fd5b505050506121414390565b60a05414612162576040516338d8859760e01b815260040160405180910390fd5b60006040518060200160405280612177611f6a565b90529050600061218785846124da565b90506000612195828461343d565b90508060a4546121a591906140fe565b60a4556001600160a01b038516600090815260a660205260409020546121cc9082906140fe565b6001600160a01b038616600090815260a660205260409081902091909155517f4c209b5fc8ad50758f13e2e1088ba56a560dff690a1c6fef26394f4c03821c4f9061221c90879085908590614116565b60405180910390a16040518181526001600160a01b038616906000906000805160206142288339815191529060200160405180910390a3505050505050565b609c54604051636d0be88d60e01b81523060048201526001600160a01b03858116602483015284811660448301526064820184905290911690636d0be88d90608401600060405180830381600087803b1580156122b757600080fd5b505af11580156122cb573d6000803e3d6000fd5b50505050816001600160a01b0316836001600160a01b03160361230157604051638cd22d1960e01b815260040160405180910390fd5b6000836001600160a01b0316856001600160a01b031603612325575060001961234d565b506001600160a01b03808416600090815260a760209081526040808320938816835292905220545b600061235983836140b6565b6001600160a01b038616600090815260a66020526040812054919250906123819085906140b6565b6001600160a01b038616600090815260a66020526040812054919250906123a99086906140fe565b6001600160a01b03808916600090815260a6602052604080822086905591891681522081905590506000198414612403576001600160a01b03808816600090815260a760209081526040808320938c168352929052208390555b856001600160a01b0316876001600160a01b03166000805160206142288339815191528760405161243691815260200190565b60405180910390a35050505050505050565b6000806124558484612ef9565b9050611f628161345b565b6097546040516370a0823160e01b815230600482015260009161010090046001600160a01b03169081906370a0823190602401602060405180830381865afa1580156124b0573d6000803e3d6000fd5b505050506040513d601f19601f820116820180604052508101906124d4919061406a565b91505090565b6097546040516370a0823160e01b815230600482015260009161010090046001600160a01b031690829082906370a0823190602401602060405180830381865afa15801561252c573d6000803e3d6000fd5b505050506040513d601f19601f82011682018060405250810190612550919061406a565b90506125676001600160a01b038316863087613473565b6040516370a0823160e01b81523060048201526000906001600160a01b038416906370a0823190602401602060405180830381865afa1580156125ae573d6000803e3d6000fd5b505050506040513d601f19601f820116820180604052508101906125d2919061406a565b90506125de82826140b6565b9695505050505050565b600054610100900460ff1661260f5760405162461bcd60e51b81526004016108a59061419c565b61261761349a565b60a054158015612627575060a154155b61267f5760405162461bcd60e51b815260206004820152602360248201527f6d61726b6574206d6179206f6e6c7920626520696e697469616c697a6564206f6044820152626e636560e81b60648201526084016108a5565b612688826132f5565b609e879055866126f35760405162461bcd60e51b815260206004820152603060248201527f696e697469616c2065786368616e67652072617465206d75737420626520677260448201526f32b0ba32b9103a3430b7103d32b9379760811b60648201526084016108a5565b6126fc89612bc4565b4360a055670de0b6b3a764000060a15561271588612db7565b8551612728906098906020890190613b55565b50845161273c906099906020880190613b55565b50609a8054825160ab80546001600160a01b03199081166001600160a01b039384161790915560208086015160ff8a166001600160a81b031990951694909417610100948416850217909455604080860151609b80549093169084161790915566b1a2bc2ec5000060a95560978054610100600160a81b0319168f84168502179081905581516318160ddd60e01b81529151939004909116926318160ddd926004838101938290030181865afa1580156127fa573d6000803e3d6000fd5b505050506040513d601f19601f8201168201806040525081019061281e919061406a565b506097805460ff191660011790556128358361289b565b50505050505050505050565b6033546001600160a01b031633146111065760405162461bcd60e51b815260206004820181905260248201527f4f776e61626c653a2063616c6c6572206973206e6f7420746865206f776e657260448201526064016108a5565b606580546001600160a01b03191690556113b5816134c9565b600080804360a054146128dd576040516338acf79960e01b8152600481018290526024016108a5565b6128e733856124da565b90508060a3546128f791906140fe565b91508160a3819055507fa91e67c5ea634cd43a12c5a482724b03de01e85ca68702a53d0c2f45cb7c1dc533828460405161293393929190614116565b60405180910390a19392505050565b81158061294d575080155b6129b65760405162461bcd60e51b815260206004820152603460248201527f6f6e65206f662072656465656d546f6b656e73496e206f722072656465656d416044820152736d6f756e74496e206d757374206265207a65726f60601b60648201526084016108a5565b4360a054146129d8576040516397b5cfcd60e01b815260040160405180910390fd5b600060405180602001604052806129ed611f6a565b905290506000808415612a0e57849150612a078386612448565b9050612a1e565b612a18848461343d565b91508390505b81158015612a2c5750600081115b15612a6d5760405162461bcd60e51b815260206004820152601160248201527072656465656d546f6b656e73207a65726f60781b60448201526064016108a5565b609c54604051634732387560e11b81526001600160a01b0390911690638e6470ea90612aa19030908a908790600401614178565b600060405180830381600087803b158015612abb57600080fd5b505af1158015612acf573d6000803e3d6000fd5b5050505080612adc612460565b1015612afb576040516391240a1b60e01b815260040160405180910390fd5b8160a454612b0991906140b6565b60a4556001600160a01b038616600090815260a66020526040902054612b309083906140b6565b6001600160a01b038716600090815260a66020526040902055612b53868261334f565b60405182815230906001600160a01b038816906000805160206142288339815191529060200160405180910390a37fe5b754fb1abb7f01b499791d0b820ae3b6af3424ac1c59768edb53f4ec31a929868284604051612bb493929190614116565b60405180910390a1505050505050565b609c5460408051623f1ee960e11b815290516001600160a01b0392831692841691627e3dd29160048083019260209291908290030181865afa158015612c0e573d6000803e3d6000fd5b505050506040513d601f19601f82011682018060405250810190612c329190614083565b612c7e5760405162461bcd60e51b815260206004820152601c60248201527f6d61726b6572206d6574686f642072657475726e65642066616c73650000000060448201526064016108a5565b609c80546001600160a01b0319166001600160a01b0384811691821790925560408051928416835260208301919091527f7ac369dbd14fa5ea3f473ed67cc9d598964a77501540ba6751eb0b3decf5870d9101611da8565b60975460ff16612cf85760405162461bcd60e51b81526004016108a590614046565b6097805460ff19169055612d0a6115ba565b506000826001600160a01b031663a6afed956040518163ffffffff1660e01b81526004016020604051808303816000875af1158015612d4d573d6000803e3d6000fd5b505050506040513d601f19601f82011682018060405250810190612d71919061406a565b90508015612d9557604051633eea49b760e11b8152600481018290526024016108a5565b612da2868686868661351b565b50506097805460ff1916600117905550505050565b60004360a05414612ddb57604051630be2a5cb60e11b815260040160405180910390fd5b609d60009054906101000a90046001600160a01b03169050816001600160a01b0316632191f92a6040518163ffffffff1660e01b8152600401602060405180830381865afa158015612e31573d6000803e3d6000fd5b505050506040513d601f19601f82011682018060405250810190612e559190614083565b612ea15760405162461bcd60e51b815260206004820152601c60248201527f6d61726b6572206d6574686f642072657475726e65642066616c73650000000060448201526064016108a5565b609d80546001600160a01b0319166001600160a01b0384811691821790925560408051928416835260208301919091527fedffc32e068c7c95dfd4bdfd5c4d939a084d6b11c4199eac8436ed234d72f9269101611da8565b6040805160208101909152600081526040518060200160405280612f21856000015185613956565b90529392505050565b600080612f378585612ef9565b9050611fd6612f458261345b565b84613962565b609c54604051637666d5e360e11b81523060048201526001600160a01b03868116602483015285811660448301528481166064830152608482018490529091169063eccdabc69060a401600060405180830381600087803b158015612faf57600080fd5b505af1158015612fc3573d6000803e3d6000fd5b50505050826001600160a01b0316826001600160a01b031603612ff957604051633a94626760e11b815260040160405180910390fd5b600061301582604051806020016040528060a95481525061396e565b9050600061302382846140b6565b90506000604051806020016040528061303a611f6a565b90529050600061304a8285612448565b905060008160a35461305c91906140fe565b60a381905560a4549091506130729086906140b6565b60a4556001600160a01b038716600090815260a660205260409020546130999087906140b6565b6001600160a01b03808916600090815260a6602052604080822093909355908a16815220546130c99085906140fe565b6001600160a01b03808a16600081815260a6602052604090819020939093559151908916906000805160206142288339815191529061310b9088815260200190565b60405180910390a360405185815230906001600160a01b038916906000805160206142288339815191529060200160405180910390a37fa91e67c5ea634cd43a12c5a482724b03de01e85ca68702a53d0c2f45cb7c1dc530838360405161317493929190614116565b60405180910390a1505050505050505050565b609c5460405163df71403b60e01b81526001600160a01b039091169063df71403b906131bb90309086908690600401614178565b600060405180830381600087803b1580156131d557600080fd5b505af11580156131e9573d6000803e3d6000fd5b505050506131f44390565b60a0541461321557604051630e8d8c6160e21b815260040160405180910390fd5b8061321e612460565b101561323d576040516348c2588160e01b815260040160405180910390fd5b600061324883611f16565b9050600061325683836140fe565b905060008360a25461326891906140fe565b6001600160a01b038616600090815260a86020526040902083815560a15460019091015560a2819055905061329d858561334f565b604080516001600160a01b038716815260208101869052908101839052606081018290527f13ed6866d4e1ee6da46f845c46d7e54120883d75c5ea9a2dacc1c4ca8984ab809060800160405180910390a15050505050565b60aa80546001600160a01b038381166001600160a01b031983168117909355604080519190921680825260208201939093527f66fd58e82f7b31a2a5c30e0888f3093efe4e111b00cd2b0c31fe014601293aa09101611da8565b60975461010090046001600160a01b0316612046818484611fe3565b60006133c0826040518060400160405280602081526020017f5361666545524332303a206c6f772d6c6576656c2063616c6c206661696c6564815250856001600160a01b03166139919092919063ffffffff16565b80519091501561204657808060200190518101906133de9190614083565b6120465760405162461bcd60e51b815260206004820152602a60248201527f5361666545524332303a204552433230206f7065726174696f6e20646964206e6044820152691bdd081cdd58d8d9595960b21b60648201526084016108a5565b6000610de461345484670de0b6b3a7640000613956565b83516139a0565b805160009061157190670de0b6b3a764000090614156565b613494846323b872dd60e01b85858560405160240161200f93929190614178565b50505050565b600054610100900460ff166134c15760405162461bcd60e51b81526004016108a59061419c565b6111066139ac565b603380546001600160a01b038381166001600160a01b0319831681179093556040519116919082907f8be0079c531659141344cd1fd0a4f28419497f9722a3daafe3b4186f6b6457e090600090a35050565b609c54604051637eca7def60e01b81523060048201526001600160a01b038481166024830152878116604483015286811660648301526084820186905283151560a483015290911690637eca7def9060c401600060405180830381600087803b15801561358757600080fd5b505af115801561359b573d6000803e3d6000fd5b505050506135a64390565b60a054146135c7576040516380965b1b60e01b815260040160405180910390fd5b43826001600160a01b0316636c540baf6040518163ffffffff1660e01b8152600401602060405180830381865afa158015613606573d6000803e3d6000fd5b505050506040513d601f19601f8201168201806040525081019061362a919061406a565b1461364857604051631046f38d60e31b815260040160405180910390fd5b846001600160a01b0316846001600160a01b03160361367a57604051631bd1a62160e21b815260040160405180910390fd5b8260000361369b5760405163d29da7ef60e01b815260040160405180910390fd5b60001983036136bd57604051635982c5bb60e11b815260040160405180910390fd5b60006136ca868686611db4565b609c5460405163c488847b60e01b815291925060009182916001600160a01b03169063c488847b9061370490309089908890600401614178565b6040805180830381865afa158015613720573d6000803e3d6000fd5b505050506040513d601f19601f8201168201806040525081019061374491906141e7565b91509150600082146137b45760405162461bcd60e51b815260206004820152603360248201527f4c49515549444154455f434f4d5054524f4c4c45525f43414c43554c4154455f604482015272105353d5539517d4d152569157d19052531151606a1b60648201526084016108a5565b6040516370a0823160e01b81526001600160a01b0388811660048301528291908716906370a0823190602401602060405180830381865afa1580156137fd573d6000803e3d6000fd5b505050506040513d601f19601f82011682018060405250810190613821919061406a565b101561386f5760405162461bcd60e51b815260206004820152601860248201527f4c49515549444154455f5345495a455f544f4f5f4d554348000000000000000060448201526064016108a5565b306001600160a01b038616036138905761388b30898984612f4b565b6138f3565b60405163b2a02ff160e01b81526001600160a01b0386169063b2a02ff1906138c0908b908b908690600401614178565b600060405180830381600087803b1580156138da57600080fd5b505af11580156138ee573d6000803e3d6000fd5b505050505b604080516001600160a01b038a811682528981166020830152818301869052871660608201526080810183905290517f298637f684da70674f26509b10f07ec2fbc77a335ab1e7d6215a4b2484d8bb529181900360a00190a15050505050505050565b6000610de48284614137565b6000610de482846140fe565b6000670de0b6b3a7640000613987848460000151613956565b610de49190614156565b6060611f6284846000856139dc565b6000610de48284614156565b600054610100900460ff166139d35760405162461bcd60e51b81526004016108a59061419c565b6111063361289b565b606082471015613a3d5760405162461bcd60e51b815260206004820152602660248201527f416464726573733a20696e73756666696369656e742062616c616e636520666f6044820152651c8818d85b1b60d21b60648201526084016108a5565b600080866001600160a01b03168587604051613a59919061420b565b60006040518083038185875af1925050503d8060008114613a96576040519150601f19603f3d011682016040523d82523d6000602084013e613a9b565b606091505b5091509150613aac87838387613ab7565b979650505050505050565b60608315613b26578251600003613b1f576001600160a01b0385163b613b1f5760405162461bcd60e51b815260206004820152601d60248201527f416464726573733a2063616c6c20746f206e6f6e2d636f6e747261637400000060448201526064016108a5565b5081611f62565b611f628383815115613b3b5781518083602001fd5b8060405162461bcd60e51b81526004016108a59190613c11565b828054613b619061400c565b90600052602060002090601f016020900481019282613b835760008555613bc9565b82601f10613b9c57805160ff1916838001178555613bc9565b82800160010185558215613bc9579182015b82811115613bc9578251825591602001919060010190613bae565b50611fdf9291505b80821115611fdf5760008155600101613bd1565b60005b83811015613c00578181015183820152602001613be8565b838111156134945750506000910152565b6020815260008251806020840152613c30816040850160208701613be5565b601f01601f19169190910160400192915050565b600060208284031215613c5657600080fd5b5035919050565b6001600160a01b03811681146113b557600080fd5b8035613c7d81613c5d565b919050565b60008060408385031215613c9557600080fd5b8235613ca081613c5d565b946020939093013593505050565b600060208284031215613cc057600080fd5b8135610de481613c5d565b600080600060608486031215613ce057600080fd5b8335613ceb81613c5d565b92506020840135613cfb81613c5d565b929592945050506040919091013590565b634e487b7160e01b600052604160045260246000fd5b600082601f830112613d3357600080fd5b813567ffffffffffffffff80821115613d4e57613d4e613d0c565b604051601f8301601f19908116603f01168101908282118183101715613d7657613d76613d0c565b81604052838152866020858801011115613d8f57600080fd5b836020870160208301376000602085830101528094505050505092915050565b803560ff81168114613c7d57600080fd5b600060608284031215613dd257600080fd5b6040516060810181811067ffffffffffffffff82111715613df557613df5613d0c565b6040529050808235613e0681613c5d565b81526020830135613e1681613c5d565b60208201526040830135613e2981613c5d565b6040919091015292915050565b6000806000806000806000806000806101808b8d031215613e5657600080fd5b613e5f8b613c72565b9950613e6d60208c01613c72565b9850613e7b60408c01613c72565b975060608b0135965060808b013567ffffffffffffffff80821115613e9f57600080fd5b613eab8e838f01613d22565b975060a08d0135915080821115613ec157600080fd5b50613ece8d828e01613d22565b955050613edd60c08c01613daf565b9350613eeb60e08c01613c72565b9250613efa6101008c01613c72565b9150613f0a8c6101208d01613dc0565b90509295989b9194979a5092959850565b80151581146113b557600080fd5b600080600080600060a08688031215613f4157600080fd5b8535613f4c81613c5d565b94506020860135613f5c81613c5d565b9350604086013592506060860135613f7381613c5d565b91506080860135613f8381613f1b565b809150509295509295909350565b60008060408385031215613fa457600080fd5b8235613faf81613c5d565b91506020830135613fbf81613c5d565b809150509250929050565b600080600060608486031215613fdf57600080fd5b8335613fea81613c5d565b925060208401359150604084013561400181613c5d565b809150509250925092565b600181811c9082168061402057607f821691505b60208210810361404057634e487b7160e01b600052602260045260246000fd5b50919050565b6020808252600a90820152691c994b595b9d195c995960b21b604082015260600190565b60006020828403121561407c57600080fd5b5051919050565b60006020828403121561409557600080fd5b8151610de481613f1b565b634e487b7160e01b600052601160045260246000fd5b6000828210156140c8576140c86140a0565b500390565b6001600160a01b03958616815293909416602084015260408301919091526060820152608081019190915260a00190565b60008219821115614111576141116140a0565b500190565b6001600160a01b039390931683526020830191909152604082015260600190565b6000816000190483118215151615614151576141516140a0565b500290565b60008261417357634e487b7160e01b600052601260045260246000fd5b500490565b6001600160a01b039384168152919092166020820152604081019190915260600190565b6020808252602b908201527f496e697469616c697a61626c653a20636f6e7472616374206973206e6f74206960408201526a6e697469616c697a696e6760a81b606082015260800190565b600080604083850312156141fa57600080fd5b505080516020909101519092909150565b6000825161421d818460208701613be5565b919091019291505056feddf252ad1be2c89b69c2b068fc378daa952ba7f163c4a11628f55a4df523b3efa2646970667358221220fa1363b812bb2e7b47797b49218d2dee0a11a758b12f8a5c46bef3aa5aabfefe64736f6c634300080d0033",
  "devdoc": {
    "author": "Venus Dev Team",
    "kind": "dev",
    "methods": {
      "acceptOwnership()": {
        "details": "The new owner accepts the ownership transfer."
      },
      "accrueInterest()": {
        "custom:access": "Not restricted",
        "custom:events": "Emits AccrueInterest event on success",
        "details": "This calculates interest accrued from the last checkpointed block   up to the current block and writes new checkpoint to storage.",
        "returns": {
          "_0": "Always NO_ERROR"
        }
      },
      "addReserves(uint256)": {
        "custom:access": "Not restricted",
        "custom:events": "Emits ReservesAdded event; may emit AccrueInterest",
        "params": {
          "addAmount": "The amount fo underlying token to add as reserves"
        }
      },
      "allowance(address,address)": {
        "params": {
          "owner": "The address of the account which owns the tokens to be spent",
          "spender": "The address of the account which may transfer tokens"
        },
        "returns": {
          "_0": "amount The number of tokens allowed to be spent (-1 means infinite)"
        }
      },
      "approve(address,uint256)": {
        "custom:access": "Not restricted",
        "custom:events": "Emits Approval event",
        "details": "This will overwrite the approval amount for `spender`  and is subject to issues noted [here](https://eips.ethereum.org/EIPS/eip-20#approve)",
        "params": {
          "amount": "The number of tokens that are approved (uint256.max means infinite)",
          "spender": "The address of the account which may transfer tokens"
        },
        "returns": {
          "_0": "success Whether or not the approval succeeded"
        }
      },
      "badDebtRecovered(uint256)": {
        "custom:access": "Only Shortfall contract",
        "custom:events": "Emits BadDebtRecovered event",
        "details": "Called only when bad debt is recovered from auction",
        "params": {
          "recoveredAmount_": "The amount of bad debt recovered"
        }
      },
      "balanceOf(address)": {
        "params": {
          "owner": "The address of the account to query"
        },
        "returns": {
          "_0": "amount The number of tokens owned by `owner`"
        }
      },
      "balanceOfUnderlying(address)": {
        "details": "This also accrues interest in a transaction",
        "params": {
          "owner": "The address of the account to query"
        },
        "returns": {
          "_0": "amount The amount of underlying owned by `owner`"
        }
      },
      "borrow(uint256)": {
        "custom:access": "Not restricted",
        "custom:error": "BorrowCashNotAvailable is thrown when the protocol has insufficient cash",
        "custom:events": "Emits Borrow event; may emit AccrueInterest",
        "params": {
          "borrowAmount": "The amount of the underlying asset to borrow"
        },
        "returns": {
          "_0": "error Always NO_ERROR for compatilibily with Venus core tooling"
        }
      },
      "borrowBalanceCurrent(address)": {
        "params": {
          "account": "The address whose balance should be calculated after updating borrowIndex"
        },
        "returns": {
          "_0": "borrowBalance The calculated balance"
        }
      },
      "borrowBalanceStored(address)": {
        "params": {
          "account": "The address whose balance should be calculated"
        },
        "returns": {
          "_0": "borrowBalance The calculated balance"
        }
      },
      "borrowRatePerBlock()": {
        "returns": {
          "_0": "rate The borrow interest rate per block, scaled by 1e18"
        }
      },
      "constructor": {
        "custom:oz-upgrades-unsafe-allow": "constructor"
      },
      "exchangeRateCurrent()": {
        "returns": {
          "_0": "exchangeRate Calculated exchange rate scaled by 1e18"
        }
      },
      "exchangeRateStored()": {
        "details": "This function does not accrue interest before calculating the exchange rate",
        "returns": {
          "_0": "exchangeRate Calculated exchange rate scaled by 1e18"
        }
      },
      "forceLiquidateBorrow(address,address,uint256,address,bool)": {
        "custom:access": "Only Comptroller",
        "custom:error": "ForceLiquidateBorrowUnauthorized is thrown when the request does not come from ComptrollerLiquidateAccrueCollateralInterestFailed is thrown when it is not possible to accrue interest on the collateral vTokenLiquidateCollateralFreshnessCheck is thrown when interest has not been accrued on the collateral vTokenLiquidateLiquidatorIsBorrower is thrown when trying to liquidate selfLiquidateCloseAmountIsZero is thrown when repayment amount is zeroLiquidateCloseAmountIsUintMax is thrown when repayment amount is UINT_MAX",
        "custom:events": "Emits LiquidateBorrow event; may emit AccrueInterest",
        "params": {
          "borrower": "The borrower of this vToken to be liquidated",
          "liquidator": "The address repaying the borrow and seizing collateral",
          "repayAmount": "The amount of the underlying borrowed asset to repay",
          "skipLiquidityCheck": "If set to true, allows to liquidate up to 100% of the borrow   regardless of the account liquidity",
          "vTokenCollateral": "The market in which to seize collateral from the borrower"
        }
      },
      "getAccountSnapshot(address)": {
        "details": "This is used by comptroller to more efficiently perform liquidity checks.",
        "params": {
          "account": "Address of the account to snapshot"
        },
        "returns": {
          "borrowBalance": "Amount owed in terms of underlying",
          "error": "Always NO_ERROR for compatilibily with Venus core tooling",
          "exchangeRate": "Stored exchange rate",
          "vTokenBalance": "User's balance of vTokens"
        }
      },
      "getCash()": {
        "returns": {
          "_0": "cash The quantity of underlying asset owned by this contract"
        }
      },
      "healBorrow(address,address,uint256)": {
        "custom:access": "Only Comptroller",
        "custom:error": "HealBorrowUnauthorized is thrown when the request does not come from Comptroller",
        "custom:events": "Emits RepayBorrow, BadDebtIncreased events; may emit AccrueInterest",
        "details": "This function does not call any Comptroller hooks (like \"healAllowed\"), because we assume   the Comptroller does all the necessary checks before calling this function.",
        "params": {
          "borrower": "account to heal",
          "payer": "account who repays the debt",
          "repayAmount": "amount to repay"
        }
      },
      "initialize(address,address,address,uint256,string,string,uint8,address,address,(address,address,address))": {
        "params": {
          "admin_": "Address of the administrator of this token",
          "comptroller_": "The address of the Comptroller",
          "decimals_": "ERC-20 decimal precision of this token",
          "initialExchangeRateMantissa_": "The initial exchange rate, scaled by 1e18",
          "interestRateModel_": "The address of the interest rate model",
          "name_": "ERC-20 name of this token",
          "riskManagement": "Addresses of risk fund contracts",
          "symbol_": "ERC-20 symbol of this token",
          "underlying_": "The address of the underlying asset"
        }
      },
      "liquidateBorrow(address,uint256,address)": {
        "custom:access": "Not restricted",
        "custom:error": "LiquidateAccrueCollateralInterestFailed is thrown when it is not possible to accrue interest on the collateral vTokenLiquidateCollateralFreshnessCheck is thrown when interest has not been accrued on the collateral vTokenLiquidateLiquidatorIsBorrower is thrown when trying to liquidate selfLiquidateCloseAmountIsZero is thrown when repayment amount is zeroLiquidateCloseAmountIsUintMax is thrown when repayment amount is UINT_MAX",
        "custom:events": "Emits LiquidateBorrow event; may emit AccrueInterest",
        "params": {
          "borrower": "The borrower of this vToken to be liquidated",
          "repayAmount": "The amount of the underlying borrowed asset to repay",
          "vTokenCollateral": "The market in which to seize collateral from the borrower"
        },
        "returns": {
          "_0": "error Always NO_ERROR for compatilibily with Venus core tooling"
        }
      },
      "mint(uint256)": {
        "custom:access": "Not restricted",
        "custom:events": "Emits Mint and Transfer events; may emit AccrueInterest",
        "details": "Accrues interest whether or not the operation succeeds, unless reverted",
        "params": {
          "mintAmount": "The amount of the underlying asset to supply"
        },
        "returns": {
          "_0": "error Always NO_ERROR for compatilibily with Venus core tooling"
        }
      },
      "mintBehalf(address,uint256)": {
        "custom:access": "Not restricted",
        "custom:events": "Emits Mint and Transfer events; may emit AccrueInterest",
        "details": "Accrues interest whether or not the operation succeeds, unless reverted",
        "params": {
          "mintAmount": "The amount of the underlying asset to supply"
        },
        "returns": {
          "_0": "error Always NO_ERROR for compatilibily with Venus core tooling"
        }
      },
      "owner()": {
        "details": "Returns the address of the current owner."
      },
      "pendingOwner()": {
        "details": "Returns the address of the pending owner."
      },
      "redeem(uint256)": {
        "custom:access": "Not restricted",
        "custom:error": "RedeemTransferOutNotPossible is thrown when the protocol has insufficient cash",
        "custom:events": "Emits Redeem and Transfer events; may emit AccrueInterest",
        "details": "Accrues interest whether or not the operation succeeds, unless reverted",
        "params": {
          "redeemTokens": "The number of vTokens to redeem into underlying"
        },
        "returns": {
          "_0": "error Always NO_ERROR for compatilibily with Venus core tooling"
        }
      },
      "redeemUnderlying(uint256)": {
        "details": "Accrues interest whether or not the operation succeeds, unless reverted",
        "params": {
          "redeemAmount": "The amount of underlying to receive from redeeming vTokens"
        },
        "returns": {
          "_0": "error Always NO_ERROR for compatilibily with Venus core tooling"
        }
      },
      "reduceReserves(uint256)": {
        "custom:access": "Not restricted",
        "custom:error": "ReduceReservesCashNotAvailable is thrown when the vToken does not have sufficient cashReduceReservesCashValidation is thrown when trying to withdraw more cash than the reserves have",
        "custom:events": "Emits ReservesReduced event; may emit AccrueInterest",
        "params": {
          "reduceAmount": "Amount of reduction to reserves"
        }
      },
      "renounceOwnership()": {
        "details": "Leaves the contract without owner. It will not be possible to call `onlyOwner` functions anymore. Can only be called by the current owner. NOTE: Renouncing ownership will leave the contract without an owner, thereby removing any functionality that is only available to the owner."
      },
      "repayBorrow(uint256)": {
        "custom:access": "Not restricted",
        "custom:events": "Emits RepayBorrow event; may emit AccrueInterest",
        "params": {
          "repayAmount": "The amount to repay, or -1 for the full outstanding amount"
        },
        "returns": {
          "_0": "error Always NO_ERROR for compatilibily with Venus core tooling"
        }
      },
      "repayBorrowBehalf(address,uint256)": {
        "custom:access": "Not restricted",
        "custom:events": "Emits RepayBorrow event; may emit AccrueInterest",
        "params": {
          "borrower": "the account with the debt being payed off",
          "repayAmount": "The amount to repay, or -1 for the full outstanding amount"
        },
        "returns": {
          "_0": "error Always NO_ERROR for compatilibily with Venus core tooling"
        }
      },
      "seize(address,address,uint256)": {
        "custom:access": "Not restricted",
        "custom:error": "LiquidateSeizeLiquidatorIsBorrower is thrown when trying to liquidate self",
        "custom:events": "Emits Transfer, ReservesAdded events",
        "details": "Will fail unless called by another vToken during the process of liquidation.  Its absolutely critical to use msg.sender as the borrowed vToken and not a parameter.",
        "params": {
          "borrower": "The account having collateral seized",
          "liquidator": "The account receiving seized collateral",
          "seizeTokens": "The number of vTokens to seize"
        }
      },
      "setAccessControlAddress(address)": {
        "custom:access": "Only Governance",
        "custom:events": "Emits NewAccessControlManager event",
        "details": "Admin function to set address of AccessControlManager",
        "params": {
          "newAccessControlManager": "The new address of the AccessControlManager"
        }
      },
      "setComptroller(address)": {
        "custom:access": "Only Governance",
        "custom:error": "SetComptrollerOwnerCheck is thrown when the call is not from owner",
        "custom:events": "Emits NewComptroller event",
        "details": "Admin function to set a new comptroller"
      },
      "setInterestRateModel(address)": {
        "custom:access": "Controlled by AccessControlManager",
        "custom:error": "SetInterestRateModelOwnerCheck is thrown when the call is not authorized by AccessControlManager",
        "custom:events": "Emits NewMarketInterestRateModel event; may emit AccrueInterest",
        "details": "Admin function to accrue interest and update the interest rate model",
        "params": {
          "newInterestRateModel": "the new interest rate model to use"
        }
      },
      "setProtocolSeizeShare(uint256)": {
        "custom:access": "Controlled by AccessControlManager",
        "custom:error": "SetProtocolSeizeShareUnauthorized is thrown when the call is not authorized by AccessControlManagerProtocolSeizeShareTooBig is thrown when the new seize share is too high",
        "custom:events": "Emits NewProtocolSeizeShare event on success",
        "details": "must be less than liquidation incentive - 1",
        "params": {
          "newProtocolSeizeShareMantissa_": "new protocol share mantissa"
        }
      },
      "setReserveFactor(uint256)": {
        "custom:access": "Controlled by AccessControlManager",
        "custom:error": "SetReserveFactorAdminCheck is thrown when the call is not authorized by AccessControlManagerSetReserveFactorBoundsCheck is thrown when the new reserve factor is too high",
        "custom:events": "Emits NewReserveFactor event; may emit AccrueInterest",
        "details": "Admin function to accrue interest and set a new reserve factor"
      },
      "supplyRatePerBlock()": {
        "returns": {
          "_0": "rate The supply interest rate per block, scaled by 1e18"
        }
      },
      "sweepToken(address)": {
        "custom:access": "Only Governance",
        "params": {
          "token": "The address of the ERC-20 token to sweep"
        }
      },
      "totalBorrowsCurrent()": {
        "returns": {
          "_0": "totalBorrows The total borrows with interest"
        }
      },
      "transfer(address,uint256)": {
        "custom:access": "Not restricted",
        "custom:error": "TransferNotAllowed is thrown if trying to transfer to self",
        "custom:events": "Emits Transfer event on success",
        "params": {
          "amount": "The number of tokens to transfer",
          "dst": "The address of the destination account"
        },
        "returns": {
          "_0": "success True if the transfer suceeded, reverts otherwise"
        }
      },
      "transferFrom(address,address,uint256)": {
        "custom:access": "Not restricted",
        "custom:error": "TransferNotAllowed is thrown if trying to transfer to self",
        "custom:events": "Emits Transfer event on success",
        "params": {
          "amount": "The number of tokens to transfer",
          "dst": "The address of the destination account",
          "src": "The address of the source account"
        },
        "returns": {
          "_0": "success True if the transfer suceeded, reverts otherwise"
        }
      },
      "transferOwnership(address)": {
        "details": "Starts the ownership transfer of the contract to a new account. Replaces the pending transfer if there is one. Can only be called by the current owner."
      }
    },
    "title": "Venus VToken Contract",
    "version": 1
  },
  "userdoc": {
    "events": {
      "AccrueInterest(uint256,uint256,uint256,uint256)": {
        "notice": "Event emitted when interest is accrued"
      },
      "Approval(address,address,uint256)": {
        "notice": "EIP20 Approval event"
      },
      "BadDebtIncreased(address,uint256,uint256,uint256)": {
        "notice": "Event emitted when bad debt is accumulated on a market"
      },
      "BadDebtRecovered(uint256,uint256)": {
        "notice": "Event emitted when bad debt is recovered via an auction"
      },
      "Borrow(address,uint256,uint256,uint256)": {
        "notice": "Event emitted when underlying is borrowed"
      },
      "LiquidateBorrow(address,address,uint256,address,uint256)": {
        "notice": "Event emitted when a borrow is liquidated"
      },
      "Mint(address,uint256,uint256)": {
        "notice": "Event emitted when tokens are minted"
      },
      "NewAccessControlManager(address,address)": {
        "notice": "Event emitted when comptroller is changed"
      },
      "NewComptroller(address,address)": {
        "notice": "Event emitted when comptroller is changed"
      },
      "NewMarketInterestRateModel(address,address)": {
        "notice": "Event emitted when interestRateModel is changed"
      },
      "NewProtocolSeizeShare(uint256,uint256)": {
        "notice": "Event emitted when protocol seize share is changed"
      },
      "NewReserveFactor(uint256,uint256)": {
        "notice": "Event emitted when the reserve factor is changed"
      },
      "Redeem(address,uint256,uint256)": {
        "notice": "Event emitted when tokens are redeemed"
      },
      "RepayBorrow(address,address,uint256,uint256,uint256)": {
        "notice": "Event emitted when a borrow is repaid"
      },
      "ReservesAdded(address,uint256,uint256)": {
        "notice": "Event emitted when the reserves are added"
      },
      "ReservesReduced(address,uint256,uint256)": {
        "notice": "Event emitted when the reserves are reduced"
      },
      "Transfer(address,address,uint256)": {
        "notice": "EIP20 Transfer event"
      }
    },
    "kind": "user",
    "methods": {
      "accessControlManager()": {
        "notice": "Storage of AccessControlManager"
      },
      "accrualBlockNumber()": {
        "notice": "Block number that interest was last accrued at"
      },
      "accrueInterest()": {
        "notice": "Applies accrued interest to total borrows and reserves"
      },
      "addReserves(uint256)": {
        "notice": "The sender adds to reserves."
      },
      "allowance(address,address)": {
        "notice": "Get the current allowance from `owner` for `spender`"
      },
      "approve(address,uint256)": {
        "notice": "Approve `spender` to transfer up to `amount` from `src`"
      },
      "badDebt()": {
        "notice": "Total bad debt of the market"
      },
      "badDebtRecovered(uint256)": {
        "notice": "Updates bad debt"
      },
      "balanceOf(address)": {
        "notice": "Get the token balance of the `owner`"
      },
      "balanceOfUnderlying(address)": {
        "notice": "Get the underlying balance of the `owner`"
      },
      "borrow(uint256)": {
        "notice": "Sender borrows assets from the protocol to their own address"
      },
      "borrowBalanceCurrent(address)": {
        "notice": "Accrue interest to updated borrowIndex and then calculate account's borrow balance using the updated borrowIndex"
      },
      "borrowBalanceStored(address)": {
        "notice": "Return the borrow balance of account based on stored data"
      },
      "borrowIndex()": {
        "notice": "Accumulator of the total earned interest rate since the opening of the market"
      },
      "borrowRatePerBlock()": {
        "notice": "Returns the current per-block borrow interest rate for this vToken"
      },
      "comptroller()": {
        "notice": "Contract which oversees inter-vToken operations"
      },
      "decimals()": {
        "notice": "EIP-20 token decimals for this token"
      },
      "exchangeRateCurrent()": {
        "notice": "Accrue interest then return the up-to-date exchange rate"
      },
      "exchangeRateStored()": {
        "notice": "Calculates the exchange rate from the underlying to the VToken"
      },
      "forceLiquidateBorrow(address,address,uint256,address,bool)": {
        "notice": "The extended version of liquidations, callable only by Comptroller. May skip  the close factor check. The collateral seized is transferred to the liquidator."
      },
      "getAccountSnapshot(address)": {
        "notice": "Get a snapshot of the account's balances, and the cached exchange rate"
      },
      "getCash()": {
        "notice": "Get cash balance of this vToken in the underlying asset"
      },
      "healBorrow(address,address,uint256)": {
        "notice": "Repays a certain amount of debt, treats the rest of the borrow as bad debt, essentially   \"forgiving\" the borrower. Healing is a situation that should rarely happen. However, some pools   may list risky assets or be configured improperly  we want to still handle such cases gracefully.   We assume that Comptroller does the seizing, so this function is only available to Comptroller."
      },
      "initialize(address,address,address,uint256,string,string,uint8,address,address,(address,address,address))": {
        "notice": "Construct a new money market"
      },
      "interestRateModel()": {
        "notice": "Model which tells what the current interest rate should be"
      },
      "isVToken()": {
        "notice": "Indicator that this is a VToken contract (for inspection)"
      },
      "liquidateBorrow(address,uint256,address)": {
        "notice": "The sender liquidates the borrowers collateral.  The collateral seized is transferred to the liquidator."
      },
      "mint(uint256)": {
        "notice": "Sender supplies assets into the market and receives vTokens in exchange"
      },
      "mintBehalf(address,uint256)": {
        "notice": "Sender calls on-behalf of minter. minter supplies assets into the market and receives vTokens in exchange"
      },
      "name()": {
        "notice": "EIP-20 token name for this token"
      },
      "protocolSeizeShareMantissa()": {
        "notice": "Share of seized collateral that is added to reserves"
      },
      "redeem(uint256)": {
        "notice": "Sender redeems vTokens in exchange for the underlying asset"
      },
      "redeemUnderlying(uint256)": {
        "notice": "Sender redeems vTokens in exchange for a specified amount of underlying asset"
      },
      "reduceReserves(uint256)": {
        "notice": "Accrues interest and reduces reserves by transferring to the protocol reserve contract"
      },
      "repayBorrow(uint256)": {
        "notice": "Sender repays their own borrow"
      },
      "repayBorrowBehalf(address,uint256)": {
        "notice": "Sender repays a borrow belonging to borrower"
      },
      "reserveFactorMantissa()": {
        "notice": "Fraction of interest currently set aside for reserves"
      },
      "seize(address,address,uint256)": {
        "notice": "Transfers collateral tokens (this market) to the liquidator."
      },
      "setAccessControlAddress(address)": {
        "notice": "Sets the address of AccessControlManager"
      },
      "setComptroller(address)": {
        "notice": "Sets a new comptroller for the market"
      },
      "setInterestRateModel(address)": {
        "notice": "accrues interest and updates the interest rate model using _setInterestRateModelFresh"
      },
      "setProtocolSeizeShare(uint256)": {
        "notice": "sets protocol share accumulated from liquidations"
      },
      "setReserveFactor(uint256)": {
        "notice": "accrues interest and sets a new reserve factor for the protocol using _setReserveFactorFresh"
      },
      "shortfall()": {
        "notice": "Storage of Shortfall contract address"
      },
      "supplyRatePerBlock()": {
        "notice": "Returns the current per-block supply interest rate for this v"
      },
      "sweepToken(address)": {
        "notice": "A public function to sweep accidental ERC-20 transfers to this contract. Tokens are sent to admin (timelock)"
      },
      "symbol()": {
        "notice": "EIP-20 token symbol for this token"
      },
      "totalBorrows()": {
        "notice": "Total amount of outstanding borrows of the underlying in this market"
      },
      "totalBorrowsCurrent()": {
        "notice": "Returns the current total borrows plus accrued interest"
      },
      "totalReserves()": {
        "notice": "Total amount of reserves of the underlying held in this market"
      },
      "totalSupply()": {
        "notice": "Total number of tokens in circulation"
      },
      "transfer(address,uint256)": {
        "notice": "Transfer `amount` tokens from `msg.sender` to `dst`"
      },
      "transferFrom(address,address,uint256)": {
        "notice": "Transfer `amount` tokens from `src` to `dst`"
      },
      "underlying()": {
        "notice": "Underlying asset for this VToken"
      }
    },
    "version": 1
  },
  "storageLayout": {
    "storage": [
      {
        "astId": 324,
        "contract": "contracts/VToken.sol:VToken",
        "label": "_initialized",
        "offset": 0,
        "slot": "0",
        "type": "t_uint8"
      },
      {
        "astId": 327,
        "contract": "contracts/VToken.sol:VToken",
        "label": "_initializing",
        "offset": 1,
        "slot": "0",
        "type": "t_bool"
      },
      {
        "astId": 1279,
        "contract": "contracts/VToken.sol:VToken",
        "label": "__gap",
        "offset": 0,
        "slot": "1",
        "type": "t_array(t_uint256)50_storage"
      },
      {
        "astId": 116,
        "contract": "contracts/VToken.sol:VToken",
        "label": "_owner",
        "offset": 0,
        "slot": "51",
        "type": "t_address"
      },
      {
        "astId": 236,
        "contract": "contracts/VToken.sol:VToken",
        "label": "__gap",
        "offset": 0,
        "slot": "52",
        "type": "t_array(t_uint256)49_storage"
      },
      {
        "astId": 25,
        "contract": "contracts/VToken.sol:VToken",
        "label": "_pendingOwner",
        "offset": 0,
        "slot": "101",
        "type": "t_address"
      },
      {
        "astId": 104,
        "contract": "contracts/VToken.sol:VToken",
        "label": "__gap",
        "offset": 0,
        "slot": "102",
        "type": "t_array(t_uint256)49_storage"
      },
      {
        "astId": 17456,
        "contract": "contracts/VToken.sol:VToken",
        "label": "_notEntered",
        "offset": 0,
        "slot": "151",
        "type": "t_bool"
      },
      {
        "astId": 17459,
        "contract": "contracts/VToken.sol:VToken",
        "label": "underlying",
        "offset": 1,
        "slot": "151",
        "type": "t_address"
      },
      {
        "astId": 17462,
        "contract": "contracts/VToken.sol:VToken",
        "label": "name",
        "offset": 0,
        "slot": "152",
        "type": "t_string_storage"
      },
      {
        "astId": 17465,
        "contract": "contracts/VToken.sol:VToken",
        "label": "symbol",
        "offset": 0,
        "slot": "153",
        "type": "t_string_storage"
      },
      {
        "astId": 17468,
        "contract": "contracts/VToken.sol:VToken",
        "label": "decimals",
        "offset": 0,
        "slot": "154",
        "type": "t_uint8"
      },
      {
        "astId": 17471,
        "contract": "contracts/VToken.sol:VToken",
        "label": "riskFund",
        "offset": 1,
        "slot": "154",
        "type": "t_address_payable"
      },
      {
        "astId": 17474,
        "contract": "contracts/VToken.sol:VToken",
        "label": "protocolShareReserve",
        "offset": 0,
        "slot": "155",
        "type": "t_address_payable"
      },
      {
        "astId": 17484,
        "contract": "contracts/VToken.sol:VToken",
        "label": "comptroller",
        "offset": 0,
        "slot": "156",
        "type": "t_contract(ComptrollerInterface)8193"
      },
      {
        "astId": 17488,
        "contract": "contracts/VToken.sol:VToken",
        "label": "interestRateModel",
        "offset": 0,
        "slot": "157",
        "type": "t_contract(InterestRateModel)9481"
      },
      {
        "astId": 17490,
        "contract": "contracts/VToken.sol:VToken",
        "label": "initialExchangeRateMantissa",
        "offset": 0,
        "slot": "158",
        "type": "t_uint256"
      },
      {
        "astId": 17493,
        "contract": "contracts/VToken.sol:VToken",
        "label": "reserveFactorMantissa",
        "offset": 0,
        "slot": "159",
        "type": "t_uint256"
      },
      {
        "astId": 17496,
        "contract": "contracts/VToken.sol:VToken",
        "label": "accrualBlockNumber",
        "offset": 0,
        "slot": "160",
        "type": "t_uint256"
      },
      {
        "astId": 17499,
        "contract": "contracts/VToken.sol:VToken",
        "label": "borrowIndex",
        "offset": 0,
        "slot": "161",
        "type": "t_uint256"
      },
      {
        "astId": 17502,
        "contract": "contracts/VToken.sol:VToken",
        "label": "totalBorrows",
        "offset": 0,
        "slot": "162",
        "type": "t_uint256"
      },
      {
        "astId": 17505,
        "contract": "contracts/VToken.sol:VToken",
        "label": "totalReserves",
        "offset": 0,
        "slot": "163",
        "type": "t_uint256"
      },
      {
        "astId": 17508,
        "contract": "contracts/VToken.sol:VToken",
        "label": "totalSupply",
        "offset": 0,
        "slot": "164",
        "type": "t_uint256"
      },
      {
        "astId": 17511,
        "contract": "contracts/VToken.sol:VToken",
        "label": "badDebt",
        "offset": 0,
        "slot": "165",
        "type": "t_uint256"
      },
      {
        "astId": 17515,
        "contract": "contracts/VToken.sol:VToken",
        "label": "accountTokens",
        "offset": 0,
        "slot": "166",
        "type": "t_mapping(t_address,t_uint256)"
      },
      {
        "astId": 17521,
        "contract": "contracts/VToken.sol:VToken",
        "label": "transferAllowances",
        "offset": 0,
        "slot": "167",
        "type": "t_mapping(t_address,t_mapping(t_address,t_uint256))"
      },
      {
        "astId": 17531,
        "contract": "contracts/VToken.sol:VToken",
        "label": "accountBorrows",
        "offset": 0,
        "slot": "168",
        "type": "t_mapping(t_address,t_struct(BorrowSnapshot)17526_storage)"
      },
      {
        "astId": 17534,
        "contract": "contracts/VToken.sol:VToken",
        "label": "protocolSeizeShareMantissa",
        "offset": 0,
        "slot": "169",
        "type": "t_uint256"
      },
      {
        "astId": 17538,
        "contract": "contracts/VToken.sol:VToken",
        "label": "accessControlManager",
        "offset": 0,
        "slot": "170",
        "type": "t_contract(AccessControlManager)9427"
      },
      {
        "astId": 17541,
        "contract": "contracts/VToken.sol:VToken",
        "label": "shortfall",
        "offset": 0,
        "slot": "171",
        "type": "t_address"
      }
    ],
    "types": {
      "t_address": {
        "encoding": "inplace",
        "label": "address",
        "numberOfBytes": "20"
      },
      "t_address_payable": {
        "encoding": "inplace",
        "label": "address payable",
        "numberOfBytes": "20"
      },
      "t_array(t_uint256)49_storage": {
        "base": "t_uint256",
        "encoding": "inplace",
        "label": "uint256[49]",
        "numberOfBytes": "1568"
      },
      "t_array(t_uint256)50_storage": {
        "base": "t_uint256",
        "encoding": "inplace",
        "label": "uint256[50]",
        "numberOfBytes": "1600"
      },
      "t_bool": {
        "encoding": "inplace",
        "label": "bool",
        "numberOfBytes": "1"
      },
      "t_contract(AccessControlManager)9427": {
        "encoding": "inplace",
        "label": "contract AccessControlManager",
        "numberOfBytes": "20"
      },
      "t_contract(ComptrollerInterface)8193": {
        "encoding": "inplace",
        "label": "contract ComptrollerInterface",
        "numberOfBytes": "20"
      },
      "t_contract(InterestRateModel)9481": {
        "encoding": "inplace",
        "label": "contract InterestRateModel",
        "numberOfBytes": "20"
      },
      "t_mapping(t_address,t_mapping(t_address,t_uint256))": {
        "encoding": "mapping",
        "key": "t_address",
        "label": "mapping(address => mapping(address => uint256))",
        "numberOfBytes": "32",
        "value": "t_mapping(t_address,t_uint256)"
      },
      "t_mapping(t_address,t_struct(BorrowSnapshot)17526_storage)": {
        "encoding": "mapping",
        "key": "t_address",
        "label": "mapping(address => struct VTokenStorage.BorrowSnapshot)",
        "numberOfBytes": "32",
        "value": "t_struct(BorrowSnapshot)17526_storage"
      },
      "t_mapping(t_address,t_uint256)": {
        "encoding": "mapping",
        "key": "t_address",
        "label": "mapping(address => uint256)",
        "numberOfBytes": "32",
        "value": "t_uint256"
      },
      "t_string_storage": {
        "encoding": "bytes",
        "label": "string",
        "numberOfBytes": "32"
      },
      "t_struct(BorrowSnapshot)17526_storage": {
        "encoding": "inplace",
        "label": "struct VTokenStorage.BorrowSnapshot",
        "members": [
          {
            "astId": 17523,
            "contract": "contracts/VToken.sol:VToken",
            "label": "principal",
            "offset": 0,
            "slot": "0",
            "type": "t_uint256"
          },
          {
            "astId": 17525,
            "contract": "contracts/VToken.sol:VToken",
            "label": "interestIndex",
            "offset": 0,
            "slot": "1",
            "type": "t_uint256"
          }
        ],
        "numberOfBytes": "64"
      },
      "t_uint256": {
        "encoding": "inplace",
        "label": "uint256",
        "numberOfBytes": "32"
      },
      "t_uint8": {
        "encoding": "inplace",
        "label": "uint8",
        "numberOfBytes": "1"
      }
    }
  }
}